tags,context,found_helpful_data-review_yes_count,found_helpful_data-review_total_count,recommendation,review,reviewed_on,is_online_consult,recommends,patient_name,reply_text,replied_at,replier_name
"Treatment satisfaction,","Newborn Jaundice,Children's Health,Paediatric Critical Care,",0,0,YES,"We couldn’t have had a better healthcare experience than at Rainbow Hospital - Vikrampuri with Dr. Akheel Rizwan for over 6 yrs now! My child is always treated so well and the experience with Dr. Akheel is amazing.

I would like to take this opportunity to sincerely thank him for his kindness and concern.

My wife and I are a big fan of Dr. Akheel Rizwan for his extra ordinary diagnosis & treatment ability at the first go.",2019-12-28 19:38:44,False,True,Naval Thakur,,,
"Doctor friendliness,Explanation of the health issue,Treatment satisfaction,","Children's Health,",0,0,YES,"** ****** ****** ** *** **** ************ ** **** **** **** True to all the other comments his approach is amazing. He spends ample time in explaining the issues n treatment and also gives an insight and encourages the parents how to take care of the children in any case. Doesn't give unecessary medicines nor recommends unecessary tests. We have known him for almost 8 years. He has handled both our children from the time they were born. So, One can trust him with their child's health and be assured they are in the best hands. The world needs pediatricians like him. ",2019-12-20 04:06:48,False,True,Verified Patient,,,
"Doctor friendliness,Explanation of the health issue,Treatment satisfaction,Value for money,","Fever,",0,0,YES,"He is an excellent doctor since birth of my child I take h to this doctor only .
I would strongly recommend this doctor.",2019-03-28 06:53:12,False,True,Sindhura Padaraju,,,
"Doctor friendliness,Explanation of the health issue,Treatment satisfaction,Value for money,Wait time,","Paediatric care,Child specialists ,",0,0,YES,"never recommend Antibiotic straight away, examines thoroughly with the parents feedback.

highly recommended for pediatric care",2019-02-15 06:21:14,False,True,sandeep g,,,
"Doctor friendliness,Explanation of the health issue,Treatment satisfaction,Value for money,","stomach and intestinal infections,",0,0,YES,"We are new in Hyd and I was looking for doctor for my daughter. someone told me about Dr Akeel and This was my second visit to the doctor. He is very good, very friendly with kids and explained the issue very well. For my daughter now I am going to visit him only. Will not give you unnecessary medicine",2019-05-21 04:44:54,False,True,Verified Patient,,,
"Doctor friendliness,Explanation of the health issue,Treatment satisfaction,Value for money,Wait time,","Pediatrics Critical Care,Pediatric Vaccinations,",0,0,YES,"Doctor gives you ample time to explain the problem and the best part about this doctor is, 
he avoids you from visiting diagnostic centers 
he never gives you a list of medicines
And if you start consulting him for a year, you will be able to take care of your child atleast till you reach the doctor. 
He makes you much equipped with what needs to be done. Kudos to these kind of doctors which are really a rare in this age.",2018-04-06 06:36:47,False,True,Verified Patient,,,
