tags,context,found_helpful_data-review_yes_count,found_helpful_data-review_total_count,recommendation,review,reviewed_on,is_online_consult,recommends,patient_name,reply_text,replied_at,replier_name
"Doctor friendliness,Explanation of the health issue,Treatment satisfaction,","Coronary Angiogram,",0,0,YES,"I would fully recommend the doctor to everyone who is looking for any guidance related to heart.
We had visited him for my husband.
He patiently heard all the facts and took note of it, checked all the reports, symptoms thoroughly and guided us for further actions.
",2020-02-23 07:43:53,False,True,Verified Patient,,,
"Wait time,Treatment satisfaction,Explanation of the health issue,Doctor friendliness,Value for money,","Heart Conditions,",0,0,NO,,2019-08-27 03:50:04,False,False,Verified Patient,,,
