tags,context,found_helpful_data-review_yes_count,found_helpful_data-review_total_count,recommendation,review,reviewed_on,is_online_consult,recommends,patient_name,reply_text,replied_at,replier_name
None,None,0,0,YES,"I was admitted for a procedure. My experience was very pleasant right from admission till discharge. My procedure  was done by extremely professional Cardiologist Dr. Ashish. who made me very comfortable and kept me informed during & after the process. I never felt worried or scared. He even visited the ward before the discharged me personally explained to me the next course of treatment. I also must compliment the hospital administration & Ms Leena for cleanliness, coordination, and smooth process. I strongly recommend this Wockhardt Hospital Mira Road for Cardiology treatment. ",2024-07-16 11:04:35,False,True,Verified Patient,,,
None,None,0,0,YES,"Dr. Ashish Mishra is an outstanding cardiologist. The hospital experience was excellent, with attentive staff and modern facilities. Dr. Ashish's expertise and compassionate care made a significant difference. I highly recommend him to anyone looking for a cardiologist in the mira bhayander area.",2024-07-15 05:45:34,False,True,Verified Patient,,,
None,None,0,0,YES,"I had chest pains for several days when it got too much and had to book an emergency appointment with DR. Ashish Mishra at the Wockhards Hospital Mira Road.
Him and his staff treated me well and on time, they were very helpful and professional. will definitely highly recommend as a great heart doctor in the Mira Bhayander area!",2024-07-13 06:13:55,False,True,Verified Patient,,,
None,None,0,0,YES,"The doctor is incredibly caring, deserving special recognition for his exceptional service, delivered with expertise. Huge kudos Dr Ashish Mishra at wockhardt hospital mira road.",2024-07-17 09:59:54,False,True,Verified Patient,,,
None,None,0,0,YES,"Him and his staff treated me well and on time, they were very helpful and professional. will definitely highly recommend as a great heart doctor in the Mira Bhayander area!",2024-07-13 07:03:23,False,True,Verified Patient,,,
None,None,0,0,YES,Dr Ashish Mishra provided exceptional care during my surgery. His thorough pre-operative assessment and reassuring demeanor helped alleviate my anxiety. I felt safe throughout the procedure. Highly recommend for their expertise and professionalism.,2024-07-12 07:17:48,False,True,Verified Patient,,,
None,None,0,0,YES,"From several days I had sevier pain in chest and one day  it was extremely painful, my brother search for best Cardiac dr. In Borivali it came Dr. Ashish Mishra from Wockhardt Borivali Clinic i call on clinic no. And took appt for emergency consultation and by gods grace dr. Was available on the day.. Dr. Ashish mishra is a wonderful doctor he relaxed me gave medication.
He ** **** ************* *** Explained me why it happned, answered all my questions..",2023-04-24 06:59:21,False,True,Verified Patient,,,
