tags,context,found_helpful_data-review_yes_count,found_helpful_data-review_total_count,recommendation,review,reviewed_on,is_online_consult,recommends,patient_name,reply_text,replied_at,replier_name
None,None,0,0,YES,"**** ****** ** ********my entire family kids visit her,knew her since more then 12 years. 

Her treatment suits my Kids.",2017-09-04 14:29:58,False,True,Rashid Khan,,,
None,None,0,0,YES,"*** ** ** ********* *** experienced paediatric doctor. We have been consulting her since our children were born. 
",2017-02-11 04:47:48,False,True,Renjan and Geena,,,
None,None,0,0,YES,Nice doctor..... listens to the patient's problems. explains everything patiently & properly. Gives patients the most priority,2016-03-16 15:45:41,False,True,Pranitha,,,
"Doctor friendliness,Explanation of the health issue,Treatment satisfaction,Value for money,","Pediatric Vaccinations,",0,0,YES,Dr. Uma was very approachable and answered each of our queries very patiently. We are new to the city and are really happy to have found Dr. Uma as our child's pediatrician. ,2020-03-16 08:01:18,False,True,Prateek Sircar ,,,
"Doctor friendliness,Explanation of the health issue,Treatment satisfaction,Value for money,Wait time,","Pediatric Vaccinations,Paediatric care,",0,0,YES,"Doctor is always very kind in nature.
By God grace her treatment is always suits for my baby.
The treatment is always satisfactory for us. 
",2019-01-14 14:41:46,False,True,Verified Patient,,,
"Doctor friendliness,Explanation of the health issue,Treatment satisfaction,Wait time,","Children's Health,",0,0,YES,,2018-06-04 10:12:01,False,True,priti jeswani,,,
