tags,context,found_helpful_data-review_yes_count,found_helpful_data-review_total_count,recommendation,review,reviewed_on,is_online_consult,recommends,patient_name,reply_text,replied_at,replier_name
,,0,0,YES,I have PCOD from 6 years.. i had no hopes was getting cured from it and having baby. I getting consulted from 5 years. I was not undergone any treatment these years.. only by doctor given diet and consultation I got cured from it. Now I got delivered with a healthy baby without any treatment for PCOD.. I'm very thankful for the doctor.. she is very experienced and a very caring doctor. Thank you doctor ,2022-04-28 06:28:17,False,True,Ranjitha,,,
,"PCOD/PCOS Treatment,",0,0,YES,Very sweet experienced doctor who listens to your complaint patiently and explains the issue well. Helpful,2022-09-20 10:36:14,False,True,Rhea Verghese,,,
"Doctor friendliness,Explanation of the health issue,Treatment satisfaction,","PCOD/PCOS Treatment,",0,0,YES,"I know doctor since from 15 years
 She is well experienced and provide **** treatment. Confident that her treatment will cure.",2020-09-09 04:45:11,False,True,Chaithanya G S,,,
,,0,0,NO,*** **** ** ** *** ** **** ************** Did not prescribed me any additional vitamins. Did not send me to dietician until 6-7 months. *** ******* *** **** ** *** *** **** *** **** * ******** In my first pregnancy i got zero empathy from her. Was a nightmare.,2022-06-10 05:19:04,False,False,Verified Patient,,,
,"Breast Examination,",0,0,YES,Thank you so much ma'am  for your treatment and correct guide for my fibro cystic changes in  Right breast.,2023-10-20 12:21:02,False,True,Verified Patient,,,
,,0,0,YES,First time.visit and was very comfortable sharing with her my private talks . She's an amazing gyno and gives positive energy. Overall wonderful experience! ,2021-03-25 05:47:17,False,True,Verified Patient,,,
