tags,context,found_helpful_data-review_yes_count,found_helpful_data-review_total_count,recommendation,review,reviewed_on,is_online_consult,recommends,patient_name,reply_text,replied_at,replier_name
,,0,0,Yes,I had shoulder dislocation related issues so went to hospital. ********* *** **** ** *** ******. I am satisfied with the explanation and treatment given. I can definitely recommend the doctor to my family and friends. There was no waiting time when we went. It was only 5 minutes. I had surgery. MRI was done outside and I took reports. Doctor was friendly. There is improvement in my health. Physiotherapy was suggested. I have plans to go again. ,2021-07-24 06:00:46,False,True,NIKHIL,,,
,,0,0,Yes,My relative had consulted the doctor and it was for knee surgery related. ********* *** **** ** ******. I would like to recommend the doctor to other people. We had consultation with doctor. Tests was done. There was no waiting time in the hospital when we went. Surgery was required and it was done somewhere else. Doctor was friendly with us.  ,2021-06-05 12:58:04,False,True,Siddharth Patel,,,
,,0,0,YES,Dr. Mahesh Reddy is one doctor who does not believe in surgery straight away. He always gives the patients the alternatives which has helped me a lot. He believes surgery is the lost resort. He always explains your case in detail with lots of patience. In fact  I have known him for almost 12 years.,2021-08-19 08:47:52,False,True,Verified Patient,,,
"Explanation of the health issue,","unstable shoulder,",0,0,YES,Very reassuring. Gives clear guidance. Keeps it simple. Very punctual and does not keep us waiting. ,2021-03-06 09:58:00,False,True,Srinidhi Kadaba Garudachar,,,
"Doctor friendliness,Explanation of the health issue,Treatment satisfaction,","Joint Mobilization,",0,0,YES,"**** ************* ******* Explains the condition very well.
Explained both pros and cons of the treatment and provides  facts",2021-10-21 04:35:26,False,True,Verified Patient,,,
"Explanation of the health issue,Treatment satisfaction,","Rotator Cuff Injury Treatment,",0,0,YES,The doctor was on time. He was quick to do a physical assessment of the problem and explain the issue and progressive options to get relief .,2021-02-02 04:24:17,False,True,Verified Patient,,,
