tags,context,found_helpful_data-review_yes_count,found_helpful_data-review_total_count,recommendation,review,reviewed_on,is_online_consult,recommends,patient_name,reply_text,replied_at,replier_name
,,0,0,YES,"Recently I had been to Dr. Lokesh for my hand bone fracture.
He gave a very good treatment and the way he handles the patient is very soothing.
Thanks to Dr.Lokesh.",2024-02-01 10:14:49,False,True,User,,,
,,0,0,YES,"Very friendly person, what brings us happy is his smile, 
When we have pain he cares and he give proper solutions. 
I had a knee injury and visited Dr.Lokesh thought very helpful exercises. Now I’m perfectly fine. 
I would recommend to everyone ",2022-10-01 06:50:01,False,True,Subhash Babu,,,
