tags,context,found_helpful_data-review_yes_count,found_helpful_data-review_total_count,recommendation,review,reviewed_on,is_online_consult,recommends,patient_name,reply_text,replied_at,replier_name
,"Abortion / Medical Termination of Pregnancy (MTP),",0,0,YES,"Dr. Chakrabarty is an absolute professional. She proves not only diagnosis and treatment is the deal, but also how vital attitude and warmth is for a patient. Would 110% recommend her. ",2024-05-25 14:25:27,False,True,Subhangi Dhar,,,
,"Pregnancy Check Up,",0,0,YES,Excellent advice on our issue.she has explained the problem which we have and given proper guidance on treatment ,2024-03-12 17:45:15,False,True,Ravikanti Arunoday,,,
,,0,0,NO,she was not available. we waited for her for so long. I was not expecting this kind of things. Time is very important to anyone. please try to maintain it,2023-08-11 11:52:26,False,False,Verified Patient,,,
"Doctor friendliness,Explanation of the health issue,Treatment satisfaction,Value for money,",,0,0,YES,"Doctor well behaved. She explained so well. I'm happy that She's my doctor. Will suggest everyone 

Very good. Must visit ",2023-08-16 07:36:57,False,True,Swarnali  Chakraborty,Thank you swarnali.,2023-08-17T05:55:19+0000,Dr. Arundhati Chakrabarty
