tags,context,found_helpful_data-review_yes_count,found_helpful_data-review_total_count,recommendation,review,reviewed_on,is_online_consult,recommends,patient_name,reply_text,replied_at,replier_name
"Doctor friendliness,Explanation of the health issue,Wait time,","Infertility Evaluation / Treatment,",0,0,NO,"I had visited Doctor Sujay Dasgupta during 2016, he was a very good person back then, I revisited him today(01/07/2021) at the Bhagirathi Neotia Child care center at New Town. This time around I was completely shocked regarding the utter Unprofessional and unruly attitude of Dr. Dasgupta. He was in a hurry since the time our consultation started and kept saying he is getting late for some engagement that he has. ***** ** *** *** ******** **** *** **** *** *** **** *** ** **** ** ***** * **** ****** ** **** ******* **** ***** ******* *** for us he spared 5-7 minutes hardly. His behavior was very hostile, did not even speak with a courtesy **** ** ******** **** * ******* As a patient we expect the doctors to be understanding *** **** ****** ****** ** **** ** **** ** **** This is a reasonable expectation considering they are not providing consultation for free, we have paid their consultation fees and they should hear us out. Why should a patient suffer because of the doctor's own agenda or engagements. Why would the doctor agree to consult a patient if he knows he would be late for his affairs in the first place. Unruly rude behavior, way of speaking are some of the things i would like to point out about this doctor. ** *** *** ******** ** ***** *** ** *** ******* I am not sure why he treated us the way he did today, me and my wife are very disheartened with the kind of behavior Dr. Dasgupta showcased. We have reported the whole incident to the management team of Bhagirathi Neotia. * ****** * ******** ** *** ********** ******** **** ** **** ***** ** *** ************ ******* ******* ******* *** ******* ******** ** ********** *** ********** *** ********* ******** **** ** **** ** *** *** **** **** ** *** *** ** ** ******** ****** ********* **** ***** ********* * **** ***** **** ** *** ********* ********* * ***** ** ****** ** *** ********* ** *** **** * ********* **** *** ** **** *** **** **** *** **** *** **** ****** ** ****** ** * ************ ********",2021-07-01 13:46:21,False,False,Debojyoti Bandyopadhyay,"We are happy that most of our patients do not think like you. As you have mentioned, our Dr gave adequate time to all other patients except you. Some patients need extra time (even an hour) while in some other cases the consultation can be completed within 5 minutes.
Regarding your problem our Dr already reassured you that you did not have any big problem and advised some tests.
Then you showed tests and medicines advised by other doctors and asked for opinion on it. Nobody can judge the prescription of another doctor. We can not comment on tests advised by other doctors.
Even finally he requested that he was having an emergency (because we cannot endanger other patient's life when that patient requires URGENT medical attention). But you repeatedly asked to know the SPELLING OF EACH TEST advised by the doctor. The tests were clearly written in prescription and it did not require the doctor to spell the name of each test.
Therefore in future when you visit any doctor, please remember,
1) all patients may not get equal time in consultation. The time depends on the severity of the problem patient is suffering.
2) don't compete with other patients regarding time
3) don't ask the doctor to judge the prescription of another doctor. (You purposefully avoided explanation of this).
4) the spelling of the tests can be asked from the laboratory.
Good luck.",2021-07-05T14:08:29+0000,Dr. Sujoy Dasgupta
"Doctor friendliness,Explanation of the health issue,Treatment satisfaction,Value for money,","Pregnancy,",0,0,YES,"We started our journey in July, 2019. Then I found Dr. Sujoy Dasgupta Sir and we met our Doctor. He explained us each and every points needs to be taken care off and guided us. We were having full of queries and doubts in our mind. He was always with us in all the phases and helped us with the clarifications by understanding our medical history. What we specially liked that he always explained everything before the questions asked. We always found our mental satisfactions in every time we visits him.He was always available to clear our doubts in the WhatsApp and Phone at any point of time in a day and night.Dr. Sujoy Dasgupta Sir is a great human being and advisor in our journey. ** *** **** ***** ** **** *** *** ***** *** ** *** ******* *** ** ** **** ** *** **** * **** **** *** *** *************** ** ********Things are going well however the tough time started. We were so worried due to this global pandemic. Situation was very tough for us but our Doctor Sir explained us everything in detailed and helped us to understand all the pros and crons and ensure us to take the right decisions.Delivery happened little earlier than the scheduled planning due to some complications. Dr. Sujoy Dasgupta Sir hold our hands tightly in this challenging time and we are blessed with a healthy baby boy and cherishing the every moment. Now we are so happy and enjoying our parenthood from 6th April, 2020.Thank you for your part in our journey. We are so touched beyond words.Your kindness, sincere caring, and concern make everything better and are a great encouragement.We do pray to God for your success. We blindly believe you that makes the faith on you.Many many thanks to you and your team.This is our small story bound by Dr. Sujoy Dasgupta Sir.Aparna & Abhisek Pramanik",2020-04-12 02:03:49,False,True,Abhisek Pramanik,"Dear Mr and Mrs Pramanik, Thanks a lot for penning down the details of your journey through thick and thin, in beautiful words. We believe that the patients have the right to take decision about their treatment and therefore, they should be fully informed about the details of their condition, reports and treatment options. Thank you for your unconditional faith on us from the very beginning.
Regarding Covid 19 pandemic, it was totally unexpected. We never anticipated such things. That's why we have not been able to provide the care according to our standard protocol. We have to omit many check up, tests and medicines just to avoid spreading the infection according to the Govt policy. We feel this is very tough time, especially for those who are pregnant and their family members. We are trying our best to support them via phone and Whatsapp.
Thank you again for your kind words of appreciation.",2020-04-13T08:08:22+0000,Dr. Sujoy Dasgupta
"Treatment satisfaction,","Pregnancy Check Up,",0,0,YES,"I was facing pregnancy related issues since 2-3 years. Then we got to know about Dr. Sujoy Dasgupta Sir and consulted him at Kolkata. After 2 years of his consultation we got to hear good news and blessed with a baby boy. I'm very thankful to him. I would highly recommend him for consultation related to pregnancy issues. He is very helpful with a great personality. Thank you so much once again Sir.
",2024-04-20 16:18:22,False,True,Supriti Ghosh ,Thank you so much for your valuable feedback. Thanks a lot for having faith on our treatment even when we failed.,2024-04-23T14:49:53+0000,Dr. Sujoy Dasgupta
"Wait time,Value for money,Treatment satisfaction,Explanation of the health issue,Doctor friendliness,","Caesarean Section (C Section),Tubectomy/Tubal Ligation,Pregnancy Check Up,",0,0,YES,"Going through childbirth is mix of immense pain followed by happiness. In this journey, the presence of a wonderful doctor is simply priceless. Thanks Dr. Sujoy Dasguptafor comforting us and taking way all our stress. It was a great privilege and an unforgettable experience to have met you 3 years ago, when we were gifted our 1st baby under your guidance. So we did not think twice to visit you again after getting the news of 2nd pregnancy. The littlest feet make the biggest footprints in our heart and you are the pacemaker wrapped with kindness and caring nature. It was the humanity and brotherly love rather than professionalism showed by you throughout this journey. You may not know what you did for us, because we are now one of the happiest families with 2 children born in your hands i.e. garden of humanity. May your days be full of good health just like you help all of us. We will be forever grateful to you. With lots of love and respect…..
                                   Mr. & Mrs. Mahanti
",2021-09-20 09:00:35,False,True,Mousum Mahanti,"Dear Mr and Mrs Mohanti, our words really fall short to describe our gratitude. You kept unconditional trust on our treatment in both the pregnancies. The word ""thank you"" is too small for you. ",2021-10-13T08:11:53+0000,Dr. Sujoy Dasgupta
"Doctor friendliness,Explanation of the health issue,Treatment satisfaction,Value for money,Wait time,","Pregnancy Check Up,",0,0,YES,"We became a bit frustated as I was yet to conceive after 5 years of our marriage. We went to a renowned gynaecologist of Kolkata to resolve the issue. But the Doctor gave us very little time in each seating and it seemed that the problem, whatever it is with me, remained unsolved after more than a year. Then a colleague of my husband suggested us about Dr Sujoy Dasgupta (from now on, I will address him as 'Sir'). We visited Sir at Garia, Friends Diagnostics. From the first day, Sir was very supportive and thorough, he consulted with us like a friend, giving all the possible options. The problem for which I was unable to conceive till that time, was identified by Sir within a week. After then, following his advice, I became pregnant which was an amazing experience. 
As my hometown is Krishnanagar, we could not visit Sir after lockdown, but he was always there whenever we required advices. I am unfortunate that I was unable to have Sir beside me during the most important incident of my life, due to pandemic situation, but I know it is his blessings that leads us to our parenthood.
******** * **** ******* ** **** *** ** ******** ***** *** ****** * **** *** *** ** ***** ***** Thank you very much Sir.",2020-08-27 03:43:50,False,True,Suparna Mitra Ghosh,"Dear Mrs Mitra, we are keeping ""Reply"" section ""empty"" because we do not have words to express our gratitude to your kind appreciation.",2020-08-30T05:04:32+0000,Dr. Sujoy Dasgupta
"Doctor friendliness,Explanation of the health issue,Treatment satisfaction,Value for money,","Pregnancy Check Up,Caesarean Section (C Section),",0,0,YES,"It was month of March'2020, when I came to know that my wife is pregnant. We went to Dr. Sujoy Dasgupta with lots of anxiety, curiosity, tension(for covid-19) along with good feeling.We never faced any difficulties as we always used to receive proper and promt advice offline as well as online(via whatsapp text message) all the way of this special journey.We want to give you special thanks for your mental support and splendid behaviour during this covid-19 period. Finally the day has come on 09th November'2020. We are blessed with our ""Little Angel"".  Dr. Dasgupta is just awesome with his talent, experience, behaviour and knowledge. 
Thank you very much sir for holding our hand in this journey and to give us our 'MAA LAXMI' with your Magic Hand.",2020-11-15 12:35:15,False,True,Dhiman Ghosh,"Dear Mr Ghosh, it is quite usual for the women and their family members to have queries regarding pregnancy particularly if it is the first one. Our job is to support them to allay anxiety. Because of Covid-19, the situation has become more difficult. Therefore we try our best to support them as far as feasible. We thank you for relying on our treatment throughout the pregnancy. Thanks a lot. ",2020-12-11T00:37:06+0000,Dr. Sujoy Dasgupta
"Doctor friendliness,Explanation of the health issue,Treatment satisfaction,Value for money,","Infertility Evaluation / Treatment,",0,0,YES,"As a common layman we approached Dr Sujoy Dasgupta for infertility treatment. Right from the very outset Dr Dasgupta appeared more as a friend than a doctor. We would never ever forget how a person can become larger-than-life by sheer sincerity and cordiality. Today, as the parent of two male children, we can't help appreciating the approach, the care, love and guidance, as and when required, bestowed upon us by Dr Dasgupta...And we promise to teach our generation next how one has to be GOOD intrinsically to become great in any field of profession...Thank you Sir...thank you so much for always being there...",2020-01-14 19:35:25,False,True,ANUP PANJA ,"Really we are overwhelmed. No words are enough to express our gratitude for you and your family, not only for this kind review, but also for unconditional faith on us throughout the treatment phase. We cannot use the word ""Thank you"" because we cannot. Lots of blessings for the babies.",2020-01-17T16:13:49+0000,Dr. Sujoy Dasgupta
"Treatment satisfaction,Value for money,","Pregnancy,",0,0,YES,"I was under Dr Dasgupta's guidance from the very first day of my pregnancy. He guided me thoroughly stating the pros and cons as I was pre diabetic for a long time by then. I had endometriosis, uterine fibroid and later polyhydramnios was detected at 36 weeks. However Doctor handled my case very smoothly treating me with bare minimum medicines and sincerely operated me in the last week of July to bring my little angel on this earth. He was very helpful and replied to all the queries as required. Thank you doctor.",2021-08-05 07:16:07,False,True,user,"Dear Mrs Roy, thank you so much for your kind review. We believe in minimum intervention and that's why we want to minimise the use of medicines. 
Diabetes in pregnancy can cause serious problems for both the mother and the baby. That's why we want to make our patients alert about the complications of diabetes. Thank you for following our advice religiously and having faith on our treatment. Thanks a lot 🙏",2021-08-08T10:02:05+0000,Dr. Sujoy Dasgupta
"Doctor friendliness,Explanation of the health issue,Treatment satisfaction,Value for money,Wait time,","Pregnancy Check Up,",0,0,YES,We were very scared when covid cases returned in later half of my wife' pregnancy. But dr.Sujoy Dasgupta stand by us in this difficult time as he stand by us throughout my pregnancy period..he is such a humble kind *** ************* ****** **** even a most scared person can feel assured by his words..during each visit he would hear every little concern with patience.throughout admission and hospital stay he was very much helpful..even his ot skill and his surgical team was very helpful and skillful.my wife did not feel much pain after ot compared to other mother in same hospital. My wife started walking and normal food the very next day which was quite early in ceasarian section..I will definitely recommend him to anyone as my personal experience with him.THANK YOU DR. SUJOY DASGUPTA FROM CORE OF OUR HEART,2021-04-23 03:39:15,False,True,Biswadip Mondal,"Dear Mr Mondal, we always believe in empowering our patients and that's why we want to provide all sorts of information and address their concerns, so that they can take their own decision. 
Of course, the situation is worrisome for the patients at the time of Covid but we try to reassure them as far as possible. Come what may, we will always be there with you. 
Regarding our team, we are very much proud of our anaesthetists and Paediatrician because they always keep patient's comfort and safety in their priority. We always believe in ""Enhanced Recovery"" so that a patient can return to the normal life as soon as possible. 
Thank you so much for your unconditional faith on our treatment. Thanks a lot for your kind words of appreciation. ",2021-04-23T06:23:46+0000,Dr. Sujoy Dasgupta
"Explanation of the health issue,Treatment satisfaction,Doctor friendliness,","Pregnancy Check Up,",0,0,YES,"Many thanks to Dr. Sujoy Dasgupta and his team for safe preterm delivery of our first child (March 2021). I would like to add few words of appreciation regarding my doctor’s support during my way towards motherhood. The consultation sessions were quick and precise and we never had to wait for long hours. Adequate attention was paid wherever required. At certain tensing situations (had issues with obesity, late age, gestational diabetes, preclampsia, IUGR, breech baby), Dr. Dasgupta supported us with sufficient information and assurance which were greatly relieving. Finally, the C-section surgery was successfully executed and all associated risks were properly addressed. ",2021-04-13 18:26:37,False,True,Joyeeta Singh,"Dear Mrs Singh, at the outset let us express our gratitude for giving us the opportunity to take care of you in high risk pregnancy. We always want to empower our patients by providing them sufficient information so that they can take their own decisions after understanding the risks and benefits. We are really happy to see our patients smiling after difficult journey. Thank you so much for taking your time to write this nice review. Thanks a lot. ",2021-04-17T10:22:50+0000,Dr. Sujoy Dasgupta
"Doctor friendliness,Explanation of the health issue,Treatment satisfaction,Value for money,","Infertility Evaluation / Treatment,",0,0,YES,"When all the roads leaded us to nowhere, Dr. Dasgupta came as a complete blessing to our life to fulfill our dream of parenthood.
He is the most committed, hardworking and professional doctor we have come across in our journey so far.
I would highly recommend him ** ** ** *********** * ***** ****** *** **** * great human being who listens to his patients with utmost patience and personal care.
The new journey of parenthood has just begun as we have been blessed with a girl child ❤️ & this has happened only because of his wonder hands. 
Thank you doctor, for making the impossible happen!
Forever Thankful to you,🙏
From the newly promoted “as parents” 😇
Partha Pratim Das & Sweta Sarkar Das.
“Keep on making wonders”😇",2020-03-07 05:55:07,False,True,Sweta Sarkar Das,"Dear Mr Partha and Mrs Sweta, first of all thank you so much for having faith on our treatment, even when we repeatedly explained you about the uncertainty, the chance factors and the success rate of the procedure. When the patients blindly believe what we say, it makes us feel more responsible to prove them that they are not wrong. We are overwhelmed by your words. Lots of blessings and love for your little bundle of joy. Thank you. ",2020-03-09T08:57:07+0000,Dr. Sujoy Dasgupta
"Doctor friendliness,Explanation of the health issue,Treatment satisfaction,Value for money,Wait time,","Cesarean Delivery,",0,0,YES,"Dr Sujoy Das Gupta is a renowned name in the city...A doc with full of confidence, modest behavior, immense knowledge and skillful hands is always a splendid combination...!
I am visiting him for around couple of years now...He is very caring and supportive...And we were following his advice throughout....And guess what...He has gifted us my BABY BOY on this last 7 the Feb 2020...The best gift one can give to us...He is a new aged doc with all national and international upgrades....His treatment procedure is also globally comparable....And knowledge always helps...Gold medal in MBBS and MD both shows sure resemblance of that...!
Thank you Dr Sujoy for your kind cooperation and support....!",2020-02-17 06:34:25,False,True,Sudipta Dey Sikdar,"Dear Mrs Sikdar, what we have done was part of our professional duties and responsibilities. We really don't know if we deserve the words you have nicely written. We understand Infertility, Miscarriage and Pregnancy all are very stressful conditions for the couples. Many a times, we cannot give success, but we definitely try our best, especially to be as much supportive as possible. We are indebted to you for keeping your faith on us despite repeated failure number of time. We feel happy that at the end, we made you smile. Thanks a lot.",2020-03-02T08:00:04+0000,Dr. Sujoy Dasgupta
"Doctor friendliness,Treatment satisfaction,Explanation of the health issue,Value for money,Wait time,","Infertility Evaluation / Treatment,",0,0,YES,"As a family, we cannot adequately thank you, Sir for what you did. Our baby was successfully delivered and my wife is healthy, thanks to you. We appreciate the way you stood by us every step of the way.
 
Ours was a high-risk pregnancy, and your care and attention from beginning to end was amazing. We were so grateful that you took the time to listen to all our fears and concerns. You allayed them and allowed us to focus on enjoying the pregnancy.
Thank you, Thank you, Thank you sir.
অনেক ভালো থাকবেন, সুস্থ থাকবেন.",2020-01-01 09:11:06,False,True,Sushanta,"

We would rather thank you not only for your kind words, but also for your unconditional faith on us since 2017. You never left us even when our (and your) repeated attempts failed. That's why we took it as a challenge that we must do something to make you smile. But this difficult journey would never have been successful without your active cooperation and abiding by all the advices meticulously. This new year must be really ""very happy"" for you because you got the most precious wealth this year. Thanks a lot.",2020-01-02T13:44:27+0000,Dr. Sujoy Dasgupta
"Treatment satisfaction,Value for money,Wait time,Explanation of the health issue,","High-Risk Pregnancy Care,",0,0,YES,"I have 3 miscarriage,dr Sujoy dasgupta sir is a great Dr,he treat me very carefully,he told me I have anti phospholipid syndrome (APS),he is friend,philosopher and guide, I am fully satisfied,after 3 miscarriage I have a daughter on 15/02/2024,frist to Allah and then very very very thank ful to Dr Sujoy dasgupta to give me a very beautiful daughter 🙏🙏🙏🙏🙏🙏🙏",2024-02-28 13:13:13,False,True,Verified Patient,Thank you so much ,2024-07-20T17:53:17+0000,Dr. Sujoy Dasgupta
"Explanation of the health issue,Treatment satisfaction,Value for money,Doctor friendliness,","Pregnancy,",0,0,YES,"Dr. Sujoy Dasgupta has helped us to experience one of the most joyous and precious moments of our marriage life.  He is qualified, knowledgeable and talks precisely. By the blessings of Almighty, we have given birth to a baby girl on this earth without any artificial reproductive measures. My wife and I are truly grateful to you to have such a good doctor. We will remember you and cherish the moments which you gifted us. A big Thank you! ",2022-12-03 19:13:54,False,True,Anirban Bose,Thank you so much ,2024-07-20T17:53:37+0000,Dr. Sujoy Dasgupta
"Treatment satisfaction,Doctor friendliness,Explanation of the health issue,Value for money,","Infertility Evaluation / Treatment,Caesarean Section (C Section),",0,0,YES,"*** ***** ******** ** **** ** *** *** *** When we are helpless for a baby,then he help us to overcome the critical situation with his magical treatment. He also motivate us to think positive. After his hardwork and support, now we are the parent of our tiny little princess. Thank you so much Dr. 🙏🙏🙏💐💐💐",2021-10-23 19:28:14,False,True,Sougata Majhi,"Dear Mr Majhi, we really have no words to express our gratitude because you believed in our treatment even when we failed. We understand, couples are coming to us with lots of stress and at the same time with huge expectations. We, therefore, try our best to give positive support to them, while being honest to the condition and treatment. Thanks a lot for your kind review. Lots of blessings to your little princess.",2021-10-31T07:18:47+0000,Dr. Sujoy Dasgupta
"Doctor friendliness,Value for money,Wait time,Treatment satisfaction,Explanation of the health issue,","general physician,",0,0,YES,"We lost all hopes when we visited him just for a second opinion. He gave us enough time, reviewed all my previous reports and prescriptions and discussed all the possible options and benefits and risks of each option. We were really impressed and decided to get treatment by him. And we got the results next month. Now we are proud parents",2022-02-08 12:55:08,False,True,Guddu Kumar Sharma,Thank you so much ,2024-07-20T17:54:51+0000,Dr. Sujoy Dasgupta
"Doctor friendliness,Explanation of the health issue,Treatment satisfaction,Value for money,Wait time,","Infertility Evaluation / Treatment,",0,0,YES,"We appoints doctor after suggest by our friend. We are satisfied the treatment and homely atmosphere of the centre, mainly  friendliness behaviour of sir. We can taste the parenthood only for sir. I am suggest all those who suffers from gyne problem. Thank you sir .",2021-11-30 09:50:03,False,True,Somnath sanki,"Dear Mr Sanki, we feel honoured that you kept faith on our treatment throughout your journey. IVF is an expensive procedure and often involves lots of uncertainties. We always try to give our best efforts. We feel happy to see your smiling face. Thanks a lot for your kind review. ",2021-12-28T13:07:33+0000,Dr. Sujoy Dasgupta
"Explanation of the health issue,Treatment satisfaction,Value for money,","Pregnancy Check Up,",0,0,YES,"We contacted the doctor after some complications during 1st trimester, from there on it has been a smooth journey till my delivery (may 2021).
I would highly recommend Dr Sujoy Dasgupta especially for the way he explains each and every minor details. ",2021-06-07 03:00:51,False,True,Kaushiki Ghosh Hazra,"Dear Mrs Hazra, we believe pregnancy is not a disease, rather a transition in a woman's life. Therefore, we try not to impose unnecessary restrictions in pregnancy and encourage the women to lead normal life as far as possible. However, women suffer from lots of anxiety during pregnancy, especially during first pregnancy. Our duty is to explain them what is normal and what is not. Thank you for your believe in our treatment. Thanks a lot for your kind words of appreciation. ",2021-06-07T16:55:46+0000,Dr. Sujoy Dasgupta
