tags,context,found_helpful_data-review_yes_count,found_helpful_data-review_total_count,recommendation,review,reviewed_on,is_online_consult,recommends,patient_name,reply_text,replied_at,replier_name
None,"BP Monitoring,",0,0,YES,"*** ***** ****** *********** ** *** **** ************ ** **********My family and relatives is taking treatment from him since long time,he is easily approachable,He takes time with the patient to help them with their health issues and explaing the condition in very clear manner.

In my opinion, It’s rare to find such a cardiologist like Dr. Shiva Prasad Koyalakonda that combines such personal touches and care for a patient as a person with outstanding quality of medical care. I highly recommend him to anyone looking for a cardiologist specialist.


",2023-03-23 07:50:22,False,True,Verified Patient,,,
None,None,0,0,YES,Very good experience and listen patient problems very carefully.provides the atmost care towards the patient and treat accordingly,2023-03-19 14:29:15,False,True,729636,,,
None,None,0,0,YES,**** ******** *******. listen to patient's problems/issues so keenly and answer all the queries patiently and prescribes ***** medicines. I had a procedure done by him.. super happy about the treatment!,2023-02-04 15:54:50,False,True,Harun,,,
None,None,0,0,YES,Really nice doctor and explained the issue very well in friendly manner.I have consulted him for chest pain and heart burn. I got clarity after consulting him,2021-08-23 10:56:59,False,True,Anu,,,
"Explanation of the health issue,","Pain in Left part of Chest,",0,0,YES,thank you sir for being so nice and explaining the issue. ** ** * **** ****** *** i had visited him in January. wanted to be in touch as well but he is a busy man. ,2019-10-20 14:07:42,False,True,Harsha,,,
"Doctor friendliness,Explanation of the health issue,Treatment satisfaction,Value for money,",None,0,0,YES,Doctor frienliness treatment satisfaction explanation of the health issue patint is very happy great doctor ,2018-05-05 09:03:48,False,True,Shiva Santhosh Panthula,,,
None,"Heart Conditions,",0,0,YES,Though you take appointment doctor will not be available for consultation.  High wait time. Waited for 1.5 hours...repeated follow ups required with hospital staff to check for the availability status of doctor.  No use of taking appointment before visit,2021-11-30 06:59:16,False,True,Verified Patient,,,
