tags,context,found_helpful_data-review_yes_count,found_helpful_data-review_total_count,recommendation,review,reviewed_on,is_online_consult,recommends,patient_name,reply_text,replied_at,replier_name
,,0,0,YES,*** ******** ** *** **** ****** *** *** **** ***** *********  I have had my RTC done from him. It’s amazing how he understands and manages his patients and executes painless treatments all the time. Got my wisdom tooth extraction today and as expected very smoothly executed his procedure. I would highly recommend this doctor for all your dental needs. ** ** ** ****** ** *** ****** ,2023-03-13 15:44:47,False,True,Syed Ameen Razvi,,,
"Doctor friendliness,Explanation of the health issue,Treatment satisfaction,Value for money,Wait time,","RCT - Root Canal Treatment,",0,0,YES,"Most painless root canal one can ever find... 
How style and experience of work makes him special..
",2020-08-11 16:16:16,False,True,Muneera bhat,,,
"Doctor friendliness,Explanation of the health issue,Treatment satisfaction,Value for money,","Wisdom Tooth Extraction,",0,0,YES,I’m very much satisfied with his treatment. I will recommend  People who is really scared of tooth extraction and any other problem please visit him once you will be very confident. ,2020-05-25 04:44:14,False,True,Sunil kumar ,,,
