tags,context,found_helpful_data-review_yes_count,found_helpful_data-review_total_count,recommendation,review,reviewed_on,is_online_consult,recommends,patient_name,reply_text,replied_at,replier_name
"Doctor friendliness,Explanation of the health issue,Treatment satisfaction,Value for money,","Fever Treatment,",0,0,YES,Doctor is very patient in hearing how we feel first which i feel is very important during any treatment. He has also diagnosed my problem accurately. With nominal fees it is difficult to find a good doctor now. I will highly recommend Dr. Hariharan for his sincerity. ,2023-06-11 05:44:55,False,True,Muthulakshmi,,,
"Doctor friendliness,Explanation of the health issue,Treatment satisfaction,Value for money,","Stomach pain and stomach upset,",0,0,YES,"I visited him for gastric problem for my father. He cured it within two to three days. Before visiting him, I visited another doctor but didn't recover even after taking full course of medicine as prescribed. ",2019-12-30 08:25:39,False,True,Gopalakrishna VOBILISETTY,,,
"Doctor friendliness,Explanation of the health issue,Treatment satisfaction,Value for money,",None,0,0,YES,"I like His approachness to patient which is very nice.
He didn't get angry for repeated questions.
Very cool  & honest person.",2017-12-25 15:14:36,False,True,subashchandran,,,
None,None,0,0,NO,Dr Hariharan always speaks about his experience which is not relevent.and can be much better in diagonosing diseases.,2020-11-14 09:16:35,False,False,Janani,,,
None,None,0,0,YES,I am from Salem...  I'm showing my mom to him for  2 year the way he treat us very good . Very casual person...  He wont  give unwanted medicine ... They medicine which has been prescribed by him will wont give any side effects for my mom ... Hats off sir for ur dedicated work... ,2020-11-13 15:25:09,False,True,Verified Patient,,,
None,"Fever Treatment,Diabetes Treatment,",0,0,YES,"Happy with Doctor friendliness, explanation of the health issue, query clarifications, Treatment satisfaction.Doctor is very patient & user friendly. Diagnosis and explanation of the diseases to the patients are awesome. The way of handling the patients with utmost care are exceptional irrespective of the time spending with patients. I strongly recommend to see him for issues like Viral fever,diabetes. Really happy to get such doctors. ",2019-12-19 09:12:53,False,True,Verified Patient,,,
None,None,0,0,Yes,**** ****** ** ****** his approach to patients are cool. Very positive and reliable.   He also make you understand your problem and how to go about it.,2016-12-24 17:54:02,False,True,Sarath Barani,Thank you ,2017-07-27T04:33:13+0000,Dr. Hariharan V.S
None,None,0,0,YES,Whenever i speak with him about my problem. He gives correct solution for my problem. Always i like Dedicated doctor like Dr.Hariharan V.S.,2021-03-04 09:12:35,False,True,Verified Patient,,,
