tags,context,found_helpful_data-review_yes_count,found_helpful_data-review_total_count,recommendation,review,reviewed_on,is_online_consult,recommends,patient_name,reply_text,replied_at,replier_name
None,None,0,0,YES,"Excellent doctor, easy to approach, caring, very friendly. She diagnosed the diseases quickly, correctly and treats well. My wife K Anitha was suffering from heavy fever and headache almost every year in a particular month. She is the only Doctor stopped that fever by giving some vaccine. Also she treated my wife from viral menangities recently. *** ** *** *** **** ****** ** **** **** **** ********* ******* *** **** ** ******",2020-09-13 05:23:38,False,True,K S Govindarajan,,,
"Doctor friendliness,Explanation of the health issue,Treatment satisfaction,Value for money,",None,0,0,YES,I have visited this doctor and consulted her multiple Times. first time I visited when I get health check up done for my father and took her advice regarding controlling high cholesterol level.Recently I had consultant her when I was down with viral fever and I was not very sure whether it is Dengue. *** ********** ********* **** **** ********* *** I was feeling better within 2 days.only one small advice to the doctor she should keep a very smiling face.,2018-11-13 16:18:37,False,True,Abinash Das,,,
"Explanation of the health issue,Treatment satisfaction,Value for money,","Proctoscopy,",0,0,NO,"My brother we Admitted with cold and fever. Which had 3-4 days before. Doctor said may be dengue then ran the test report is negative. Gave normal iv fluids saline and dextrose. After 4 hrs doing fine. When i asked what is the status needs to perform one more time dengue test. Again negative. After 4 hrs of admission doing fine with no issues. After 2 nd report negative she said one more time it has to be done and then ll discharge. Overall paid approx 37k bill for a normal fever.
What kind of diagnosis and treatment this is!

Overall not recommended to this doctor and this hospital for normal fever

",2018-12-03 11:56:27,False,False,Verified Patient,,,
None,None,0,0,NO,Not satisfied with her suggestions given for my problem .  Disappointed today. Doctor fees s also very high. ,2022-04-19 10:39:47,False,False,PREMALATHA  VINOTH,,,
"Doctor friendliness,Explanation of the health issue,Treatment satisfaction,","Outpatient treatment,",0,0,YES,"Extremely courteous, friendly. She listens to our problems and offers perfect remedy . Fully satisfied with her",2019-09-15 02:02:38,False,True,Suganthi,,,
"Explanation of the health issue,Treatment satisfaction,Wait time,","Dizziness,",0,0,NO,"Visited Apollo hospital with intermittent fever and dizziness and got admitted and given Saline + antibiotic.  they reported platelet count is low. Next day blood test result on platelet was further low than previous reading.
Since dizziness was complained during admission, they suggested MRI and now the total bill of 55K for 2 day (low grade intermittent fever + low platelet count). Still the platelet count issue was not improved.

Not satisfied with their treatment.",2019-11-16 17:18:26,False,False,Verified Patient,,,
"Explanation of the health issue,Treatment satisfaction,Value for money,","Fever,",0,0,NO,Went with normal fever with no symptom whatsoever of flu. ******* ******** ********* ** *** ******* prescribed H1N1 test. Scared my parent by stating story of a patient not agreed for this test and died in a week. So had to go for the test which costed around 4500 and result was ** *********  Negative. Completely lost trust in the way the H1N1 test was kind of imposed on us. ,2019-03-29 16:17:26,False,False,Verified Patient,,,
