tags,context,found_helpful_data-review_yes_count,found_helpful_data-review_total_count,recommendation,review,reviewed_on,is_online_consult,recommends,patient_name,reply_text,replied_at,replier_name
None,None,0,0,YES,"Dr. HariPrasath is a lifesaver. He saved our entire family during this COVID pandemic as everyone in our family was affected by COV 19. 

Doctor was kind enough to prepone the consultation understanding the situation and helped throughout.

Everyone in our family is in debt and we cannot thank enough for the support and timely assistance.

Thank you from the bottom of our hearts.",2021-05-16 16:47:59,False,True,Naresh kumar,,,
None,None,0,0,YES,Excellent.  Doctor is very patient and comforting. Patient will feel 50 % healed just talking to him. The balance 50% healing he does with minimal medicines. He has not prescribed antibiotics or tests unless essential. He is well informed too and spends time with each patient.,2015-10-26 13:04:48,False,True,ABISHAI,,,
"Doctor friendliness,Explanation of the health issue,Treatment satisfaction,Value for money,Wait time,","Diabetes Treatment,",0,0,YES," Staffs Are very Friendly and Caring. Dr. Hariprasath is very gentle and caring. One of the cleanest clinic I've ever
Seen. 
Overall 10/10",2023-01-06 15:23:21,False,True,Rini,,,
None,None,0,0,NO,"not recommending,no patience to hear patience history,better to avoid,
lots of one word answer .




",2021-12-16 11:07:08,False,False,MR.VINODH.M,,,
None,None,0,0,YES,"*** ** *** **** *** ********* ** **** ****** he will let us to explain our doubts and provide us better caring and consultation , proper diagnosis, rite medication period most important thing is  never make us to become panic irrespective whatever may be the situation is.. very humble in nature..  we can see God's living in human form.. ",2023-08-28 06:05:26,False,True,Verified Patient,,,
"Doctor friendliness,Explanation of the health issue,",None,0,0,YES,"This is the first time I am getting consultation and felt the confidence and comfortable feel. He gave me a 10 days task and hope it will help me for the speedy recovery 
",2022-09-03 15:47:03,False,True,Verified Patient,,,
"Explanation of the health issue,Treatment satisfaction,","Diabetic Neuropathy,",0,0,YES,"Doctor listens to our issue clearly & responded with even the basics for a diabetic.
He explained other complications & scenarios if a diabetic is not in control.
He is always recommended..",2020-08-24 04:31:46,False,True,Verified Patient,,,
