tags,context,found_helpful_data-review_yes_count,found_helpful_data-review_total_count,recommendation,review,reviewed_on,is_online_consult,recommends,patient_name,reply_text,replied_at,replier_name
"Doctor friendliness,Explanation of the health issue,Treatment satisfaction,Value for money,Wait time,","Gynae Problems,",0,0,YES,Thank you pritimala maam for your efforts and guidance. Because of your precise decesions and experince of correct mediciation our family is completed. Highly recommended.,2023-11-28 08:12:43,False,True,Yash shah,,,
"Doctor friendliness,Explanation of the health issue,Treatment satisfaction,Value for money,Wait time,","Test Tube Baby\IVF|ICSI,",0,0,YES,"Very friendly Doctor, who is approachable at any time of the day. 
Set-up is good , staffs are friendly.
On top of this, great results...",2021-07-31 11:25:42,False,True,B A Kadam,,,
,"Test Tube Baby\IVF|ICSI,",0,0,NO,Not Satisfied I have done IVF treatment  for my wife but totally not satisfied lack of transparency  ,2024-06-11 07:39:29,False,False,Rakesh Yadav,,,
,"PCOD/PCOS Treatment,",0,0,NO,"Waited till 11:45 am for a 10:30 am appointment. Whole day schedule disturbed no use of time and energy
",2023-07-04 06:14:04,False,False,Verified Patient,,,
"Explanation of the health issue,Value for money,","Gynaecological Problem,",0,0,YES,****** ** **** **** * she quickly understood the problem and suggested the treatment. But I was expecting little more explanation about my health issue. ,2022-04-20 13:07:12,False,True,Verified Patient,Hello my dear. Thanks for your response. Also I will like to request you to connect with me as I have given my contact to you. As I suggested you need to get the given test done which will make the diagnosis clearer & after which the real discussion is going to happen. So please feel free to connect with me. Thank you so much 😊👍,2022-04-21T08:16:00+0000,Dr. Gangurde Pritimala Bhalchandra
