tags,context,found_helpful_data-review_yes_count,found_helpful_data-review_total_count,recommendation,review,reviewed_on,is_online_consult,recommends,patient_name,reply_text,replied_at,replier_name
,,0,0,YES,"Had visited the clinic for peel sessions. I have an acne prone skin.
Dr. Sadaf did a good treatment and I was able to see significant change on my skin. The doctor is well trained and polite.",2024-04-05 08:26:02,False,True,Verified Patient,,,
,,0,0,YES,"Had excellent experience with Partha Dentals, the clinic has High standards of excellence, combining the latest innovation in Dental technology with highly educated professional dentists
Dr sadaf mam",2023-10-10 07:17:01,False,True,Naresh,,,
,,0,0,YES,I went to the clinic with hairfall issue Dr sadaf recommended me GFC treatment  . It's been 3 sessions now I can see reduction in hairfall. Very Professional and kind person.,2023-12-09 06:36:54,False,True,Verified Patient,,,
