tags,context,found_helpful_data-review_yes_count,found_helpful_data-review_total_count,recommendation,review,reviewed_on,is_online_consult,recommends,patient_name,reply_text,replied_at,replier_name
,,0,0,YES,"Mr. Harish Kumar is an excellent doctor.
He guided me & calmed me during the treatment with his words.
I was pretty anxious but he's words of trust made me calm.
Overall he is a good doctor...

",2023-09-29 16:05:58,False,True,M. Srinivas ,,,
,,0,0,YES,Dr . Harish  clearly  explaind about my tooth problem and he  treated it well …. He was so friendly ,2023-10-01 08:15:02,False,True,Verified Patient,,,
,,0,0,YES,Painless treatment and amicable talk seems very excellent treatment he has very patience and smile which gives patient hope,2023-09-29 16:01:37,False,True,Verified Patient,,,
,,0,0,YES,Dr harish has expertise in every aspect of dentistry he is a excellent with his skills he manages and listents to patients in very good way ,2023-09-29 13:56:29,False,True,Verified Patient,,,
,,0,0,YES,"excellent, doctor was with patience and friendly.Best results and no pain. His communication is very good 😊 ",2023-09-29 13:27:56,False,True,Verified Patient,,,
