tags,context,found_helpful_data-review_yes_count,found_helpful_data-review_total_count,recommendation,review,reviewed_on,is_online_consult,recommends,patient_name,reply_text,replied_at,replier_name
None,None,0,0,YES,"He is a very good human being. Polite in nature and listens to the child's parents minutely. Always takes the call and if any emergency rise he gives special appointment. Dr Puneet Goenka Sir is next to God to us.

-----Parents of Mouditya De 

",2023-11-04 18:40:28,False,True,Sharmistha De Banerjee ,,,
"Doctor friendliness,Explanation of the health issue,Treatment satisfaction,",None,0,0,YES,He is a wonderful human being *** ** ********* ************** My son improved with his treatment so soon. I am thankful to my friend who referred his name to me.,2017-02-17 16:53:29,False,True,Sony Agarwal,,,
"Doctor friendliness,Explanation of the health issue,Treatment satisfaction,","Newborn Jaundice,",0,0,YES,"he has been looking after both my child , *** * ******* ** ** *** *** *** there has been several times when his advice and medicine has helped my child. I would blindfold recommend him to every one. *** **** ****** * **** **** ****** ** ** ****  ",2019-05-04 12:36:21,False,True,vishnu agarwal,,,
None,None,0,0,YES,"He is a vey good doctor.. he is very polite, understand the problem well and provide **** medicines. My daughter's vaccination done this week. She did not cry for long. I recommend him for vaccinations and other treatments too.   ",2018-03-12 12:57:20,False,True,BIDISHA BANERJEE,,,
None,None,0,0,YES,"He is an  amazing dr. Behaviour is very good.I always take appointment for my baby,any serious condition he can handle wonderfully. He take call at midnight also.i always get help from him. ",2022-08-13 19:31:16,False,True,Verified Patient,,,
"Doctor friendliness,Explanation of the health issue,Treatment satisfaction,",None,0,0,YES,he is a very good and well behaviour doctor.**** *** ********* *** ****.i like his treatment and behaviour ,2019-02-20 19:02:48,False,True,Verified Patient,Thanks for the wonderful feedback! ,2019-02-22T08:07:35+0000,Dr. Punit Goenka
None,None,0,0,YES,** ** *** ** ******my daughter is a patient of his...he save her life..I recommend ebery one for Dr. Goenka.,2021-06-23 18:10:57,False,True,Verified Patient,,,
