tags,context,found_helpful_data-review_yes_count,found_helpful_data-review_total_count,recommendation,review,reviewed_on,is_online_consult,recommends,patient_name,reply_text,replied_at,replier_name
,,0,0,YES,It was a great experience .The doctor seemed very friendly and my problem was sorted very efficiently.Thank you doctor,2020-07-24 13:27:04,False,True,Bidyut Seal,Thank you for your feedback!,2020-07-25T12:39:02+0000,Dr. Sudarsan Sen
,,0,0,YES,"Great doctor best surgeon
Wisdom tooth extraction was done
Painless procedure
The total procedure was done in minutes ",2023-10-25 06:38:34,False,True,Verified Patient,Thank you.,2023-10-30T17:45:13+0000,Dr. Sudarsan Sen
