tags,context,found_helpful_data-review_yes_count,found_helpful_data-review_total_count,recommendation,review,reviewed_on,is_online_consult,recommends,patient_name,reply_text,replied_at,replier_name
,,0,0,YES,"I had  a massive heart attack on 16.05.2021 being Sunday, total lock down at Chennai by 11.30 a.m.
It was massive in the sense it was called widow maker heart attack.I was rushed and virtually lifted by my brother in his car within 20 minutes to Kavery Hospital and it was found out that there there was 100% block in the main  valve of the heart. Angio was done ,the block was removed  but stent was fixed by a leading international cardiologist.
Follow up check up was done on 4 occasion s by him.
But unfortunately he never asked me to take ECG or Echocardiogram. Due to this on 23rd November 2021 I was breathless and could not lie down or sit.
My bladder was full. No urine output. This continued on 24 th November 2021. On 25 th November 2021 I was taken to Kavery for OP check up but all the cardiologists were busy in Angio and they refused to talk to me  at least over intercom.
We returned empty handed. No appointment in his private clinic.
On 26 th November God gave the contact of Dr E.BABU International Cardiologist through my younger brother.
We ,( myself and my wife) took an appointment by contacting Malar hospital and met him. By seeing condition of being wheel chair bound immediately instructed us to take ECG and Echocardiogram and added some medicines.
What a miracle on the same night I had a good and sound sleep.
All my problems were completely resolved by his prescription of additional medicines.
Dr E  Babu is my saviour.
Dr E Babu is  my God..
He is very courteous to all the patients.
He is very kind and having lot of patience to hear the patient.
He is authority in his subject .Easily approachable. Very cordial .*****  **** *********.
Highly Recommended.",2022-01-07 09:30:23,False,True,CA V.  Radhakrishnan  ,,,
,,0,0,YES,"If anyone needs Heart related consultation, I highly  recommend Dr. Babu with Fortis Malar Hospital in Adyar.  He provides excellent communication and services to handle all your heart related concerns.  You’ll be in great hands with his expertise and experience. I must appreciate his availability, you can get doctor consultation immediately.
My father-in-law was diagnosed with Coronary Artery Disease - Triple vessel disease after he had a sever chest pain and left shoulder pain on one Sunday night.  Doctor had immediately performed primary angioplasty with stenting in one of the vessels and performed staged revascularization on the other two vessels.  His quality of life is improved now.  He is recovered very faster with angioplasty plus stenting.",2022-03-20 11:35:56,False,True,Ramakrishnan Ganesan,,,
,,0,0,YES,"I recommend  sir for any heart related  problem or else for high blood pressure. First  of all he is good human being and he is not threatening  about our issues. Whatever issues,he is take care it and he is showing good guidelines. Be frank am telling this,with medicine patients have to change their lifestyle like (diet,workout,stress-free life)surely they can recovery in short period. He is diagnosing the issues in correct form and giving tips to recover from that issues apart medicines. ",2022-11-19 13:40:41,False,True,Hariharan,,,
,,0,0,YES,"The first qualification of a doctor is to have cordial and smile approach to a patient,  which will ease the patient from tension and fear. Dr.E.Babu ,left nothing to be desired in that qualification. His friendly approach, patience in explaining the problem tiredlessly to patient . In stay and OPD treatments are good. No hesitation in recommending.",2021-08-06 05:38:38,False,True,C. Natarajan ,,,
"Doctor friendliness,Value for money,Wait time,","Irregular Heartbeat,",0,0,YES,Direct to the heart of the problem. No beating around the Bush.Fast focused service.You get more bang for your buck. ,2020-02-20 05:15:16,False,True,Verified Patient,,,
