tags,context,found_helpful_data-review_yes_count,found_helpful_data-review_total_count,recommendation,review,reviewed_on,is_online_consult,recommends,patient_name,reply_text,replied_at,replier_name
"Doctor friendliness,Explanation of the health issue,Treatment satisfaction,Value for money,Wait time,",None,0,0,YES,He is a wonderful person I met in my life .*** ** * ****** *** ** **** ** *** *** ** With RHD when most of the doctors I met  suggested not to go for pregnancy it was him who gave me the courage to go for it .He suggested another wonderful doctor .I was able to carry out a very risky pregnancy under his guidance  and gave birth to beautiful kid .He is not that kind of a person who  advice surgery un necessary .If I have not met him my life would have been a hell ,2017-09-20 06:29:42,False,True,Rasmi Shivkumar,,,
"Doctor friendliness,Explanation of the health issue,Treatment satisfaction,Value for money,Wait time,",None,0,0,YES,"A down to earth and very learned and sympathetic to patients doctor, thoroughly professional .
I recommend.",2017-06-03 07:52:51,False,True,L n kedia,,,
None,None,0,0,YES,Wonderful doctor a down-to-earth person who takes care of the patient very nicely and is easily approachable very few doctors have such good qualities our family owes him a lot. ,2022-06-28 07:00:39,False,True,S. SUWETHAMBARI,,,
None,None,0,0,YES,A down to earth person with kind heart. Moreover he's from a place near to my native. He cared me during my tough time; prescribed minimum Medicines & more advice. My heartful Thanks to him & his Assistant .,2021-11-06 04:40:13,False,True,VINOD NARAYAN,,,
