tags,context,found_helpful_data-review_yes_count,found_helpful_data-review_total_count,recommendation,review,reviewed_on,is_online_consult,recommends,patient_name,reply_text,replied_at,replier_name
None,None,0,0,Yes,Good enough no issue with the doctor. I visited for general fever treatment. The doctor's behaviour was good and listened to our problem. I wouldn't like to recommend this doctor to others because instead of treatment he used to do the right investigation. I would like to give a rating of 4/5. **** ** ***** ** *********** **** ***** ** ********* *********** ************* ** *** ******** ******* *** ******* ***** ** ******* *** ***** *** **** ************** ,2020-01-15 19:07:03,False,True,Ravi Ratnala,,,
None,None,0,0,Yes,"Consulted to the doctor, he is a good doctor about treatment. Once I booked an appointment from Practo that time he is not available. Main thing is doctor timing because he will not be available sometimes. I would like to give a rating of 3.5/5 but he is good, honest. And I visited for my wife fever treatment and he prescribed medicine not reacted differently but he is good. There was waiting time while collecting medicine, It took a long time around half an hour.",2020-01-12 18:38:09,False,True,Kishore,,,
None,None,0,0,NO,"Another person sitting next to doctor when I went in, doc was more concentrating to talk to him than me. *** ** *** **** *** ************** ****** **** **** ** * ***** Didn't listen to me, interrupted many times without empathy. Over all I felt wastage of my time n money. ",2021-07-23 15:08:11,False,False,Ben,,,
None,"Men and Women Wellness Screening,",0,0,NO,Appointment was for 6.30 doctor came at around 7.30 had to wait for him to come and then after that for him to screen other patients...it took me around 3 hours for a normal check up,2023-07-01 13:05:57,False,False,Verified Patient,,,
"Doctor friendliness,Value for money,","Fever,",0,0,YES,Doctor had prescribed exact medicines to cure the issue. Doctor's deep knowledge regarding my health issue understanding was good,2019-12-14 12:21:53,False,True,Narsan Rojanala,,,
"Doctor friendliness,Explanation of the health issue,","Fasting blood sugar,",0,0,NO,Am not satisfied with doctor. Doctor is not explaining the problem. And not a talkative person. Thank you ,2020-12-19 04:23:00,False,False,Verified Patient,,,
"Doctor friendliness,Value for money,","Body Ache,",0,0,NO,,2020-07-05 02:09:06,False,False,Siva,,,
