tags,context,found_helpful_data-review_yes_count,found_helpful_data-review_total_count,recommendation,review,reviewed_on,is_online_consult,recommends,patient_name,reply_text,replied_at,replier_name
"Doctor friendliness,Explanation of the health issue,Treatment satisfaction,","Consultation,",0,0,YES,Very satisfactory. Doctor was able to diagnose quickly. She was very friendly and asked relevant questions,2020-02-01 04:48:05,False,True,Aanand Raj,,,
None,None,0,0,YES,"Very cordial , examined thoroughly , advice well communicated. Will share my experience to my friends and relatives.
",2020-02-29 11:29:46,False,True,Verified Patient,,,
"Doctor friendliness,Explanation of the health issue,","Consultation,",0,0,NO,Would prefer Doctor closing the door and talking to patient in a mellowed voice and preferably in friendlier tone making the patient comfortable.,2021-02-10 12:17:57,False,False,Verified Patient,,,
"Doctor friendliness,Explanation of the health issue,","Joint pains Adult Vaccination,",0,0,NO,"She is not friendiness *** *** ********** ** ******** *****.
She has to spend more time with patient instead of one minute.",2019-09-06 16:11:41,False,False,Verified Patient,,,
"Treatment satisfaction,Value for money,",None,0,0,NO,,2018-02-12 08:52:41,False,False,Verified Patient,,,
