tags,context,found_helpful_data-review_yes_count,found_helpful_data-review_total_count,recommendation,review,reviewed_on,is_online_consult,recommends,patient_name,reply_text,replied_at,replier_name
"Treatment satisfaction,","Fever Treatment,",0,0,YES,Listened my problem carefully and prescribed medicine which helped me to get over the illness quickly.,2023-06-30 04:24:23,False,True,Anmol Pandey,,,
None,None,0,0,YES,Doctor is very friendly and makes you comfortable and gives lots of confidence. Suggests medication as needed.,2022-05-19 07:54:09,False,True,Krishna Kumar Nallur,,,
"Doctor friendliness,Explanation of the health issue,Treatment satisfaction,Value for money,Wait time,","Outpatient treatment,",0,0,YES,"The doctor listens very patiently to our problem, goes through each and every investigation report very thoroughly and explains everything in detail. An outstanding doctor. ",2019-09-16 16:43:34,False,True,Venkateshwar Rao,Thank you,2019-09-17T15:26:56+0000,Dr. Suram Vasanth Kumar
"Doctor friendliness,Explanation of the health issue,","Joint pains Adult Vaccination,",0,0,NO,,2024-05-01 04:43:32,False,False,Anand Putnala,,,
"Explanation of the health issue,Treatment satisfaction,Doctor friendliness,","Fever,",0,0,YES,"Pleased with the time & attention to understand / assess the overall health status, unlike many who just check temp at most & prescribe some antibiotics.. ",2017-12-29 15:43:44,False,True,Shailaja,Thank you,2018-01-31T14:29:02+0000,Dr. Suram Vasanth Kumar
None,None,0,0,YES,"Doctor was on time, very friendly, good listener, ***** ********** prescription worked, responded swiftly to messages - Highly recommended.",2020-11-05 14:29:38,False,True,Verified Patient,,,
"Doctor friendliness,Value for money,",None,0,0,YES,"Very good and friendly doctor, I recommend this doctor to my friends also,overall rating is 4 out of 5

",2021-04-24 04:58:34,False,True,Verified Patient,,,
None,None,0,0,YES,"good support from doctor,  with one day I recovered great export for diagnosis. thank you doctor for your support",2020-10-02 04:31:16,False,True,Verified Patient,,,
"Doctor friendliness,Explanation of the health issue,Treatment satisfaction,Value for money,Wait time,",None,0,0,YES,**** ****** ******* ** **** **** ******* he listen careful. My mom and myself are really satisfied with his smooth treatment.,2019-05-12 09:17:30,False,True,Verified Patient,,,
