tags,context,found_helpful_data-review_yes_count,found_helpful_data-review_total_count,recommendation,review,reviewed_on,is_online_consult,recommends,patient_name,reply_text,replied_at,replier_name
"Doctor friendliness,Explanation of the health issue,Treatment satisfaction,Value for money,","Dental Checkup (General),",0,0,YES,"**** ****** **** **** ********** ******
Provide complete package of treatment.

Friendly doctor with children & adult.",2024-03-19 07:46:28,False,True,Yogi rana,,,
,,0,0,YES,He has good ********* *** experience. He explained all process in detail which helped me to take decision on RCT.,2020-12-03 04:12:36,False,True,Brijesh Gupta,,,
,,0,0,YES,"Doctor Ravi is highly humble, understanding and a friendly doctor. He is a good person who listens your queries related to the treatment patiently and resolves them. I would highly recommend him to others.",2020-03-05 17:17:12,False,True,Nishit Kujur,Thank you Meena for your kind words. Keep Smiling..😊,2020-03-06T07:58:35+0000,Dr. Ravi Dahiya
,,0,0,YES,I have got my RCT done by Dr Ravi and I am completely satisfied with his work ethics and treatment. Would recommend this clinic for all your dental problems.,2020-02-23 14:08:46,False,True,Purva,thank you so much purva..,2020-03-06T07:59:08+0000,Dr. Ravi Dahiya
,,0,0,YES,It was a very good dental experience with Dr.  Ravi Dahiya.  He understood my concerns and was very polite with me. I would like to visit him again in future. ,2020-02-23 13:42:43,False,True,samar,Thank you Samar..,2020-03-06T07:59:44+0000,Dr. Ravi Dahiya
,"RCT - Root Canal Treatment,",0,0,YES,"I am thankful to you  sir for  excellent pain-free dental treatment (R.C.T ). You are very honest towards your profession ,moreover very humble  and kind . I would highly recommend  Dr.Ravi Dahiya for all dental problems to all.. I was always scared of RCT  but my experience got completely changed when I got R.C.T from Ravi sir.A millions thanks to u  Sir . *** **** ******* ***** ",2020-09-13 17:55:02,False,True,Verified Patient,Thank you so much.. ,2020-09-14T13:53:05+0000,Dr. Ravi Dahiya
,"Wisdom Tooth Extraction,",0,0,YES,"I have been visiting Dr. Ravi from past couple of years. I have no doubts that he is an expert dentist, but his expertise also lies in making his patients comfortable during the painful dental procedures. I also take my son to him for a dental check up and scaling once in six months. I am proud to say that Answer to all of my family's dental issues is Dr. Ravi Dhayia at Family Dental",2020-03-07 11:20:50,False,True,Verified Patient,,,
