tags,context,found_helpful_data-review_yes_count,found_helpful_data-review_total_count,recommendation,review,reviewed_on,is_online_consult,recommends,patient_name,reply_text,replied_at,replier_name
,,0,0,YES,Doctor Navitha is very patient and co operative. I am satisfied with her advice and medicine. Thanks. ,2020-12-08 14:04:20,False,True,Mitesh Agrawal,,,
"Doctor friendliness,","Williams Syndrome,",0,0,YES,"Doctor understand the issue and explained in good manner
Forwarded to concern department for further procedure",2020-03-17 18:43:53,False,True,Verified Patient,,,
,,0,0,NO,"If the doctor has shown up, I would have told my experience. she didn't even come to the hospital. I waited for 2 hours with my 5 month kid. she didn't even come then. ",2020-06-02 08:09:17,False,False,Vinay,,,
,,0,0,NO,I booked appointment at 11 AM. waited for 2 hrs with my 5 month old kid. The doctor didn't even shown up after 2 hours,2020-06-02 08:55:21,False,False,Verified Patient,,,
