tags,context,found_helpful_data-review_yes_count,found_helpful_data-review_total_count,recommendation,review,reviewed_on,is_online_consult,recommends,patient_name,reply_text,replied_at,replier_name
None,None,0,0,Yes,I had visited the hospital with my mother and it was related to my mother's health  . Doctor was good and well experienced. we  are   fully satisfied with the explanation and treatment given. There was no   long  waiting time in the hospital. Overall it was very good. I would like to recommend the doctor in future for my  family and friends too.,2021-05-20 14:14:47,False,True,Kush Chugh,,,
None,None,0,0,YES,"Today....I went to hospital with my mother **** *** *** ** *** **** ****** * **** **** **** 
He calmly listen her problem and gave her **** solution of her problem......it was awesome experience...

There was no such long line . 
",2023-06-08 08:41:10,False,True,Verified Patient,,,
"Treatment satisfaction,Value for money,","Knee Pain Treatment,",0,0,NO,"He prescribed medicine of worth RS 18000, yes eighteen thousand for a month... 
Who can afford that ??
No plan to follow up with him.
As long as his medical explaination of health issue and way of talking is considered... It was nice.

",2019-01-25 04:33:15,False,False,Akash Verma,,,
"Treatment satisfaction,","Knee Pain Treatment,",0,0,NO,** ** **** * ***** ***** ** ******** ********* **** ******* ** **** ******* *** ***** ** **** * *** **** *** **** ***** ******* **** ******** ** *** **** ******** *** ******** he suggests 20k a month medicine. We have visited there with 3 people with different pain issue *** ** ********** **** ******** ** *** *** * ***** *** medicine cost was 20k per person...how a middle class family will afford that.,2019-09-14 03:44:09,False,False,Verified Patient,,,
"Doctor friendliness,Explanation of the health issue,Treatment satisfaction,Value for money,","Neck Pain Treatment,",0,0,NO,Never expect this from such a reputative doc as he is so rude and shouted us without listening us problem as doc are here for give us statisfaction and calmness as we come to them havin so much trust like we do on god but this type of behaviour and super expenses medicine *** *** **** *** we didnt expect this thanks,2019-04-06 10:54:20,False,False,Verified Patient,,,
