tags,context,found_helpful_data-review_yes_count,found_helpful_data-review_total_count,recommendation,review,reviewed_on,is_online_consult,recommends,patient_name,reply_text,replied_at,replier_name
"Doctor friendliness,Explanation of the health issue,Treatment satisfaction,Value for money,","Paediatrics - Chest,",0,0,YES,"********* ******* friendly, trustworthy, has been my son’s doctor for the past 15 yrs. Dr Gowher shares a great rapport with the patient. She is always available in case of any urgency.",2019-04-13 09:59:15,False,True,Shaheen,,,
"Treatment satisfaction,","Paediatric & Family Counselling,",0,0,YES,Thanks to Dr. Gauhar because of her we met fathima great counseller. It really helps our family to be together ,2019-04-13 09:45:40,False,True,Tabassum ali,,,
"Doctor friendliness,Explanation of the health issue,Treatment satisfaction,",None,0,0,YES,Very Clean and Well Maintained setup. Dr Gowher is very down to earth and makes it very comfortable for the patient. Answered all my concerns very clearly and precisely.  The clinic is also very accessible and well located with parking space.Will definitely recommend Dr Gowher to other patients as well. ,2019-04-23 12:08:47,False,True,Verified Patient,,,
"Doctor friendliness,Explanation of the health issue,","Children's Health,",0,0,YES,Doctor was genuine.. she treated my son well also the hygiene of the clinic is osm.. she's very friendly with kids... Good for kids ,2019-09-28 07:14:28,False,True,Verified Patient,,,
None,"Vaccination/ Immunization,",0,0,YES,Visited for fever cold cough and vaccination ..  the suggestion and advice and prescription are good,2017-01-26 09:15:57,False,True,sampath,,,
