tags,context,found_helpful_data-review_yes_count,found_helpful_data-review_total_count,recommendation,review,reviewed_on,is_online_consult,recommends,patient_name,reply_text,replied_at,replier_name
,,0,0,YES,"Dear Dr. Varsha Manohar,

I wanted to extend my deepest gratitude for the remarkable care and expertise you provided to my daughter during a challenging time. Your compassion, dedication, and unwavering commitment to your patients truly shine through in every interaction.

When my daughter was wrongly diagnosed with cerebral ataxia by another doctor, we were filled with worry and uncertainty. However, your insight and thorough examination led us to a different diagnosis – OMAS (antibody syndrome). Your confidence and expertise gave us hope when we needed it most.

Thanks to your prompt intervention and tailored treatment plan, we have witnessed remarkable improvements in my daughter's condition within just one week. Her movements have gradually returned to normal, and we are filled with gratitude for your timely intervention.

Meeting you was nothing short of a blessing, and we are forever grateful for your expertise, compassion, and dedication to your profession. Your ability to accurately diagnose and effectively treat my daughter's condition has made a profound difference in our lives.

Thank you, Dr. Varsha Manohar, for your exceptional care and for being a beacon of hope and healing for our family. We are deeply indebted to you for your kindness and expertise.",2024-03-01 07:58:58,False,True,Nagaraj,,,
,,0,0,YES,"We are consulting Dr Varsha from past 1.5 months for my Son's speech delay/Autism/ADHD / Brain development situation. And I am really happy with the suggestions given by Varsha mam and we are seeing our son's progess day by day . Also, Dr Varsha technically explained all the possible scenarios and really liked the approach.
Thank you for all the efforts 🙏",2024-01-27 13:15:34,False,True,nithin,,,
,,0,0,YES,"I am really thankful...we wer struggling frm 9 years but, finnally we got a solution by her....
She gave a leachtur abt the procedure of the treatment patiently & in an understable language...she clarified all our doubt & respond immediately..
With regards...
Tharun kummara.V( parents)",2024-03-15 15:51:05,False,True,Verified Patient,,,
,,0,0,YES,"Am Victoria my son suffered from autoimune disease, after receiving some treatment from our national hospital in Tanzania(East Africa) then we fly to Brains hospital where by  Madam Varsha doctor treat him. *** ** * **** ****** she attended him very well explaining to me every step of treatment she make. Now my son is doing well.",2023-11-21 14:48:15,False,True,Victoria,,,
,,0,0,YES,"My daughter consult Dr venkatramana sir, but sir reffer to Dr varsha manohar madom. she is famous pediatric neurologists doctor .his treatment is well and good, excellent tallented. patient problem call for madom if any time call received patient problem guide some medicine and conversation very friendly thanks varsha madom and thanks venkatramana sir.my daughter day by day recover. ",2024-01-28 15:49:14,False,True,Verified Patient,,,
,,0,0,YES,"She was very helpful and beast brain Dr. Varsha in Bangalore. I am very happy and thank you so much .
      ",2024-01-23 05:31:43,False,True,Verified Patient,,,
