tags,context,found_helpful_data-review_yes_count,found_helpful_data-review_total_count,recommendation,review,reviewed_on,is_online_consult,recommends,patient_name,reply_text,replied_at,replier_name
,,0,0,YES,Very Nice. In his treatment for last 11 years. Always had satisfactory response and his treatment responded well,2021-04-01 08:13:28,False,True,user,,,
"Explanation of the health issue,","Heart Conditions,",0,0,YES,"Ty for your good duty.i have feel better after ur introductions.
My best wishes for u Dr and ur hospital.",2023-12-14 14:08:55,False,True,Verified Patient,,,
,,0,0,YES,I met doctor in March 2010.We went from Meerut.** ** *** **** ******* ******** Treats each patient giving full time and **** medicine. ** ** ******* *** *** *** *******,2021-01-28 07:49:24,False,True,Verified Patient,,,
"Treatment satisfaction,","Cardiac Ablation,",0,0,YES,** ** ***** ** **** **** *** ** * *******he checks very well and explains very well medicines prescribed by him are very good ** ** ****** **** ** *** *** **,2020-02-14 03:07:31,False,True,Verified Patient,,,
