tags,context,found_helpful_data-review_yes_count,found_helpful_data-review_total_count,recommendation,review,reviewed_on,is_online_consult,recommends,patient_name,reply_text,replied_at,replier_name
,,0,0,YES,overall experience with Dr Garima is good 👍. will recommend everyone . she is a good help and friendly too .. must visit,2024-07-18 14:52:16,False,True,Astha Kumari,,,
,,0,0,YES,"Our experience with Dr. Garima Maan has been very friendly, like a family member.  When we first went to her for the check-up, there were multiple questions, we were excited and at the same time bit anxious about the journey ahead. But she guided and built the trust so well that we started taking care of little things and got the right tests done at right time with her guidance. Though, both of us (me and my wife) have jobs located in cities away from Delhi but Garima ma'am was approachable all the time.  Her insightful diagnoses and patient-centered approach (seeing past history of medication) ensure comprehensive care. I strongly vouch for her and would recommend if you are looking for top notch care.",2024-06-07 13:32:19,False,True,user,,,
,,0,0,YES,"I would simply say that we need more and more Doctor like Garima Mam.. 
She is very helpful, friendly and gives full attention to the problems of patient.. 
When I met her first, for my partner, I was nervous about how to approach and get a solution that too with a Gyaneac.. But she calmed me and listened to our problem and gave genuine advice and medicine.. 
She is the best Gyaneac and great human.. Always available for help.. I am absolutely satisfied and happy and strongly recommend everyone.. 
Thank you mam.. 
Would recommend to everyone.. ",2024-04-30 16:50:02,False,True,Nitish Raj,,,
,,0,0,YES,"Dr. Garima had been of great help, amazing communication skills, she indeed worked like a therapist to me. My overall experience had been really easy. 
Definitely would recommend her to youngsters out there who are sceptical of visiting a gyneac. 
Loved it. ",2024-05-19 16:56:30,False,True,Sagari Paul,,,
,,0,0,YES,She is very caring and soft spoken. She is a dedicated Doctor. I am perfectly fine now.The way he talks is half of the cure for your problems.Dr. Garima maan listens to you very patiently & gives you sufficient time to say your problems.  I am perfectly fine now.,2024-04-30 17:31:33,False,True,Khushboo ,,,
,,0,0,YES,I was too scared to visit any gynae in the city due to privacy. But the day I met dr. Garima I knew I am going to visit her frequently. She is an amazing human being first and obviously a expertise in her field. She took care of me like a sister through out the treatment. I can't thank her enough. Stay well doc💖,2024-02-03 08:40:29,False,True,Verified Patient,,,
,,0,0,YES,"She  is very caring,polite and soft spoken. Gives maximum time to hear patient views. She ,self calls to patient and follow up their condition. I have not yet mer any other doctor like her.
",2024-02-07 15:45:47,False,True,Verified Patient,,,
,,0,0,YES,"She's too polite with patient. And too kind. 
He understood my problem very well
And solve my problem very well.
I was very happy with him.",2023-11-20 13:36:04,False,True,Verified Patient,,,
