tags,context,found_helpful_data-review_yes_count,found_helpful_data-review_total_count,recommendation,review,reviewed_on,is_online_consult,recommends,patient_name,reply_text,replied_at,replier_name
None,"Meniscus Injury,Arthroscopy,ACL Surgery,",0,0,YES,Well behaved and experienced. Explains the diagnosis and its treatment to the details. Carried out successful surgery. Even replies back any queries on phone. ,2016-11-27 12:08:16,False,True,Cliston,,,
"Doctor friendliness,Explanation of the health issue,Treatment satisfaction,Wait time,","Knee Pain Treatment,",0,0,YES,Dr Vaibhav makes you feel as if your problem is something which can be set right without any complications. Very friendly and full of energy,2017-07-23 23:48:16,False,True,Verified Patient,,,
None,"Joint Replacement Surgery,",0,0,YES,Doctor is very cordial and patient. He addresses all ur issues. Gives a lot of time and explains the entire procedure. Post knee surgery Im doing excellent and recommend him to all.,2016-04-17 18:29:52,False,True,Verified Patient,,,
"Doctor friendliness,Explanation of the health issue,Value for money,Wait time,","Orthopedic Physiotherapy,",0,0,YES,Good excellent doc good explanation and hopes given by him happy wid the service given would recmmond people in future and will visit soon,2018-12-30 08:36:04,False,True,Verified Patient,,,
"Doctor friendliness,Explanation of the health issue,","Joint Pain,Knee Dislocation,Lower Back Pain,Joint Mobilization,",0,0,YES,Excellent experience friendly talking better experience resinable price good realason patinent best advice. ,2018-11-21 15:27:57,False,True,Verified Patient,,,
