tags,context,found_helpful_data-review_yes_count,found_helpful_data-review_total_count,recommendation,review,reviewed_on,is_online_consult,recommends,patient_name,reply_text,replied_at,replier_name
,,0,0,Yes,My wife had visited the hospital and it was gynaecology related. ********* *** **** ** ******* I can definitely recommend the doctor to my family or friends. Scanning was done. There was no waiting time in the hospital when we went as we booked prior appointment. Doctor was friendly.    ,2021-06-09 03:48:59,False,True,Meenakshi,,,
,,0,0,Yes,My wife had consulted the doctor and it was for gynaecology related. Doctor was good in consulting her. I can definitely recommend the doctor to my family or friends. We went for normal consultation. There was no waiting time in the hospital when we went. Doctor is very friendly and we are checking with her since 2 years. ,2021-06-09 03:37:23,False,True,Padmini R,,,
,,0,0,Yes,I had went for gynaecology related. ********* *** **** ** ******* I can definitely recommend the doctor to my family or friends. Tablets were prescribed by the doctor. There was no waiting time in the hospital when we went. Medical tests were done. ,2021-06-05 15:23:08,False,True,Rajesh Singhmar,,,
,,0,0,Yes,"My wife had been to hospital and consulted the doctor for a gynae issue. ********* *** **** ** ******. I am satisfied with the explanation given by doctor.  I can surely recommend doctor to others. They referred us to another doctor. There was no waiting time in the hospital when we went. The concern was clinic staff were not professional, to the consultation fees it will take 30 minutes. Front desk team is not good.",2021-04-23 05:39:06,False,True,Venkataramana S,,,
,"Endometriosis Treatment,",0,0,YES,"Dr is very nice.She listens the concern with 
paitence and explains everything very clearly.I had great experience with her .I would strongly recommend this Dr.",2022-06-14 07:29:45,False,True,Ipsita Parida,,,
,,0,0,Yes,I had met the doctor and it was for gynaecology related. Consultation was fine by the doctor. I have already recommended the doctor to my family or friends. There was waiting time in the hospital when we went. It was for 30 minutes. Tablets were prescribed by the doctor. Tests was done and she was very friendly. ,2021-06-05 15:21:47,False,True,Verified Patient,,,
"Doctor friendliness,","Pregnant,",0,0,YES,Dr Lakshmi kumari is well experienced care us like her family members explain us in detail guide us well and can drop msg anytime.I had a good journey of my pregnancy of 9 months.I had cyst in my ovary doctor referred me another well experienced like her and Dr Lakshmi kumari was in touch with me during my laparoscopy and evn now.Thank you doctor ,2020-03-15 14:59:59,False,True,Verified Patient,,,
"Doctor friendliness,Explanation of the health issue,Treatment satisfaction,Value for money,","Vaginal Infection,",0,0,YES,Doctor is friendly and treated well and explained me about the problem and everything  i recommend the doctor,2020-03-03 04:28:38,False,True,Verified Patient,,,
