tags,context,found_helpful_data-review_yes_count,found_helpful_data-review_total_count,recommendation,review,reviewed_on,is_online_consult,recommends,patient_name,reply_text,replied_at,replier_name
"Doctor friendliness,Explanation of the health issue,Treatment satisfaction,","Dental Surgery,",0,0,YES,"He is down to earth .I was scared before the treatment but  he made me feel comfortable. ** ** ****** ** *** ****.

I didn't realize when my treatment got over .

This textbox has really less space to write about him .I totally recommend him .",2022-05-07 13:59:43,False,True,Vibha bhatt,,,
"Doctor friendliness,Treatment satisfaction,","Wisdom Tooth Extraction,",0,0,YES,He is just too good. No pain at all . Even the anesthetisa injection did not pain. I have got extractions done before but doctor shah is too good,2021-01-12 07:42:54,False,True,Deepti suri,,,
"Doctor friendliness,Explanation of the health issue,Treatment satisfaction,Value for money,Wait time,","Surgical Extraction(Bony),",0,0,YES,"I was surprised with the quick removal of my tooth. It was not at all painful, and very very quick. ",2021-11-09 09:31:19,False,True,Anamika George,,,
