tags,context,found_helpful_data-review_yes_count,found_helpful_data-review_total_count,recommendation,review,reviewed_on,is_online_consult,recommends,patient_name,reply_text,replied_at,replier_name
None,None,0,0,Yes,"I have been seeing Dr Mohan Raut for d past 3 yrs now and from day 1 i had faith in d way he spoke, diagnosed n treated me. I m glad for the treatment and consulting he provided in person, over msgs or phone calls. I delivered twin bful boys at his hospital and not once did i have any doubts about the way d delivery will happen or whether i will be fine or d babies will be okay. He is indeed an excellent doctor n a very gentle n humble soul esp due to his approachable n kind nature. Thank you doctor and your staff for all d help and love u gave me n our family throughout d years.",2016-06-06 15:12:43,False,True,Satpal Kaur Anand,,,
None,"Recurrent Pregnancy Loss,",0,0,Yes,Visited for recurrent pregnancy loss. The doctor has explained the further course of action in detail. He has cleared all the doubts and made us comfortable. The hospital is very neat and hygienic. Blood collection rooms were also very neat. Reception staff and nurses were energetic and friendly.  Have obtained the confidence to be successful in the future in getting our own baby.,2018-01-28 17:44:03,False,True,Teja,,,
"Doctor friendliness,Explanation of the health issue,Treatment satisfaction,Value for money,Wait time,","Pregnancy Check Up,",0,0,YES,He is really friendly and helpfull  doctor. He explains all the details in very simple language so that every one can understand.,2017-09-05 13:50:57,False,True,Shweta Rahul Soparkar,,,
"Doctor friendliness,Explanation of the health issue,Wait time,","Infertility Evaluation / Treatment,PCOD/PCOS Treatment,",0,0,YES,Overall experience was quite pleasant. Doctor listened our problems carefully n explained wht need to be done further.He was not in hurry to explaining.. N quit pleasant. ,2019-08-25 07:19:18,False,True,Pradeep Kumar,,,
"Doctor friendliness,","Pre-Pregnancy Counselling,",0,0,YES,"Wonderful experience, the consoling really helped us to think positive and hoping for the best yo happen 👍 ",2018-06-09 14:35:17,False,True,Pramod Nair,,,
"Doctor friendliness,Explanation of the health issue,Treatment satisfaction,Value for money,Wait time,",None,0,0,YES,It was awesome and great experience and very pleased to have must such a good doctor. Just to say thanks doctor,2018-03-17 13:14:29,False,True,Verified Patient,,,
None,"Gynae Problems,",0,0,YES,"Wonderful. Dr. Raut was very attentive, soft spoken, encouraging and very professional at the same time personal in his approach. I was very happy to have gone there. ",2016-08-28 04:43:16,False,True,Verified Patient,,,
