tags,context,found_helpful_data-review_yes_count,found_helpful_data-review_total_count,recommendation,review,reviewed_on,is_online_consult,recommends,patient_name,reply_text,replied_at,replier_name
"Doctor friendliness,Explanation of the health issue,Treatment satisfaction,Value for money,","Fibroid Removal,",0,0,YES,"My mom is 65 year old I met this dr while searching online. I was  bit hesitant but when I met Dr Dimple, she was a surprise to me. Her staff behavior made everything easy for us.

Dr Dimple experience help us to recover early. Strongly recommend her for treatment",2017-04-04 12:13:57,False,True,Vijaya ,,,
"Doctor friendliness,Explanation of the health issue,Value for money,","PCOS,",0,0,YES,"Dr is very friendly, staffs are so concerned and caring. Totally recommend for 
PCOS.

Thanks you so much Dr for the Service.",2017-04-04 12:05:29,False,True,Gabande,,,
"Explanation of the health issue,Treatment satisfaction,Value for money,Wait time,","Fertility Treatment,",0,0,YES,"I visited dr for my wife treatment. I found staffs and Dr very helpful. Dr approach to treatment is wonderful. Definitely recommend Dr Dimple for Infertility treatment. Thanks Dr.
  ",2017-04-04 12:20:36,False,True,Verified Patient,,,
None,"Infertility,",0,0,YES,"First doctor solved my all the doubt about my health
She is very pleasant she guid me perfectly and also giving perfect advise",2017-02-06 13:11:37,False,True,Verified Patient,,,
"Doctor friendliness,Treatment satisfaction,Explanation of the health issue,","Pregnancy Check Up,",0,0,YES,,2017-09-13 14:33:45,False,True,Ankit Das,,,
