tags,context,found_helpful_data-review_yes_count,found_helpful_data-review_total_count,recommendation,review,reviewed_on,is_online_consult,recommends,patient_name,reply_text,replied_at,replier_name
None,None,0,0,YES,"I delivered my child 17 years back at Dr.Shah's Ashwini Hospital ,Dadar (west) and had a hysterectomy last year. Dr.Vikram Shah performed the surgery.  
You feel  comfortable and safe in hands of Dr.Shah.
Thanks
",2021-05-30 15:57:58,False,True,Asavari Phadke ,,,
"Explanation of the health issue,Treatment satisfaction,Value for money,","Pregnancy,",0,0,YES,"Dr. Vikram Shah is a very warm yet to-the-point kind of a doc and explains everything very patiently despite the huge queue of patients waiting outside to meet him. Simplicity is his biggest highlight! Despite the amount of work he does, he is always available to his patients. I would reccomend him anyone who has lost all hope. At times some positivity is all you instead of expensive treatments. Thank you Doc!!",2019-01-23 07:33:11,False,True,Verified Patient,,,
None,"Stomach Cramps,",0,0,YES," Pleasant experience 
Adequate personalised care.... for my wife.. 
Patient and explains everything in detail.. 
Experienced and caring",2017-07-05 15:50:33,False,True,Gaurav,,,
None,"Pregnancy,",0,0,NO,"You will have c section for C SECTION FOR sure. Everything will be fine will let month, suddenly some complications on the list month and they will advise for C section. ** ******** **** **** *** ****** ** ****** ******** *** **** ** * **** ** * ********

He is Dr , he will give you some filmy reason for that. Best luck. Paying reasonable amount for treatment ** ***** but being fooled cause Dr I'll advised suggestions is not ok.",2017-04-12 19:59:03,False,False,Suman,,,
None,None,0,0,YES,"You feel safe in the hands of Dr. Shah.  He gives you enough time and attention,",2015-08-10 05:56:14,False,True,ANANYA HARVANDE,,,
"Doctor friendliness,Explanation of the health issue,Treatment satisfaction,Value for money,","Labor and Delivery,Pregnancy care and management,",0,0,YES,Excellent experience. Very friendly staff and doctors. All queries across the 9 months were resolved wenever required. Will definitely recommend. ,2018-08-21 15:24:15,False,True,Verified Patient,,,
