tags,context,found_helpful_data-review_yes_count,found_helpful_data-review_total_count,recommendation,review,reviewed_on,is_online_consult,recommends,patient_name,reply_text,replied_at,replier_name
,,0,0,YES,"Good pediatrician is a boon for working mothers. I have been visiting Dr vineeta Rajput ,a renouned pediatrician in New Delhi for my elder daughter for the last 4 years.
she is  a  very caring and friendly doctor. She always gives the right and valuable consultation. Over a period of time I have developed such a faith in her that now  even though I am out of delhi I am taking videoconsultation for my newborn  baby and got satisfactory results. I highly recommend her for best diagnosis and treatment.",2020-05-22 10:36:16,False,True,Priyanka chauhan ,,,
"Doctor friendliness,Explanation of the health issue,Treatment satisfaction,Value for money,Wait time,",,0,0,YES,"I have visited Dr  Vineeta  Rajput's clinic many times for my son and he  always recovered quickly  .she is extremely kind *** ** ********* *******
During this lockdown  I took videoconsultation also  from her and 
I am so thankful to have such a wonderful child specialist in my vicinity .She is a boon to my son.",2020-05-19 15:02:34,False,True,Chandra mohan (adv.),,,
,,0,0,YES,"I took my daughter to Dr. Vineeta, ma'am experience was very good, she looked after my daughter very well and now my daughter is fine.",2024-03-27 03:19:18,False,True,Verified Patient,,,
"Explanation of the health issue,","Childhood Infections,",0,0,YES,The diagnosis process and treatment for the same is remarkable. Step by step clarification was also provided.,2021-05-23 13:08:33,False,True,AYANSH RANJAN,Thank you,2021-05-24T09:31:04+0000,Dr. Vineeta Rajput
