tags,context,found_helpful_data-review_yes_count,found_helpful_data-review_total_count,recommendation,review,reviewed_on,is_online_consult,recommends,patient_name,reply_text,replied_at,replier_name
,"Children's Health,",0,0,YES,Doctor has friendly behaviour. He has listening attitude. It was very comfortable to tell doctor about what issue we are facing. Thanks!,2022-06-08 15:40:04,False,True,Sakil Alam,,,
"Treatment satisfaction,","stomach and intestinal infections,",0,0,YES,doctor is really experienced and understood the problem well. the disgnosis was excellent. my kid felt well within 3 days,2021-08-29 14:45:17,False,True,Anshu,,,
"Doctor friendliness,Explanation of the health issue,Treatment satisfaction,Value for money,Wait time,",,0,0,YES,he is a very nice doctor..explains everything so well..very much satisfied..do refer him for any kind of child problem,2020-12-01 08:42:16,False,True,Priyanka Aditya Sharma,,,
"Explanation of the health issue,Treatment satisfaction,Value for money,Wait time,","Cough In Children,",0,0,YES,We were always reassured that excessive medicines were never prescribed for our child and the doctor would take a holistic approach to treatment. His time-taking explanation of issues is also something that we miss in doctors these days. Our only regret at moving away was not being able to continue with him as our child's paediatrician. Would always recommend Dr. Ghatak to all parents especially first-timers.,2020-05-12 09:51:51,False,True,Verified Patient,Thanks for your kind feedback. Keep safe.,2020-05-13T03:41:23+0000,Dr. S. Ghatak
,"Newborn Jaundice,",0,0,YES,"The doctor patiently listened to our concrn, checked the newborn with professional care and explained the medical condition and the management in an unhurried manner. He is our baby's doctor from now on.",2022-09-29 15:17:33,False,True,Verified Patient,,,
,"Children's Health,",0,0,NO,"********* ***** *** *** ** *** ********** After three day anti biotics course, there is no respite. Doctor claimed that Medicine will help in a day.",2022-09-29 03:52:26,False,False,Verified Patient,"You should have reverted back to me if the problem persisted, which you never did. 

",2022-09-30T09:11:32+0000,Dr. S. Ghatak
"Explanation of the health issue,Treatment satisfaction,Wait time,","Cough In Children,",0,0,YES,**** **** *******no waiting time Crisp consultation to try point explanations. Every professional attitude,2022-07-07 04:55:55,False,True,Verified Patient,,,
