tags,context,found_helpful_data-review_yes_count,found_helpful_data-review_total_count,recommendation,review,reviewed_on,is_online_consult,recommends,patient_name,reply_text,replied_at,replier_name
,"Stomach pain and stomach upset,",0,0,YES,Dr. Issar listened the problem patiently and prescribed the good medicines which helped in curing the problem. ,2023-10-20 04:32:24,False,True,Paramjit Singh,,,
"Doctor friendliness,Explanation of the health issue,Treatment satisfaction,Value for money,",,0,0,YES,Nothing significant. Excellent doctor and his advice. Seen patient personally amd takes care of the patient.,2024-02-29 13:54:38,False,True,Verified Patient,,,
,,0,0,NO,Takes multiple visits for small problem. Recommend only one particular diagnostic centre. I am not going again. Thats my individual opinion's.,2024-05-17 15:31:39,False,False,Verified Patient,,,
,,0,0,YES,"Very humble doctor. Listens each and every problems in details and prescribes appropriate medications. Btw I suffered from typhoid fever and doc completely cured me in 12 days. Very happy and satisfied with Dr VS Isser. 
Thanks again",2023-09-11 06:42:39,False,True,Yogesh Khadiya,,,
,"Consultation,",0,0,YES,Doctor understood the issue & explained it well with good *** ********* ********** He made me comfortable & could comfortably talk to him. ,2023-12-21 14:35:10,False,True,Verified Patient,,,
,,0,0,YES,Dr. Isser is very patient and gentle. He listens to you very carefully. Spends enough time going through your reports and answering your questions.,2022-07-27 11:56:19,False,True,Verified Patient,,,
