tags,context,found_helpful_data-review_yes_count,found_helpful_data-review_total_count,recommendation,review,reviewed_on,is_online_consult,recommends,patient_name,reply_text,replied_at,replier_name
None,None,0,0,YES,Met mrs. Sruthi for my reduced Saliva secretion which is identified as stress induced related to sjogrens syndrome. Mrs. Sruthi was really friendly and i whatsapp her whenever I have doubts . She replies even during mid nights in her busy schedules. Her treatment was very rapid for me and slowly it started with my recovery and now I am completely recovered. Her timely help and selflessness was whole thing that helped me overcome my diagnosis. I definitely would recommend her for oral and other health issues ,2024-01-27 17:12:20,False,True,Poornima,,,
None,None,0,0,YES,"With utmost appreciation, I would like to express my heartfelt thanks to Dr.Shruthi Murali for the exceptional treatment I received for my lockjaw. Your professionalism, meticulousness, and kind demeanor made the entire process much more manageable. Thank you for ensuring my long-term well-being",2024-02-01 08:37:53,False,True,Kanakadurga,,,
None,None,0,0,YES,"A very humble, kind, and passionate doctor, with unbelievable clinical expertise. I witnessed some general physicians seeking her opinion in diagnosing immune disorders. She takes a detailed history and minimizes the use of Xrays or other modalities to zero in on the correct diagnosis. She ensures that the patient is well-informed of his/her condition and also follows up on her own with personal interest and no extra charge.",2024-01-31 14:15:10,False,True,Mahalakshmi Desigan,,,
None,None,0,0,YES,Good Pal Doctor. Has been very friendly while consulting. Recommendation 10/10. Avoids recommending more tablets.,2024-01-26 21:52:33,False,True,Srinivasan,,,
None,None,0,0,YES,Contacted Dr.Sruti Murali for oral ulcer. She patiently heard the whole medical history and prescribed medicines for 3 days. I was relieved of pain on the 2nd day itself. She has a pleasing approach and explains the condition in a simple language which is appreciable. ,2024-01-24 19:49:45,False,True,Verified Patient,,,
None,None,0,0,YES,I took my friend for broken tooth....he was very quickly diagonised and given treatment. This doctor never goes for unnecessary tests. Treats patients well. Her patient hearing and approaches makes patients recover soon.,2024-01-30 05:08:21,False,True,Verified Patient,,,
None,None,0,0,YES,She really understands the issue well by asking right questions and gives a proper solution. Would definitely recommend her.,2024-01-28 15:48:45,False,True,Verified Patient,,,
