tags,context,found_helpful_data-review_yes_count,found_helpful_data-review_total_count,recommendation,review,reviewed_on,is_online_consult,recommends,patient_name,reply_text,replied_at,replier_name
None,None,0,0,YES,Dentist Jayabal  is excellent in hsndling patients.If v feel any discomfort while doing  any treatment he hs patience to cooperate which most of the doctors dont hv.And  I feel very comfortable and well taking treatment under him.He is doing everything quickly and  correctly. No severe pain and very comfortable. ,2015-04-24 09:54:30,False,True,Sajeetha Parveen,,,
None,None,0,0,YES,"My dental needs were done professionally and timely manner which is beyond my expectations 

During my visit I got fillings and crown done .

Doctor and assistant were very helpful.

Mahendran 

",2023-03-27 04:24:02,False,True,Mahendran Theivendra,,,
None,None,0,0,YES,I approached Denticare for Dental full crown . Right from appointment to completion of dental procedure was smooth. Dr. Gnanaraj was patient enough to answer my concerns.  would recommend to my friends and relatives.,2023-02-09 08:24:54,False,True,Franklin Eden,,,
None,None,0,0,YES,Recently went for a consultation and was suprised to see such clean and appealing ambience. Friendly staff. Clear and approachable dentist. Patience to clarify my doubts. Will definitely recommend to friends and family. ,2023-02-07 11:20:17,False,True,Margrate Susairaj ,,,
None,"Toothache,",0,0,YES,Very dedicated professional  doctor and reasonable fee for the treatment. i really appreciate and admire his  professionalism.,2016-11-21 03:31:43,False,True,Tamilsangu,,,
"Doctor friendliness,Explanation of the health issue,Treatment satisfaction,Value for money,","Misaligned Teeth,Abnormally Shaped Teeth,Tooth Loss,",0,0,YES,Such a wonderful doctor. very well patient friendly. explains and each everything to the patient clearly. ,2019-01-08 13:15:32,False,True,Akshaya,,,
None,None,0,0,YES,Excellent facility and a one stop solution for all dental problems. Doctor is very friendly and listens patiently. He is precise in execution. Well trained staff. Definitely would recommend Denticare.,2023-03-07 02:37:23,False,True,Verified Patient,,,
None,"Dental Cavities,",0,0,YES,I'm fully satisfied with his service and iam much happy..and in future i will suggest him to my friends and family members circle,2016-01-23 11:18:38,False,True,Verified Patient,,,
None,None,0,0,Yes,Very friendly doctor and good service provided.,2015-11-02 13:19:03,False,True,Chennai,,,
