tags,context,found_helpful_data-review_yes_count,found_helpful_data-review_total_count,recommendation,review,reviewed_on,is_online_consult,recommends,patient_name,reply_text,replied_at,replier_name
"Doctor friendliness,Treatment satisfaction,Value for money,","RCT - Root Canal Treatment,",0,0,YES,Dr Smrithi did a re root canal surgery to me.I was suffering with failed root canal for the past one year as the previous doctors were not able to find the exact cause of the problem.Smrithi rescued me by performing a proper examination via multiple scans and found out the root issue.She gave multiple sittings and removed all the decay properly until it vanished to zero.it has been two months now and I have not faced any issue in that teeth and I'm using the teeth to chew and enjoy my food .I would definitely recommend smrithi for her patience * *** ********* *,2024-04-05 04:31:48,False,True,Swatipriya,,,
"Doctor friendliness,Explanation of the health issue,Wait time,","Dental Fillings,",0,0,YES,The doctor listened to my dental issue. She  examined and then suggested treatment to fix tooth decay.  The treatment has started and hope to get fully well,2024-01-18 13:58:37,False,True,Kamala,,,
,,0,0,YES,"I had an impacted tooth extraction by a surgeon from the same hospital (Glow Dental) and got pre-surgical and post-surgical assistance from Dr, Smriti.  She handled it in a good way.  
",2024-02-05 07:02:20,False,True,Verified Patient,,,
"Doctor friendliness,Value for money,Wait time,","Scaling / Polishing,",0,0,YES,Good explain about the issues clear and crystal.Minimal waiting time and utilising the latest technology equipment. ,2024-01-27 10:34:02,False,True,Verified Patient,,,
"Doctor friendliness,","Dental Examinations,",0,0,YES,"Excellent., cordial, ************** prompt analysis of problem and offering instant remedy with complete professionalism. ",2023-12-16 10:29:34,False,True,Verified Patient,,,
