tags,context,found_helpful_data-review_yes_count,found_helpful_data-review_total_count,recommendation,review,reviewed_on,is_online_consult,recommends,patient_name,reply_text,replied_at,replier_name
None,None,0,0,YES,"Thanks for caring treatment 
Good friendly assistance

From the day1 till end of the treatment , the same way of polite approach by doctor 
Explained well
Now I feel happy 

Dr.krithika mam so caring and wonderful treatment


Thanks for making me smile hehehehe ",2016-01-23 12:16:55,False,True,S.Lavanya,,,
None,None,0,0,YES,Dr.Davis sir is just awesome and really friendly to get things clarified.. He is a really experienced person and has magic in his hands too.. He is so jovial that we spend so much time talking to him.. ,2015-08-15 08:53:04,False,True,LAKSHMI,,,
"Doctor friendliness,Explanation of the health issue,Treatment satisfaction,Value for money,",None,0,0,YES,"Good ********* *** experience, doctor is very friendly .Very much satisfied with the treatment we are undergoing.",2021-04-01 13:58:02,False,True,Verified Patient,,,
