tags,context,found_helpful_data-review_yes_count,found_helpful_data-review_total_count,recommendation,review,reviewed_on,is_online_consult,recommends,patient_name,reply_text,replied_at,replier_name
None,None,0,0,YES,"I went to this doctor with heavy back ache. He was not hurrying up unlike other docs, was very patient in listening fully to me, explained me my problem with the help of few pictures and prescribed me medicines. Even though I was in a position to go for any tests due to my pain, he advised that he will prescribe for xrays only if the pain does not come down in a week. I felt he is quite different from others in that sense too... were I usually end up in doing multiple tests even for simple ailments. ",2016-03-04 11:10:08,False,True,Uma Maheswari,,,
None,None,0,0,YES,"I am very much thankful Dr. Prashanth who helped for my son's knee surgery were I was very much disappointed in his matter but he helped to handle the situation very much patiently

Thank you Dr. ",2019-12-26 08:57:43,False,True,Lakshmi jayamuthappa,,,
None,None,0,0,YES,"He  is good in explaining the terms of pain and how to get rid of pain..
He gives clear explanation regarding the problem . i felt happy to know the things in detailed manner",2016-03-04 06:36:03,False,True,Bhargavi,,,
None,None,0,0,YES,A really great experience and nice doctor. I would recommend him to anyone who needs him. My son went in with a broken leg and a week later we went in again and came out with a recovered foot.,2016-02-28 14:23:29,False,True,Sanita Ortho Op,,,
None,None,0,0,YES,He saw us before appointed time. He was very attentive and understood health condition very quickly.,2021-01-25 12:59:11,False,True,Ganesh Melarkode,,,
"Doctor friendliness,Treatment satisfaction,Wait time,","Sprain,",0,0,YES,My 2 year old son sprained his elbow while playing. He walked crying and walked out smiling. Wait time and consultation time was very less. ,2019-05-22 14:44:23,False,True,Verified Patient,,,
