tags,context,found_helpful_data-review_yes_count,found_helpful_data-review_total_count,recommendation,review,reviewed_on,is_online_consult,recommends,patient_name,reply_text,replied_at,replier_name
,,0,0,YES,"Excellent  service, highly recommended. 
Dr sundeep and Dr Deepthi was so caring  and staffs are all friendly and did an excellent  job.i have always  had stress with dentists  due to a horrible  experience  when I was a child . However, I feel so comfortable  with Dr sundeep and  Dr Deepthi  and staffs that I don't feel stressed! and I got my implants  done here .I am satisfied  with treatment  and now I reffer my collegue,friends and family.i will advise everyone  one for any dental problems this is one stop solution.  It is very cost effective  as compare to other clinics dAnd skin, hair treatments also done here good  results  for hair and skin treatments  .Thank you Dr's. ",2022-03-31 12:57:53,False,True,Verified Patient,Thank you so much for taking the time to leave us a feedback - it's much appreciated!,2022-04-17T15:25:01+0000,Dr. Mata Sundeep
,"Wisdom Tooth Extraction,",0,0,YES,"The doctor was good and professional. Explained the treatment procedure very well Overall it is a good experience.
",2023-09-27 03:42:37,False,True,Vishnuvardhan C,,,
"Doctor friendliness,Explanation of the health issue,Treatment satisfaction,Value for money,Wait time,",,0,0,YES,Dr.Sundeep has explained the treatment procedure clearly and guided us with the better treatment and follow up sessions are also done periodically. I am quite comfortable with the treatment going on.,2022-09-04 06:46:14,False,True,Verified Patient,,,
"Treatment satisfaction,",,0,0,YES,"Friendly docters and very good treatment, good hospitality, they will give a good advice regarding particular problem",2022-04-21 08:53:20,False,True,Verified Patient,,,
"Doctor friendliness,Explanation of the health issue,Treatment satisfaction,Value for money,","Dental Crowns,",0,0,YES,The doctor is more efficient in tratment of dental problems & explaination of problems in well understanding manner,2022-04-17 11:02:38,False,True,Verified Patient,Thank you so much for taking the time to leaving feedback - it's much appreciated!,2022-04-18T14:41:53+0000,Dr. Mata Sundeep
