tags,context,found_helpful_data-review_yes_count,found_helpful_data-review_total_count,recommendation,review,reviewed_on,is_online_consult,recommends,patient_name,reply_text,replied_at,replier_name
"Doctor friendliness,Explanation of the health issue,Treatment satisfaction,","Post and Core,",0,0,YES,"Both the Doctors, Keerthana & Vinay Kumar Yadav explained the procedure in such a detail that I was left with no further questions.  Extracting the wisdom tooth was totally painless and even after one day, I am not feeling any pain.  Even post extraction, gargling with salt water, continuing the antibiotics till the cycle is complete is explained thoroughly.  I wish these Doctor all the Best and to get more and more opportunities to treat the people in the same way.",2024-04-03 07:07:43,False,True,N.S Srinivasa Murthy,,,
,,0,0,YES,I had met with an accident a few months back which had resulted in facial fractures and lacerations. Dr.Vinay sir and Dr.Keerthana mam had treated me and had done a very fine job to make sure that the stitch marks are not visible to the eyes. I am very satisfied with the results.Very friendly doctors who are very responsive to all the queries and clarifies all our doubts very patiently. Definitely would recommend them to everyone.,2023-11-02 04:14:17,False,True,Tejas Gowda J,,,
,,0,0,YES,I have visited VK Dental Care for my mother complete teeth implant at the age of 65 she got this treatment and recovered soon....All credits to Dr Vinay and Dr Keerthana both are very patient to answer to al our queries and soft spoken at same time very professional and clinic is very clean and hygiene.Equipments are top notch.Thank u Dr Vinay and Dr Keerthana 😊,2023-11-01 10:45:42,False,True,Devaraj ,,,
,,0,0,YES,I had a very good experience at VK dental clinic despite my anxiety. I visited them to get a missing tooth replaced. Dr Vinay performed implant surgery and it was completely pain free with minimal discomfort after procedure. I highly recommend VK dental care for all your dental requirements.,2023-09-24 14:23:44,False,True,Kiran K,,,
,,0,0,YES,Overall treatment is good . The services were good and the staffs and doctors were excellent in all ways .,2023-11-01 10:25:18,False,True,Nirmitha C,,,
,,0,0,YES,"Very good treatment  and the doctor was very friendly. The clinic atmosphere is very good . Thank you for the care.
",2023-11-01 08:48:36,False,True,Kempamma ,,,
,,0,0,YES,"A very good doctor who always cares her patients. The way she handles the patients is very much impressive.
And the clinic is well maintained with the good equipments.",2023-11-01 08:22:32,False,True,Anjali G,,,
,,0,0,YES,Was happy with overall experience and clinic was clean and hygiene and Prices are also very affordable ,2023-11-01 08:13:10,False,True,Vedanth ,,,
,,0,0,YES,"Best dental clinic in the locality which is affordable price 
Highly satisfied with the experience 
",2023-11-01 09:01:35,False,True,Verified Patient,,,
