tags,context,found_helpful_data-review_yes_count,found_helpful_data-review_total_count,recommendation,review,reviewed_on,is_online_consult,recommends,patient_name,reply_text,replied_at,replier_name
,,0,0,YES,I met with doctor to consult my Nose bone and check muscle stretch pain. He took proper time and prescribed required medicines. Feeling much better,2021-09-29 18:39:20,False,True,lohit seth,,,
,,0,0,Yes,I had slight injury on my left hand finger so  I had met the doctor he treated me really well had no issue everything went quite normal i would recommend the doctor to others as well,2021-05-11 06:15:20,False,True,Shabab Akhtar Rabbani,,,
,,0,0,NO,"He is so hurry and wanted to close the consultation ASAP ******* ****** ******* ************** He is not ready to listen what patient want to explain. He simply cuts the conversation and suggesting to visit hospital physically. ** * *** *** *** ******** ***** *** ****** ******* ****** ************* He did not even do a video call, I was expecting that. ** ** ****** ****** **** ********* ********",2021-06-11 03:47:49,True,False,Aleti Mahipal Reddy,,,
,,0,0,NO,"The doctor was in a hurry to close the case. I told him about background so that he can start with new treatment way but he was adamant on why i havent started treatment from somewhere else and asking me to go to a hospital. If i was able to go to hospital during this pandemic time, why wld i come to practo for starting online therapy. Also the doctor gave me same medicine i am using currently after asking me, which isnt helping much.This was a total non productive consultancy session for me",2021-05-21 15:48:22,False,False,gaurav pandey,,,
,,0,0,YES,Great exp. ****** ************* *** able to resolve older issues. Excellent behavior and spend adequate time,2021-03-13 08:50:42,False,True,Shital Patel,Thanks a lot for your kind words.,2021-04-08T18:17:56+0000,Orthocure clinics
,,0,0,YES,"The Doctor is extremely patient and explained to me my situation in detail, did not recommend any unessesary tests or medicines & focused on long term health. Surely recommend him for back/knee issues. ",2020-07-29 05:22:33,False,True,Gunjan Dahiya,Thanks for your good words.,2020-07-29T08:51:04+0000,Dr. Om Prakash Gupta
,,0,0,YES,The doctor is very soft spoken. Not in a hurry. Explained things in details very politely.Would definitely recommend him for related health issues.,2020-04-29 04:07:50,False,True,Indu Devi,,,
