tags,context,found_helpful_data-review_yes_count,found_helpful_data-review_total_count,recommendation,review,reviewed_on,is_online_consult,recommends,patient_name,reply_text,replied_at,replier_name
None,"ACL Surgery,",0,0,YES,"Dr. Sunil Apsingi is a very patient friendly doctor. He treated me well and gave excellent support during and after the surgery, which was completed successfully. He also diagnosed the problem very efficiently and accurately. His focus is patient centric and he gives confidence to the patient. Overall a wonderful experience with Dr Sunil Apsingi. ",2016-05-10 19:44:44,False,True,Sriram Madhav Kommu,,,
"Doctor friendliness,Explanation of the health issue,Treatment satisfaction,Value for money,Wait time,","Shoulder Dislocation Repair,",0,0,YES,Doctor is very nice. He explains patient about the problem and then provides prescription. Doctor recommends tests only if required. Went for shoulder bone dislocation for my dad. I recommend this doctor. ,2019-02-07 09:15:45,False,True,Shanthan,,,
None,None,0,0,NO,"I went today. He will not treat well, just he will ask problem and suggests medicine s. The way of communicating is not upto the mark with patients. ",2022-01-03 19:34:56,False,False,Mallikarjuna,,,
None,None,0,0,NO,"I went for my sister for pain and swelling in feet when she walks more.

He was not listening properly.

We consulted thrice with this doctor but he didn’t responded well always use to say nothing is there.
If nothing is there then why swelling and pain occurs when she walks.
In this way we wasted around 1 year.",2022-02-12 15:49:08,False,False,Verified Patient,,,
None,"Hip Pain Treatment,",0,0,NO,"
Diagnosed well related to my issue but i Felt like the doctor is not user friendly. The waiting time was too high. ",2023-10-16 12:19:43,False,False,Verified Patient,,,
