tags,context,found_helpful_data-review_yes_count,found_helpful_data-review_total_count,recommendation,review,reviewed_on,is_online_consult,recommends,patient_name,reply_text,replied_at,replier_name
None,None,0,0,Yes,I had knee pain so I went to consult the doctor. The doctor was **** **** *** spoke well. The treatment was well. I was able to recover. Doctor gave the injection and did an X-ray. Even physiotherapy was done. I am satisfied with the treatment given. I can recommend doctor to my family or friends. Waiting time was not there. The staff was also good. I am having pain and need to visit again.,2020-06-16 18:04:59,False,True,K Ravindranath,,,
None,None,0,0,Yes,Treatment was nice. Doctor behaviour was good. He understood the issue very well and he helped to resolve my problem. I will give a rating of 8/10 to the hospital. Staff and everything was fine but before they have to mention the doctor timings which is helpful to patients to know which doctor is available.,2020-03-02 05:15:42,False,True,Verified Patient,,,
None,"Knee Pain Treatment,",0,0,YES,"Extremely kind and professional doctor , spent sufficient time to explain to me the causes and treatment . ",2023-07-26 08:50:23,False,True,Verified Patient,,,
"Wait time,","Foot & Ankle,",0,0,NO,"Very bad experience, he didn't come. Staff was continues telling dr is on the way but didn't come we waited one and half hr. Than I asked for some other dr. ",2018-09-05 05:59:50,False,False,Sukirti Agnihotri,,,
"Doctor friendliness,","Hand Surgery,",0,0,YES,Wonderful experience ********* ** ***** *** ***********they will take care each problem and listen to your problems first,2019-12-12 11:42:44,False,True,Verified Patient,,,
None,None,0,0,Yes,****** ********* *** ***** I am satisfied with the doctor treatment. There was not much waiting time for the doctor. Doctor behaviour was good and listened to our problem properly. I would like to recommend this doctor to my family and friends.,2020-01-12 18:33:13,False,True,Verified Patient,,,
