tags,context,found_helpful_data-review_yes_count,found_helpful_data-review_total_count,recommendation,review,reviewed_on,is_online_consult,recommends,patient_name,reply_text,replied_at,replier_name
,,0,0,YES,Dr. Rajesh Mohan Srivastava is an exemplary physician with a wealth of experience. His compassion and vigilance in follow-up care reflect his dedication to ensuring that patients receive the best possible outcomes. Dr. Srivastava is not only highly skilled but also genuinely invested in the health and well-being of his patients.,2024-07-28 10:42:48,False,True,Mohit Kumar,,,
,,0,0,YES,The doctor is really kind and attentive. He followed up himself to check up on my health. Would recommend highly. ,2024-08-07 02:26:30,False,True,Nupur Prakash,,,
,,0,0,YES,"I really liked his kind and generous way of explaining everything.
His dedication and continuous follow up on timely medication is highly appreciable .
Thanks a ton😊",2024-08-06 15:14:13,False,True,NEHA MANHAS,,,
,,0,0,YES,"It was really gd experience, he listened to my problem and seen all my reports and recommended me medicines .",2024-08-06 14:49:41,False,True,Aryak Chatterjee,,,
