tags,context,found_helpful_data-review_yes_count,found_helpful_data-review_total_count,recommendation,review,reviewed_on,is_online_consult,recommends,patient_name,reply_text,replied_at,replier_name
None,None,0,0,YES,We have visited Partha dental Kushaigudaa for my Brother’s teeth problem. He had multiple missing teeth and Dr.Vaishna Priya suggested us to go for Full mouth implants. Treatment was done within 4 days. Now he is able to eat good. Thank you so much Dr Vaishna Priya and Partha dental.,2023-09-29 11:14:35,False,True,MAHI,,,
None,None,0,0,YES,Dr.Vaishna consulted me .had a good treatment and a great experience  I was worried too go dentists but I had a calm n painlessly treatment thank you ,2023-09-16 13:16:42,False,True,Sushiee,,,
None,None,0,0,YES,Dr.vaishna priya has done good treatment.i was worried for pain.treatment was so comfort n painless.thank you,2023-09-10 08:42:12,False,True,Anitha,,,
None,None,0,0,YES,She is just amazing.her explaination is cool.i would definitely recommend her because she is too good with her subject.,2023-09-09 10:50:58,False,True,Manoj,,,
None,None,0,0,YES,"I had hair prblm. Visited partha Dr. Vaishna has consulted me and really suggested good hair treatment... I'm happy with the treatment. 
She has taken really good care ",2023-09-09 10:25:02,False,True,Vaishna,,,
None,None,0,0,YES,Grt experience...good RCT treatment .. over-all treatment is satisfactory  .Dr.vaishna has taken really good care.i do suggest partha kushaiguda,2023-09-09 10:22:18,False,True,Vijay,,,
None,None,0,0,YES,"I wanted to express my deepest thanks for the wonderful dental care you have provided. Your professionalism, attention to detail, and commitment to patient comfort have truly made a difference. It is evident that you genuinely care about your patients’ dental health.  You are a wonderful dentist and I'm  so grateful to have you as our dentist",2023-09-10 11:27:10,False,True,Verified Patient,,,
None,None,0,0,YES,Visited partha clinic consulted dr.vaishna had good experience Dr has given good treatment thank you,2023-09-29 10:34:45,False,True,Bhargavi,,,
None,None,0,0,YES,"I have tooth pain ,I visited partha Dr. Vaishna has consulted me, and suggested rct and implants. Treatment was done with utmost care and also painless treatment",2023-09-09 11:42:16,False,True,Verified Patient,,,
