tags,context,found_helpful_data-review_yes_count,found_helpful_data-review_total_count,recommendation,review,reviewed_on,is_online_consult,recommends,patient_name,reply_text,replied_at,replier_name
"Doctor friendliness,Explanation of the health issue,Wait time,",None,0,0,YES,Have gaps between teeth . Went for a consultation. Was very confused initially but Harsha mam explained me the best treatment possible and I went for aligners . undergoing treatment . Can already see my teeth changes and I'm happy .my self confidence has improved a lot .thank you Dr Harsha mam,2023-10-02 05:43:58,False,True,Harshitha Reddy,,,
"Doctor friendliness,Explanation of the health issue,Treatment satisfaction,Value for money,Wait time,","Gap Closing,",0,0,YES,I had gaps between my front teeth . I have visited the doctor for my gaps to be closed . Dr Harsha was very kind and she explained me about Aligners. She also gave me the all possible alternative options and she suggested me the best treatment outcome will be with aligners .Thank you so much Dr Harsha mam .,2023-09-30 04:51:24,False,True,Jyothi,,,
"Doctor friendliness,Treatment satisfaction,Wait time,","Laser Gum Surgery,",0,0,YES,Visited the dental clinic for my gums problem.My gums are red and swollen and Dr harsha mam told me about the necessary gum surgery to be done .Thank you Dr Harsha mam .Thank you partha Dental .,2023-09-30 07:32:09,False,True,Rajesh ,,,
"Doctor friendliness,Treatment satisfaction,Value for money,",None,0,0,YES,Dr Harsha mam explained me about the reason for my yellowish teeth and suggested me smile designing with zirconia crowns.  Very happy and satisfied with the treatment.  Thank you Dr Harsha mam. ,2023-09-30 05:05:59,False,True,Anitha,,,
"Doctor friendliness,Explanation of the health issue,Treatment satisfaction,Value for money,","Periodontal Flap Surgery,",0,0,YES,Have bleeding from the gums since past 6 months . visited Dr Harsha for the issue . She suggested me Laser treatment for the gums . Treatment was successful. Thank you Dr Harsha for the treatment.,2023-09-29 11:19:26,False,True,Rat anjali ,,,
"Treatment satisfaction,","Veneers / Laminates,",0,0,YES,"Happened to visit Dr Harsha for my yellowish teeth. She examined me through suggested me the needed investigations , went through it and then I have been explained about the various treatment options .I chose veeners for my smile correction. My treatment was done with precise and accurate results. Thank you so much Dr Harsha .
",2023-09-29 11:07:51,False,True,Verified Patient,,,
"Doctor friendliness,Explanation of the health issue,",None,0,0,YES,I have Visited the Partha clinic for severe acne issues Dr Harsha mam explained me about the procedure of mesotherapy that needs to be done.Went through few sessions Having amazing results.Thank you so much Harsha mam for the treatment.,2023-09-29 11:02:29,False,True,Verified Patient,,,
"Doctor friendliness,","Dental Surgery,",0,0,YES,"Visited partha dental for toothache ,Dr.harsha suggested for RCT ,thanks to Dr.Harsha for the treatment am very much satisfied with the service provided.i strongly recommend to my friends and family members",2023-09-29 10:49:52,False,True,Verified Patient,,,
