tags,context,found_helpful_data-review_yes_count,found_helpful_data-review_total_count,recommendation,review,reviewed_on,is_online_consult,recommends,patient_name,reply_text,replied_at,replier_name
,,0,0,YES,she is very nice person.. one thing the doctor must have is that patience.. she has a lot.. she is listening to everything  and gave me suggestions also..she is giving medication in such a way that they are effortable.. prescribing required medication only.. not more than that.. I am recommending her..,2021-04-01 14:22:07,False,True,Sowjanya Surendra,,,
,,0,0,NO,"Bad exp we we had wt this doctor she is patience less , she don't answer our questions properly**** ***** ********* ****** **** ** ******** ****** she don't talk politely and don't show kindness

Total I don't recommend Dr SV Lakshmi  to any pregnant womens who is 1st time  

We
literally got disppointed by her behaviour we were asking some questions she told I can not answer to all ur questions ",2023-12-23 07:28:19,False,False,Verified Patient,,,
"Doctor friendliness,Explanation of the health issue,Treatment satisfaction,Value for money,","Gynae Problems,",0,0,NO,"
I would never recommend this doctor.

She was not at all professional *** ****** ****** **** * ******.
As a doctor she should try to make patients feel easy and not scare them.

",2021-01-31 04:47:08,False,False,Verified Patient,,,
