tags,context,found_helpful_data-review_yes_count,found_helpful_data-review_total_count,recommendation,review,reviewed_on,is_online_consult,recommends,patient_name,reply_text,replied_at,replier_name
,"PCOD/PCOS Treatment,",0,0,YES,Dr. Ankita is a great listener and does not prescribe any unnecessary medications and guides you to help yourself naturally rather than putting you on hormone pills. Highly recommend visiting her.,2024-06-06 15:32:56,False,True,Verified Patient,,,
,,0,0,YES,"Very caring and well explained about problem.

Clearly explained about to take medicine timings.

Thanks",2022-04-19 09:12:47,False,True,Vishnu Reddy,,,
,,0,0,YES,The communication and explanation about the problem and explaining the several methods to cure it and helping in how to overcome it.,2022-04-19 05:23:15,False,True,Abhishek ,,,
,,0,0,YES,"Very  dedicated, thoughtful, and well  communicated and humbled, more cooperative and a great medical care.",2022-04-18 16:41:54,False,True,Verified Patient,,,
