tags,context,found_helpful_data-review_yes_count,found_helpful_data-review_total_count,recommendation,review,reviewed_on,is_online_consult,recommends,patient_name,reply_text,replied_at,replier_name
"Doctor friendliness,Explanation of the health issue,Treatment satisfaction,Value for money,Wait time,","Dental Surgery,",0,0,YES,"My wife Gum treatment and wisdom tooth extraction went well. We got the treatment done within given time. 
We are genuinely thankful.

Thank you.",2019-11-29 12:45:02,False,True,Ravinder Sharma,,,
"Treatment satisfaction,","Acrylic Partial Denture,",0,0,YES,"**** **** ****** **** full of experience and friendliness.. The clinic is also accupied with latest machines and technology..
Very satisfied with the overall experience .",2019-11-29 07:49:45,False,True,Vijay Kumar Singh,,,
"Doctor friendliness,","Cosmetic/ Aesthetic Dentistry,",0,0,YES,Dr sonal is always been caring and informative.she has always directed me in the proper direction.she is very patient and wanted to help not only find my best look but something that was in my budget.i was treated like family.i highly recommend**** ** **** ******* *******great service good people very helpful and easy to talk to.,2019-12-06 08:00:13,False,True,Verified Patient,,,
"Treatment satisfaction,Value for money,","RCT - Root Canal Treatment,",0,0,YES,Treatment was done to my satisfaction and no multiple sitting required. Not expensive treatment its worth your money..happy with the services.problem was nicely explained and well treated.,2019-11-29 18:49:50,False,True,Verified Patient,,,
"Doctor friendliness,Explanation of the health issue,Treatment satisfaction,Value for money,Wait time,","RCT - Root Canal Treatment,",0,0,YES,Excellent experience.caring and dedicated doctors. Brief you proper about the problem and then advice the adequate treatment.,2019-12-07 03:13:48,False,True,Verified Patient,,,
None,None,0,0,YES,"Very good DR for dental problems. **** *********. Best part is minimum charge and full treatment....
",2019-11-30 07:39:01,False,True,Verified Patient,,,
