tags,context,found_helpful_data-review_yes_count,found_helpful_data-review_total_count,recommendation,review,reviewed_on,is_online_consult,recommends,patient_name,reply_text,replied_at,replier_name
None,None,0,0,YES,It was a very nice experience with the doctor during my visit at the clinic. Tooth extraction of my fussy kid happened with so much ease due to the comfortable and polite approach by the doctor. I would highly recommend Amit dental clinic for all the tooth related issues.,2023-01-09 09:43:48,False,True,Gifty Mehta,,,
None,None,0,0,YES,"very polite and humble doctor, and genuinely understands patient problem without charging *********** **** *** ********** highly recommended for anyone having tooth problems.",2022-12-29 07:20:55,False,True,mayank raj,,,
None,None,0,0,YES,It was a great great experience. She was very polite and helpful for patients. I recommends to all of anyone having issues in their teeth,2022-12-29 13:10:50,False,True,Verified Patient,,,
None,None,0,0,YES,Dr. Awantika is * **** ******* *** helpfull and best decision. Dr. Awantika like family best doctor for the hospital ,2022-12-29 13:09:51,False,True,Verified Patient,,,
None,None,0,0,YES,**** ********* as a doctor felt really helpful when in pain also tha treatment provide was accurate now i can eat whatever i want to. thank you doctor 😁,2022-12-29 12:57:21,False,True,Verified Patient,,,
