tags,context,found_helpful_data-review_yes_count,found_helpful_data-review_total_count,recommendation,review,reviewed_on,is_online_consult,recommends,patient_name,reply_text,replied_at,replier_name
None,None,0,0,Yes,My mom had been to hospital and it was for back pain related. Consultation was fine by the doctor. I can definitely recommend the doctor to my family and friends. There was no waiting time when we went. Tablets were prescribed by the doctor. Physiotherapy was suggested and doctor was friendly. She is recovering health wise. We were not able to do follow-up post consultation.,2021-07-29 05:26:45,False,True,Charvee,,,
None,None,0,0,YES,"I have consulted Dr. Ilavarasan for my mother spine and leg pain issues. The way he explained her issues and concern over prescribing the medicine and treatment is really heart melting. Really he is taking care of complete health issue before prescribing any tablet or even for ointment. Also he is explaining to patient in a better way they can understand what they can do and protect themselves in future.

After his consultation my mother and my whole family is felt really very happy. ",2020-11-27 16:22:33,False,True,M. JAYASEELAN,,,
"Doctor friendliness,Explanation of the health issue,Treatment satisfaction,",None,0,0,YES,"Known doctor , good care by both the doctors and the staffs. 
Always comfortable visiting the hospital",2022-02-21 06:07:10,False,True,Srividhya ,,,
"Treatment satisfaction,Explanation of the health issue,Value for money,Wait time,Doctor friendliness,","Slip Disc,",0,0,NO,,2019-05-12 06:27:45,False,False,Sathish Babu T B,,,
"Doctor friendliness,Explanation of the health issue,Treatment satisfaction,Value for money,Wait time,","Knee Replacement,",0,0,YES,"OUTSTANDING EXPERIANCE . VERY FRIENDLY , IMMENSE ABILITY, ANDWILLINGNESS TO GIVE ADVICE WHENEVER AND WHEN YOU PHONE. I AM 100% SATISFIED. VISIT ONCE",2019-10-28 12:18:44,False,True,Verified Patient,,,
