tags,context,found_helpful_data-review_yes_count,found_helpful_data-review_total_count,recommendation,review,reviewed_on,is_online_consult,recommends,patient_name,reply_text,replied_at,replier_name
,,0,0,YES,"Very good doctor and treatment I am visiting from last 8 years I suggest this doctor to everyone

Happy with service and he will respond immediately on our doubt",2024-02-29 14:41:52,False,True,Verified Patient,,,
,,0,0,YES,Doctor answers all your doubts and spends enough time with patient.. ** ** *** ** *** **** ****** ** ** ******.. I would strongly recommend him for newborn parents.. ,2023-03-05 08:51:10,False,True,vijayalakshmi Rag,,,
"Doctor friendliness,Value for money,Wait time,","Pediatric Vaccinations,",0,0,YES,Very friendly doctor. My kid was so happy with him. Waiying time was minimum. They took utmost care during this Covid period. Very nice doctor and good clinic. I recommend you to go there and meet him and experience,2020-06-04 08:30:41,False,True,Sudev Nair,,,
,,0,0,NO,"When we booked appointment through Practo, doctors, fee was showing 700 and when we visited hospital they charged 850 doctors consultation and 200 for registration.",2022-06-21 08:54:49,False,False,Rajesh ,,,
