tags,context,found_helpful_data-review_yes_count,found_helpful_data-review_total_count,recommendation,review,reviewed_on,is_online_consult,recommends,patient_name,reply_text,replied_at,replier_name
"Doctor friendliness,Treatment satisfaction,","RCT - Root Canal Treatment,",0,0,YES,"Had a great experience at Dentaire@BH. Doctor's are good friendly ,make you feel comfortable.  Best treatment so far.
Highly recommendable.",2022-10-29 13:52:37,False,True,Karishma,,,
"Treatment satisfaction,",,0,0,YES,Nice job done and I feel happy about the treatment done The cleaning was through and painless. Doctor made me comfortable and did a through but good job.,2022-02-03 07:12:06,False,True,Vyshnavi,,,
"Doctor friendliness,Treatment satisfaction,","Zirconia Crowns,",0,0,YES,Excellent treatment. Amazing service.friendly staff members.overall excellent service by doctors and staff.,2023-07-06 15:15:51,False,True,Verified Patient,,,
,,0,0,YES,Dr Arshita is truly considerate about her patients. *** *** **** ********* ** *** ****** ****** I would truly recommended anyone to visit their clinic if they are facing any dental issues. ,2023-06-24 13:54:47,False,True,Verified Patient,,,
"Doctor friendliness,","RCT - Root Canal Treatment,",0,0,YES,"It was nice experiences and friendly docter 
Explained very well about the treatment
...............
",2022-08-28 14:13:30,False,True,Verified Patient,,,
