tags,context,found_helpful_data-review_yes_count,found_helpful_data-review_total_count,recommendation,review,reviewed_on,is_online_consult,recommends,patient_name,reply_text,replied_at,replier_name
"Doctor friendliness,Explanation of the health issue,Treatment satisfaction,Value for money,Wait time,",,0,0,YES,"Thanks to Dr. Dilshad for extracting my wisdom tooth which caused a severe pain to me for months. She gave good medicine for the healing too. I had a wonderful time at the clinic too which made me feel comfortable without any hesitation.
Once again Thank you doctor for your treatment.",2024-04-11 06:55:26,False,True,Verified Patient,,,
"Doctor friendliness,",,0,0,YES,"Prime dental clinic doctors helped in completing wisdom teeth removal and root canal treatment. Considering that I have crooked teeths, it was not at all easy but still managed to complete the treatment safely and with less pain. Doctors are thorough professionals and experience high quality treatment at affordable cost. All of them carries good attitude, humble at heart and treated patients like me with care and affection. They have most latest technologies available like digital x-ray so I dont have to go out or spend additional cost which is added advantage. Waiting time is less and atmosphere is friendly and welcoming. I would highly recommend them to my friends and family members.",2023-05-29 16:11:00,False,True,Verified Patient,,,
"Doctor friendliness,Explanation of the health issue,","Immediate Dentures,",0,0,YES,**** **** ******* Explains diagnosis. Gives immediate  solution to problem.  I would recommend her for Dental problems ,2021-06-15 11:25:22,False,True,Smriti,,,
"Doctor friendliness,Explanation of the health issue,Treatment satisfaction,Value for money,Wait time,","Scalling,",0,0,YES,Sensitive  teeth  were specially  cared for by decreasing the speed of water thanks you dr Dilshad banu. ,2020-03-06 13:48:22,False,True,Nandhini ,,,
"Value for money,","Scalling,",0,0,YES,"Immensely thankful to prime dental clinic
Wonderful experience and satisfactory.The pain and problems never persisted again,Must visit!",2023-04-30 07:19:07,False,True,Verified Patient,,,
