tags,context,found_helpful_data-review_yes_count,found_helpful_data-review_total_count,recommendation,review,reviewed_on,is_online_consult,recommends,patient_name,reply_text,replied_at,replier_name
None,None,0,0,YES,within 3 months I convinced through iui treatment. as we where trying from so long( 6 years)  and consultanted so many doctors  but nothing happened after that she came like angle in our life. her treatment is systematic & well explained. it seems like she came here to introduce you to the happiness of becoming parents. ,2024-07-29 03:51:14,False,True,Verified Patient,,,
"Doctor friendliness,Explanation of the health issue,Treatment satisfaction,Value for money,","Fertility Treatment,",0,0,YES,**** ****** *** **** ** ***** Her diagnosis seems to spot on this is first time we visited her and found that she is the one for us,2019-03-16 14:40:18,False,True,Shakeer Hussain,,,
"Doctor friendliness,Treatment satisfaction,","Fertilisation In Vitro - Embryo Transfer (IVF - ET),",0,0,YES,I am very Happy. Within 8 months of duration my wife confirmed with pregnancy. Doctors and staffs of the IVF dept. The Rainbow hospital is best hospital for a women. We would like to specially thank Dr.Preeti Reddy Dr devika and her team for all her guidance and support. Thank you Dr Preethi Reddy Dr devika and the whole IVF team of the Rainbow Hospitals Madhapur. My wife name is Mrs P.ROOPA. THANK YOU !!,2019-01-15 04:14:48,False,True,Verified Patient,,,
"Doctor friendliness,Explanation of the health issue,Treatment satisfaction,Value for money,","Fertility Treatment,",0,0,YES,"*** ******* ***** ** **** ********* ********** ** ********** She explains the issues very well so that we can understand and follow . The Process is very systematic in Birthright by Rainbow Fertility Centre. You don't need to worry at all.
For fertility related issues , i strongly recommend Dr. Preethi Reddy and Birthright by Rainbow Fertility Centre.",2018-07-31 11:47:29,False,True,Verified Patient,,,
