tags,context,found_helpful_data-review_yes_count,found_helpful_data-review_total_count,recommendation,review,reviewed_on,is_online_consult,recommends,patient_name,reply_text,replied_at,replier_name
None,None,0,0,YES,"I am from Delhi and wanted a gynaecologist in Hyderabad since i shifted here.I went to gynae in yashodha earlier but Dr was very rude and unfriendly.
Finally found Dr Mahita through practo. The Dr had a very pleasing personality giving me the first impression to be open and friendly with her.She patiently heard my issue and then was quickly able to understand what i wanted to convey.She gave me enough time and found solution the problem quickly.

I will go to her in the future and keep her as my gynaecologist forever.

One of the best gynaecologist i have seen.",2016-01-13 05:12:49,False,True,ankita,,,
None,None,0,0,Yes,My wife had consulted the doctor and it was for gynaecology related. Consultation went well.  I am satisfied with the explanation given. I would like to recommend the doctor to many people. There was waiting time when we went. It was for 15 minutes. Medicines was prescribed by doctor during consultation. Doctor spoke well. ,2021-07-27 07:01:22,False,True,944474,,,
None,None,0,0,Yes,"I had visited the hospital and it was gynaecology related. Consultation was really good by the doctor. She was soft-spoken, listening to queries I had. It was easy for me to connect with her. I have already recommended doctor to my family and friends. There was more waiting time when we went. Medicines was prescribed by doctor during consultation. Hospitality was good. I am visiting hospital multiple times. Diet was suggested and she told to come after 2 months.",2021-07-13 05:32:16,False,True,shreya surana,,,
None,None,0,0,Yes,My wife had consulted the doctor and it was for gynaecology related. Consultation was fine by the doctor. I can definitely recommend the doctor to my family or friends. Tablets were prescribed by the doctor. Scanning and blood test was done. There was no waiting time in the hospital when we went. Doctor was very friendly. ,2021-06-05 14:48:07,False,True,Mohan,,,
None,None,0,0,Yes,"My sister had met the doctor and it was for gynaecology related. Consultation was fine by the doctor. Tablets were prescribed by the doctor. I would like to recommend the doctor to other people. I am satisfied with the explanation  given by the doctor. Initially my appointment was cancelled thrice, that was concern and it could be checked. Tests was done. There was  more  waiting time in the hospital when we went. It was for 1.5 - 2 hours. Doctor was friendly. ",2021-06-05 14:14:54,False,True,NarasimhaRao Jammigumpula,,,
None,None,0,0,Yes,My mother had met the doctor and it was for gynaecology related . Consultation was fine by the doctor. I would like to recommend the doctor to other people. She went for review.   ,2021-06-05 14:22:47,False,True,SRINIDHI,,,
"Doctor friendliness,Explanation of the health issue,Treatment satisfaction,Value for money,Wait time,","Gynae Problems,",0,0,YES,"Awesome doctor, she has patience and graet experience, freindly with patient, educating to patient about problem is very nice....",2020-01-03 05:08:42,False,True,Santhosh,,,
None,None,0,0,Yes,My girl friend had consulted the doctor and it was for gynaecology related . Consultation was fine by the doctor. I can definitely recommend the doctor to my family or friends. Tablets were prescribed by the doctor. There was no waiting time in the hospital when we went. We had consultation twice. Tests was done. After 1.5 month we have follow-up visit again.,2021-06-05 14:21:00,False,True,Verified Patient,,,
None,None,0,0,Yes,"Since the last 25 days, I am consulting her. She is very good. I am very happy with her. The way she approaches and the treatment everything is perfect. The staff also cooperates very well, Only 30 minutes of the estimated waiting period can be foreseen. But the reception has to be more relevant with their information because, on the last visit, I was seeking some details but I didn't get it on time. Other than that everything is good.",2019-12-14 13:54:31,False,True,Verified Patient,,,
