tags,context,found_helpful_data-review_yes_count,found_helpful_data-review_total_count,recommendation,review,reviewed_on,is_online_consult,recommends,patient_name,reply_text,replied_at,replier_name
None,None,0,0,YES,"
 hi everyone  my name is D.harika* *** ******* ***** *** ********* ************ **** a vast experience
The doctor was very friendly patience treatment also good I will recommend to my  friends and family ",2021-07-01 16:44:08,False,True,D Harika,,,
None,None,0,0,YES,Great  doctor and wonderful experience and  timely advises. we had our first time in early trimester and had good timely response and interaction,2021-06-29 14:07:15,False,True,Rev Delight Roberts,Thank you mrs Mary 🙂,2021-06-30T14:27:58+0000,Dr. V Syamala Chelamkuri
None,None,0,0,YES,Doctor was very friendly and patience treatment also good and reasonable cost I would like to  recommend my relatives ,2021-06-14 14:57:59,False,True,Pavani ,,,
"Doctor friendliness,Explanation of the health issue,Treatment satisfaction,","Pregnancy Check Up,",0,0,YES,"The doctor was very friendly and I would like to recommend her to my friends. 

Amazing employees as well.",2020-10-01 13:55:07,False,True,karthik,,,
None,None,0,0,YES,***** ** *** **** ****** *** *** **** **** * She is very friendly and you will feel like family taking care of you when you are with her. Ma'am is extremely professional and has a very unique way of relieving pain.,2021-08-18 05:41:18,True,True,Verified Patient,,,
None,None,0,0,YES,she is friendly and responded immediately for my messages and gave me right medication at right time.,2021-08-05 04:35:17,False,True,Verified Patient,,,
