tags,context,found_helpful_data-review_yes_count,found_helpful_data-review_total_count,recommendation,review,reviewed_on,is_online_consult,recommends,patient_name,reply_text,replied_at,replier_name
None,None,0,0,YES, such a wonderful doctor and she make me feel so safe.thankyou for your effort. I deeply suggest everyone to consult.she gives good hope and  tension free mind. *** ** *** **** * **** ****** *** **** a great human. When I talked with her I feel like my friend. ,2021-11-17 15:12:22,False,True,Soumya,"Thank you Soumya for the review!!!
Regards DR.AMISHRITA ",2021-11-18T09:43:47+0000,Dr. Amishrita Chintawar
None,None,0,0,Yes,"I have rescheduled appointment for my family member and we have visited to the hospital. Dr. Amishrita Chintawar was very nice person and he had the check up very well. Treatment was suggested after the check up and there was no waiting time. Hospital was neat and hygienic, positive response from the staff. I would like to recommend this doctor for other also",2021-10-26 07:26:48,False,True,Verified Patient,,,
"Doctor friendliness,Explanation of the health issue,Treatment satisfaction,Value for money,","Normal Vaginal Delivery (NVD),Pregnancy,",0,0,YES,"I was showing my regular pregnancy check up from 3rd month, doctor had adviced me about the diet,and care during pregnancy,it systematically planned...like when to come for check up and scanning..At the time of delivery I panicked alot,but Dr.Amishrita had made by delivery so easy and effort less.my baby weighed 3.25 kg at the time of delivery.thank you mam for making my delivery effortless and a normal delivery",2019-09-01 05:20:03,False,True,Verified Patient,"Thank you for your valuable feedback
Regards 
Dr.Amishrita",2019-09-03T07:47:46+0000,Dr. Amishrita Chintawar
"Doctor friendliness,Explanation of the health issue,Treatment satisfaction,",None,0,0,YES,"My wife went to doctor Amishrita with a complaint of heavy bleeding.Doctor diagnosed the problem with a few tests Nd gave minimum prescription of medicine.
My wife got cure with in two weeks time.The doctor is efficient.she gave a detailed account of the problem nd assured us of it’s cure.
I highly recommend this doctor for any of the gynaec related issues.",2019-08-31 10:17:03,False,True,Verified Patient,"Thank you so much for your valuable feedback
Regards Dr.Amishrita",2019-08-31T16:15:25+0000,Dr. Amishrita Chintawar
"Doctor friendliness,Explanation of the health issue,Treatment satisfaction,","Hysterectomy (Abdominal/Vaginal),",0,0,YES,I had been suffering from excessive menstrual bleeding.i was diagnosed with fibroid uterus which was the main cause for the bleeding problem.i had undergone hysterectomy and there was no complication.I was very much surprised with postoperative care.I was discharged on day 4 of surgery.I resumed to regular work within 3 weeks of surgery. This explains that the perfection  of the surgery.I would recommend Dr.Amishrita and team for any gynaecology surgeries,2019-08-29 12:33:16,False,True,Verified Patient,"Thank you for the feedback,that's our pleasure to treat patients,",2019-08-30T03:51:18+0000,Dr. Amishrita Chintawar
"Treatment satisfaction,","Vaginal Infection Treatment,",0,0,YES,I'm happy with dactor treatment and also I'm suggest dactor to other also ... Doctor his so friendly,2021-04-05 04:34:41,False,True,Srinivas,,,
None,"Gynae Problems,",0,0,YES,Doctor Suggested me a healthy way of treating. Felt better with the friendly interaction and explained me everything tiny thing with the doubts i had.,2023-09-11 04:31:09,False,True,Verified Patient,,,
None,None,0,0,YES,good. fast appointment and checking also fast. I recommend Manasa hospital and doctor Mam. thank you for service.,2021-09-14 07:15:34,False,True,Verified Patient,,,
"Doctor friendliness,Treatment satisfaction,Value for money,","White Discharge Problem,Cramping,",0,0,YES,"I had visited Dr.Amishrita,my wife had excessive white discharge and severe cramps during periods,she had treated my wife with ease.",2019-08-29 06:54:59,False,True,Verified Patient,"Thank you for your valuable feedback.we are always there for you to treat you.
Regards
Dr.Amishrita",2019-08-29T08:23:27+0000,Dr. Amishrita Chintawar
