tags,context,found_helpful_data-review_yes_count,found_helpful_data-review_total_count,recommendation,review,reviewed_on,is_online_consult,recommends,patient_name,reply_text,replied_at,replier_name
,"Respiratory tract infection,Bronchiectasis Treatment,",0,0,YES,"I   was sick since October 2022 asthma recently it got aggrevated I could not even walk heart echo done and some other doctor recommended b
P medicine and still no improvement
Event I went to Dr Subodh Gupta he examined and saw lung congestion and oxygen was 88 he gave me medicines and saved me ",2023-05-14 14:16:56,False,True,AMIT AGARWAL,,,
,,0,0,YES,"A few words for Dr Subodh Gupta! 
*************************************
Thank you so much for your kind and thoughtful concern in regard to my health and providing me with excellent medical and physical care. You controlled my diabetes from 367 to 110 in 10 days. It's a miracle for me. 
For diabetic patients:
No doubt Dr Subodh Gupta provides world class treatment to diabetic patients. Thus he is serving the Society in the best way. Diabetic patients should visit his clinic and enjoy their life comfortably in affordable budget. This is my experience. 
✍️V. K. Tyagi, Novel Writer (New Zealand)",2023-03-29 03:51:08,False,True,Verified Patient,Thanks a lot🙏🙏,2023-03-29T08:21:19+0000,Dr. Subodh Gupta
,"Stomach pain and stomach upset,",0,0,YES,Dr Subodh is highly professional. Listens very carefully and does a thorough examination. I am really impressed with the way he handled my case and gave his valuable advice.,2023-10-02 19:21:27,False,True,Manav Jain,,,
,,0,0,YES,"Very sincere doctor of kind caring nature. Very open, is approachable and helpful to patients. Takes whatsapp / calls, messages from patients when in need, and responds soon. He does home visitations when needed and possible.  Excellent humane nature.",2023-03-28 20:02:30,False,True,Verified Patient,Thanks,2023-03-29T08:21:46+0000,Dr. Subodh Gupta
