tags,context,found_helpful_data-review_yes_count,found_helpful_data-review_total_count,recommendation,review,reviewed_on,is_online_consult,recommends,patient_name,reply_text,replied_at,replier_name
,,0,0,YES,"Hello,I am Lalita Arora and was admitted in BLK hospital for severe dehydration.I was under observation of Dr Deepak Gargi Pandey.He is such a nice and affectionate doctor,I got so much impressed with him.He explains each and every thing to the patient.He is very friendly with his patients.Highly recommended Physician .I salute him.
",2024-01-24 06:22:27,False,True,Lalita Arora ,,,
,,0,0,YES,Superb talented doctor n very gud human being seriously hats off ur patience n ur work. Thank for helping us,2021-05-31 10:42:50,False,True,neha,,,
"Doctor friendliness,Explanation of the health issue,Treatment satisfaction,Value for money,","Loose Motion,",0,0,YES,"Identifies symptoms correctly,  treats well, I am satisfied and recommend others for him. Efficient    
Doctor, good communication ",2020-08-20 09:28:47,False,True,Verified Patient,,,
