tags,context,found_helpful_data-review_yes_count,found_helpful_data-review_total_count,recommendation,review,reviewed_on,is_online_consult,recommends,patient_name,reply_text,replied_at,replier_name
None,None,0,0,YES,"Dr Ayush clarified all the doubts we had nicely  and we are happy to recommend him further. In fact , I have already recommended. ",2021-04-28 06:23:53,False,True,Narender Singh,,,
None,None,0,0,YES,The doctor was really friendly and they helped me out immensely. I had earlier consulted many doctors but nothing brought me relief *** **** **** ****** ************ *** helped me get a diagnosis which other doctors failed to. I highly recommend them!,2022-06-16 07:58:03,False,True,Verified Patient,,,
None,None,0,0,NO,"They don't have any good facilities here.  Even if you go to get the report, doctors charge fee again.  Fixed MRP is charged on generic medicine.**** ***  ****** ***** ***** *****  I had normal constipation and I were recommended for many tests ***** **** *** *********very disappointed this docter and hospital",2021-08-05 12:08:17,False,False,Ankit dubey,,,
None,None,0,0,NO,After appointment we had some follow up questions for doctor. First we put it on practo but didn't received the reply for 36 hours. Then we contacted hospital staff they gave us a landline number of the doctor. We called on the number and doctor told us to put it on practo. But it's already there on practo ...while I understand these are tough times for doctors too but stranding patient in middle of treatment doesn't sounds good ,2021-04-26 04:43:14,False,False,Verified Patient,,,
"Value for money,Doctor friendliness,Treatment satisfaction,","Consultation,",0,0,YES,**** ****** *** good consultation. He was helpful and understanding and explained the problem well. Good experience.,2023-03-08 13:48:22,False,True,Verified Patient,,,
"Doctor friendliness,Explanation of the health issue,Treatment satisfaction,Value for money,","Vaccination/ Immunization,",0,0,NO,He didn’t care about the patient. The patient clearly had issues but he did not give any advice that could help,2021-05-03 21:40:08,False,False,Verified Patient,,,
"Explanation of the health issue,Treatment satisfaction,Value for money,Doctor friendliness,",None,0,0,YES,**** ********* ** *** *******. I was suffering from bad chest congestion which he understood and medicines suggested were useful. Thanks,2021-04-25 17:01:28,False,True,Verified Patient,,,
None,None,0,0,YES,my overall experience is good. i will recommend others to visit Dr Ayush Gupta. he is very efficient.,2021-04-09 04:49:50,False,True,Verified Patient,,,
None,None,0,0,YES,Doctor is helpful...he always pick the phone and respond if any case busy with patient... would like to recommend him for others,2021-03-06 09:30:41,False,True,Verified Patient,,,
