tags,context,found_helpful_data-review_yes_count,found_helpful_data-review_total_count,recommendation,review,reviewed_on,is_online_consult,recommends,patient_name,reply_text,replied_at,replier_name
,"Heart Conditions,",0,0,YES,Thorough professional and very attentive to patient’s concerns. Checked thoroughly and went through medical records minutely.,2024-07-11 07:45:26,False,True,Ashish Mehta,,,
,"Coronary Angiogram,",0,0,YES,"Very good and calm doctor, explained all the symptoms in detail and medicine there in. Examining of report complete and physical checkup of patient was good ",2024-04-13 11:01:44,False,True,Krishna Raina,,,
,,0,0,Yes,I  have booked  the appointment for my myself  and it was  related to my health concern. Doctor was good in consulting me. Doctor was available and there was no waiting time in hospital. I can definitely recommend the doctor to our  family and friends.It was very good. Tablets were prescribed by the doctor. I am completely satisfied with the treatment given. Doctor was pretty friendly with me.,2021-07-10 23:41:44,False,True,Tanushree,,,
,,0,0,YES,"Great doctor , ********* *********** *** humble. Explains the diagnosis and doesn’t prescribe tests for everything.",2021-09-28 21:51:56,False,True,mayank kapoor,,,
,,0,0,YES,I went to the doctor for my father in law. He was very good and explained the treatment well. I must say that I  am satisfied with the given information. Thank you. ,2020-12-24 14:05:07,False,True,Verified Patient,,,
"Doctor friendliness,Explanation of the health issue,Treatment satisfaction,","Heart Conditions,",0,0,YES,Honesty and his friendly nature. He is well experienced doctor. ** ** ****** * **** ************* May God bless him ,2020-10-21 06:27:48,False,True,Verified Patient,,,
