tags,context,found_helpful_data-review_yes_count,found_helpful_data-review_total_count,recommendation,review,reviewed_on,is_online_consult,recommends,patient_name,reply_text,replied_at,replier_name
None,None,0,0,YES,"My dad had chest pain and he helped overcome with his expertise. Excellent human, god bless him and his family.",2022-10-19 10:49:15,False,True,Chandan ,,,
None,None,0,0,YES,"My husband had a heart attack and dr vikranth veeranna did the angioplasty and stent.. he did an excellent job and my husband is fine now. We are forever grateful for his service. God bless him with health, wealth and happiness.",2021-05-27 13:03:10,False,True,Prasanna Aithal,,,
"Doctor friendliness,Explanation of the health issue,Treatment satisfaction,Value for money,Wait time,","Chest Pain During Exercise,",0,0,YES,********* ************* He diagnoses systematically. Patiently listens to all the problems. Makes sure doesn't prescribe unnecessary medication. Go to doctor for heart related issues. ,2019-07-16 04:56:46,False,True,pareshsaraf@gmail.com,,,
"Doctor friendliness,Explanation of the health issue,Treatment satisfaction,Value for money,","Angioplasty and Stenting,",0,0,YES,Had good experience and successful angioplasty performed by Dr Vikrant verranna at ssnmc hospital last weekTreatment and medical explanation of the issue was good.,2019-12-26 10:14:23,False,True,Vivek Kamath,,,
"Doctor friendliness,Explanation of the health issue,Treatment satisfaction,Value for money,","Cardiac Ablation,",0,0,YES,"Dr Vikranth is very friendly and speaks nicely with patients, 
His explanations about the problems and treatments are excellent.
I underwent angioplasty with a stent. I was keep informed by the doctor though out the procedure. That kept me in curious and confident. This is what any patient looking for. He is soft spoken and very down to earth person.
I wish him to keep up the same level of services",2019-12-06 10:03:20,False,True,Verified Patient,,,
None,None,0,0,YES,"** ** ******* * *** ** *** **** ** ****** 
Friendly 
Helping 
Treats patient with utmost care 
Regards 
Kalpana Gowrishankar ",2021-04-22 19:28:06,False,True,Verified Patient,,,
"Doctor friendliness,Explanation of the health issue,Treatment satisfaction,","Angioplasty and Stenting,",0,0,YES,Dr. Vikrant sir saved my mother in time. Very cooperative and was available mid night 3am as it was emergency. Also discuss and explain in detail the facts.,2021-03-08 07:14:49,False,True,Verified Patient,,,
"Doctor friendliness,Explanation of the health issue,Treatment satisfaction,Value for money,Wait time,","Heart Conditions,",0,0,YES,,2020-07-19 08:42:34,False,True,Verified Patient,,,
