tags,context,found_helpful_data-review_yes_count,found_helpful_data-review_total_count,recommendation,review,reviewed_on,is_online_consult,recommends,patient_name,reply_text,replied_at,replier_name
"Doctor friendliness,Explanation of the health issue,Treatment satisfaction,Value for money,","Coronary Angiography,",0,0,YES,"*** ***** ** * **** ************* *** patient friendly cardiologist. He goes into the case history in detail, understand, and treat patients holistically. I visited Max Hospital, Saket few days back with my Father. He was quick to understand his problem and give medications accordingly, and helped to ensure best possible treatment. He never suggest anything which is not in favour of patient. The way he explains everything is so amazing. He is better now. Thankful to him for my father's angioplasty in best possible way. I would recommend all to visit him for any heart related issue.",2019-03-02 13:26:16,False,True,Verified Patient,,,
"Doctor friendliness,Explanation of the health issue,Treatment satisfaction,Value for money,Wait time,","Coronary Angioplasty / Bypass Surgery,",0,0,YES,Dr. Rajeev Rathi had been treating my father for heart illness for long. ** ** *** ** *** **** ************* * **** **** ** *****. Advises are perfect and gives ample time to the patient. He performed miracles on my father and saved him from death not once but thrice. I personally consider him as a God in cardiology. ,2022-07-08 07:37:47,False,True,Verified Patient,,,
None,"Irregular Heartbeat,",0,0,NO,"Not good, doctor not responded after OPD when required about medicine doeses which was not mentioned by doctor willfully. 

....
I think don't measure doctor about his degree only  behavior also matter. ",2018-05-26 12:52:20,False,False,vinod,,,
"Doctor friendliness,Explanation of the health issue,Treatment satisfaction,Value for money,","Heart Conditions,",0,0,YES,,2019-01-27 06:05:50,False,True,Swati Singh,,,
