tags,context,found_helpful_data-review_yes_count,found_helpful_data-review_total_count,recommendation,review,reviewed_on,is_online_consult,recommends,patient_name,reply_text,replied_at,replier_name
"Explanation of the health issue,Treatment satisfaction,Value for money,","Implant Retained Dentures,",0,0,YES,"I found Dr. Pai as most efficient and a true professional.... he used modern techniques for the implant treatment. It was bit complicated, which he made very simple. 
Now I can smile wide......",2019-02-25 09:41:49,False,True,Adv Sameer Tendulkar,,,
None,"Implant Retained Dentures,",0,0,YES,** ******** *** ** *** *** ** * ******* He discussed the case with me breaking it down so that i could understand exactly what the problem was. ** ** *** ** *** **** ******** **** * **** **** ******* i would like to recommend him to all my friends and family ,2016-11-02 06:53:30,False,True,Verified Patient,,,
None,None,0,0,YES,First I was worried about how IT would look .. The doctor gave me options about the treatment I found the filling option better .. So went for it .. The doctor did a wonderful job ..! Would definitely recommend him ! Thank you so much ,2016-03-26 06:05:42,False,True,Jyoti Raut,,,
None,"Ceramic Braces Fixing,",0,0,YES,"A soothing ambience with charismatic interiors, ideal for a clinic to give their patients a feeling of relaxation and care right from the first appointment. Professional and caring staff, ready to always go out of the way to help you with any issues. Treatment process an excellent combination of professionalism and care. Appreciate the steady work behaviour of the doctor, unlike other doctors who are in a rush. Overall excellent.",2017-07-08 14:01:19,False,True,Verified Patient,,,
None,"Ceramic Braces Fixing,",0,0,YES,Very neat and tidy place ideal for a clinic. Very good coordination regarding appointments.Good and friendly staff.,2017-07-08 13:54:00,False,True,Verified Patient,,,
