tags,context,found_helpful_data-review_yes_count,found_helpful_data-review_total_count,recommendation,review,reviewed_on,is_online_consult,recommends,patient_name,reply_text,replied_at,replier_name
None,"Dental Implant Fixing,",0,0,YES,"** ****** ** ** ********* ******** She took the time to explain the whole procedure of implant surgery and very supportive indeed. I found her to be extremely professional. The process of surgery was painless and staff is truly caring.
I had a pleasant experience. It’s not easy to find a good dentist, I highly recommend Dr kaynat ******* *** ** *** **** * **** ****",2022-01-19 08:52:44,False,True,AKSHAY,,,
"Doctor friendliness,Explanation of the health issue,Treatment satisfaction,Value for money,","Dental Fillings,",0,0,YES,"The doctor knows her subject well and was extremely professional in doing the treatment. The staff is very polite and the clinic is beautiful!
Thank you doctor",2020-02-15 08:53:03,False,True,B/O Dr parinita khot,Thank you so much Dr Parinita for your kind words and appreciation. We hope to deliver you the best always.,2020-07-21T06:53:26+0000,Dr. Kaynat Gilani
None,None,0,0,YES,"Absolutely painless treatment, Dr Kaynat Madam & staff are very humble & polite. Felt very safe even during the current situation. Highly recommended to others.",2020-12-21 13:13:27,False,True,Verified Patient,,,
