tags,context,found_helpful_data-review_yes_count,found_helpful_data-review_total_count,recommendation,review,reviewed_on,is_online_consult,recommends,patient_name,reply_text,replied_at,replier_name
None,"Dental Fillings,",0,0,YES,"Doctor is very careful about the treatment and proper guidance is given before any treatment . She is very flexible regarding timings.clinic is very neat and clean
",2017-04-10 12:34:35,False,True,Ashok kandpal,,,
None,None,0,0,YES,"Visited for tooth filling.Dr jyotsna is  an amazing dentist I have come across in a very long time , very patient and knowledgeable,I was surprised when I received a call from them to check on me if my tooth is doing  good.Highly recommended 👍🏻",2023-08-05 07:06:38,False,True,Verified Patient,,,
None,"Tooth Coloured Fillings,",0,0,YES,Experience was very good. Doctor Mrs. Jyotsna is very kind and does treatment wisely. Doctor is expert in her domain. ,2016-01-16 07:02:32,False,True,satish kulkarni,,,
None,None,0,0,YES,"Excellent!!
My exp. says she takes any decision before starting treatment after checking all the aspect or probable reason or cause rather calling patient again & again.",2015-09-05 12:08:09,False,True,Thilagawathi Kumaresan,,,
None,None,0,0,YES,Dr. Jyotsna  is confident in her work. She works precisely & amicably. Create good relationship with patients. ,2015-08-14 18:38:50,False,True,vaishali jatthar,,,
"Doctor friendliness,Explanation of the health issue,Treatment satisfaction,Value for money,","Wisdom Tooth Extraction,",0,0,YES,"*** **** ******* * **** **** **** *** She takes the time to explain everything. Comfortable and friendly.love my dentist. As always, I had a great experience. ",2019-02-18 07:49:41,False,True,Verified Patient,,,
None,None,0,0,YES,"Very good, good ambience, the doctor called back to reschedule the appointment due to rain, cleaning process is very smooth.",2016-07-03 07:10:09,False,True,Verified Patient,,,
"Doctor friendliness,","RCT - Root Canal Treatment,",0,0,YES,,2021-12-21 06:08:04,False,True,Verified Patient,,,
