tags,context,found_helpful_data-review_yes_count,found_helpful_data-review_total_count,recommendation,review,reviewed_on,is_online_consult,recommends,patient_name,reply_text,replied_at,replier_name
None,None,0,0,YES,Excellent service at Smiles Forever clinic.Dr. Aditi Lele is amazing! Dr.Suhas Lele is so experienced and has such a positive energy! The staff is very polite and professional at the same time.I highly recommend this clinic for Dental work and procedures.Kudos to Dr.Lele and his team.,2023-12-29 17:38:28,False,True,Raashee Tuli,,,
None,"Dental Implant Fixing,",0,0,YES,I am quite happy with the procedure done with Dr. The whole process was handled very professionally. Would recommend to everyone.,2016-07-21 12:00:43,False,True,sabina tandon,,,
"Doctor friendliness,Treatment satisfaction,","Cosmetic/ Aesthetic Dentistry,",0,0,YES,"Doctor is very friendly, soft spoken & caring... making me very comfortable throughout the session. ",2023-12-20 13:49:35,False,True,Lalita Mukharjee,,,
None,"Dental Fillings,",0,0,YES,"Absolutely brilliant.
It was a painless procedure 
I am petrified of dentists but with Dr. Aditi Lele.. I didn't realise a thing.
I know where to go now for all my dental problems ",2016-10-26 09:55:34,False,True,Shebany,,,
"Doctor friendliness,Explanation of the health issue,","Aesthetic Dentistry,",0,0,YES,All was good. Doctor was friendly in explaining all the aspects related to my teeth and has suggested many improvements,2023-03-10 09:54:28,False,True,Verified Patient,,,
"Doctor friendliness,Explanation of the health issue,Treatment satisfaction,Value for money,Wait time,","Laser Gum Surgery,",0,0,YES,,2023-11-01 14:22:31,False,True,Saraf,,,
