tags,context,found_helpful_data-review_yes_count,found_helpful_data-review_total_count,recommendation,review,reviewed_on,is_online_consult,recommends,patient_name,reply_text,replied_at,replier_name
None,None,0,0,YES,"Very hygienic clinic.
Treatment is given after explaining everything in detail. 
I got my dental implants done at dentavenue.",2024-03-11 14:20:58,False,True,Prabha,,,
"Treatment satisfaction,",None,0,0,YES,Got dental implants done for my father. The treatment was done flawlessly. We are very happy. Dr Akshay and Dr saundya are very professional ,2024-04-16 06:40:06,False,True,Verified Patient,,,
None,None,0,0,YES,"At a dental clinic located in Chembur, Mumbai, my son received Teeth Braces treatment from Dr. Saudnya Rudrawar. The treatment process was incredibly smooth and executed to perfection. Although the treatment required a significant amount of time, the end result was well worth the wait. My son's previously misaligned teeth are now straightened, resulting in an improved and confident smile.",2023-03-22 07:22:55,False,True,Jeny,,,
None,None,0,0,YES,"Had a zirconia crown treatment; durable and natural-looking results. Highly recommended .  The clinic's ambiance is pleasant and comforting, making the entire experience stress-free.",2023-09-08 18:51:18,False,True,Verified Patient,,,
None,None,0,0,YES,Visited for teeth whitening; impressive results and friendly staff.   Best in their field.  Much knowledgeable & experienced ,2023-07-31 13:40:01,False,True,Verified Patient,,,
None,None,0,0,YES,My tooth bridge is perfect; they did an excellent job with the fitting. I definitely recommend them ,2023-09-02 14:59:49,False,True,Verified Patient,,,
