tags,context,found_helpful_data-review_yes_count,found_helpful_data-review_total_count,recommendation,review,reviewed_on,is_online_consult,recommends,patient_name,reply_text,replied_at,replier_name
"Doctor friendliness,","RCT - Root Canal Treatment,",0,0,YES,"My experience was excellent . The staff is friendly, always smiling. The entire team was professional, thorough, respectful and considerate. The facilities were in great conditions and created a  relaxing atmosphere. Highly recommended!!

",2019-12-23 05:44:42,False,True,Shraddha,,,
"Doctor friendliness,Explanation of the health issue,Treatment satisfaction,Value for money,","Tooth Coloured Fillings,",0,0,YES,Doctor goes in a very preventive manner with her treatment. She has all the new materials and latest equipment to execute it. Very satisfactory experience. ,2019-11-19 08:06:00,False,True,Sandhya,Thank you for your feedback.,2019-11-20T04:00:25+0000,Dr. Meghna Dang
"Treatment satisfaction,","Dental Fillings,",0,0,YES,Very nice . Would like to recommend this doctor to all those who are looking for Dental treatment  .,2019-11-23 06:54:13,False,True,Anita ,,,
"Treatment satisfaction,","Dental Cavities,",0,0,YES,Extremely good services and the staff is well trained and very professional. Would highly recommend. ,2019-11-22 05:36:40,False,True,Aryanil,,,
