tags,context,found_helpful_data-review_yes_count,found_helpful_data-review_total_count,recommendation,review,reviewed_on,is_online_consult,recommends,patient_name,reply_text,replied_at,replier_name
None,"Cosmetic/ Aesthetic Dentistry,",0,0,YES,"Namrata has aptly called herself The Smylist, cause you'll always end up leaving her clinic with a smile on your face, however ugly your teeth are. She is extremely hands on and takes utmost care of her patients. She is meticulous and pays a lot of attention to detail. For the first time in my life, I can't wait to come back and visit my dentist.",2017-03-31 13:53:17,False,True,Adhaar Khurana,,,
None,"Cosmetic/ Aesthetic Dentistry,",0,0,YES,Loved the clinic and how they really explain dental health-the entire team made me so comfortable and did a brilliant job with my teeth. They took precautions at every level and informed me of everything they did-am going to be regularly coming here and making sure my dental health is up to the mark.,2017-03-25 07:16:12,False,True,Juhi Kothari,,,
None,"Dental Cleaning,",0,0,YES,Painless dental experience. Appreciate how the doctor is very informative about procedures. Would recommend to all. ,2017-03-24 12:30:32,False,True,Nikhil Mulani,,,
None,None,0,0,YES,"Absolutely fantastic. *** ***** *** ***, makes the patient feel comfortable and is good at what she does. Highly recommend.",2017-01-17 21:14:08,False,True,Verified Patient,,,
None,"Dental Fillings,",0,0,YES,Had a very comfortable experience. Very happy with the work done and the clinic is really made well. Would definitely be coming back for any other dental work. ,2017-03-17 11:04:12,False,True,Verified Patient,,,
None,"Cosmetic/ Aesthetic Dentistry,",0,0,YES,"Had a fantastic experience. Changed my smile completely. Dr. Namrat explains the treatment very well and listens to you patiently. If you want a great smile, I would surely tell you to visit her! ",2017-03-23 13:59:32,False,True,Verified Patient,,,
None,"Dental Fillings,",0,0,YES,"Very good work. I was explained the treatment well and was painless as promised. Polite staff, clean and beautiful clinic. Highly recommend",2017-03-16 11:59:03,False,True,Verified Patient,,,
"Doctor friendliness,Treatment satisfaction,Wait time,","Dental Cleaning,",0,0,YES,"Excellent dentist, lovely person. Highly recommended and very conveniently located in Bandra West.  ",2018-11-03 08:08:02,False,True,Verified Patient,,,
