tags,context,found_helpful_data-review_yes_count,found_helpful_data-review_total_count,recommendation,review,reviewed_on,is_online_consult,recommends,patient_name,reply_text,replied_at,replier_name
"Doctor friendliness,Explanation of the health issue,Treatment satisfaction,Value for money,","Pediatric Vaccinations,",0,0,YES,She is soft spoken. Treats with minimal medicine needed. I would definitely refer people to visit her.,2022-01-22 04:12:17,False,True,Neha,,,
,,0,0,YES,I had to wait for more than 50 min to get connected but doctor was excellent.I am very much satisfied..,2021-09-17 04:43:15,False,True,Geetika,,,
"Doctor friendliness,","Pediatric Vaccinations,",0,0,YES,"I know Dr Lata Bhat from past 5 years...since my kids were born, as they were preterm and under supervision of Dr Lata Bhat..and she really work hard towards each kid
",2020-10-03 14:07:30,False,True,mast vivan kapoor,,,
"Doctor friendliness,Explanation of the health issue,Treatment satisfaction,",,0,0,YES,She took every details regarding my child. Listened to my concerns patiently. Prognosis & diagnosis on point. ,2020-11-19 17:19:11,False,True,Verified Patient,,,
,,0,0,YES,I had to wait for more than 45mins to get connected but it was worth..The doctor was excellent..Thanks for all the help,2021-07-19 04:48:28,True,True,Verified Patient,,,
