tags,context,found_helpful_data-review_yes_count,found_helpful_data-review_total_count,recommendation,review,reviewed_on,is_online_consult,recommends,patient_name,reply_text,replied_at,replier_name
None,None,0,0,YES,"Good pediatrician is a boon for working mothers. I have been visiting Dr vineeta Rajput ,a renouned pediatrician in New Delhi for my elder daughter for the last 4 years.
she is  a  very caring and friendly doctor. She always gives the right and valuable consultation. Over a period of time I have developed such a faith in her that now  even though I am out of delhi I am taking videoconsultation for my newborn  baby and got satisfactory results. I highly recommend her for best diagnosis and treatment.",2020-05-22 10:36:16,False,True,Priyanka chauhan ,,,
"Doctor friendliness,Explanation of the health issue,Treatment satisfaction,Value for money,Wait time,",None,0,0,YES,"I have visited Dr  Vineeta  Rajput's clinic many times for my son and he  always recovered quickly  .she is extremely kind *** ** ********* *******
During this lockdown  I took videoconsultation also  from her and 
I am so thankful to have such a wonderful child specialist in my vicinity .She is a boon to my son.",2020-05-19 15:02:34,False,True,Chandra mohan (adv.),,,
None,None,0,0,YES,"I took my daughter to Dr. Vineeta, ma'am experience was very good, she looked after my daughter very well and now my daughter is fine.",2024-03-27 03:19:18,False,True,Verified Patient,,,
None,"Fever,",0,0,NO,*** ** ***** ****** * **** **** ***** She vaccinated my baby with old influenza vaccination. My 10 month baby suffering from fever and she gave tetnus injection to her although baby already got tetnus in her immunity schedule without concerning us.,2017-02-19 20:48:03,False,False,Vijaylaxmi,,,
"Explanation of the health issue,","Childhood Infections,",0,0,YES,The diagnosis process and treatment for the same is remarkable. Step by step clarification was also provided.,2021-05-23 13:08:33,False,True,AYANSH RANJAN,Thank you,2021-05-24T09:31:04+0000,Dr. Vineeta Rajput
None,"Health Checkup (Pediatric),Cough In Children,",0,0,YES,"****** ******* ******* she listen carefully to each and every problem & explain complete details of diagonosis. Whenever I went to her for my girl child, she got better almost instantly..",2017-02-19 18:44:01,False,True,She shank mallick,,,
"Doctor friendliness,Explanation of the health issue,Treatment satisfaction,Value for money,","Paediatric Critical Care,Nutritional Assessment,Menstrual problems in adolescents,Child health disorder ,All Pediatric Problems ,",0,0,YES,"She is extremely kind, helpful *** *********** doctor. Its always enriching experience to listen her talk about benefits of healthy lifestyles and how we can follow them to lead a healthy life. ",2019-05-29 06:42:57,False,True,Verified Patient,,,
