tags,context,found_helpful_data-review_yes_count,found_helpful_data-review_total_count,recommendation,review,reviewed_on,is_online_consult,recommends,patient_name,reply_text,replied_at,replier_name
None,"Children's Health,",0,0,YES,Very friendly and warm. Doesn't believe in over the top medication. Is extremely calm and puts you at ease too specially when anything related to children can get very stressful. Very well organised with appointments for check up or vaccinations. A child friendly clinic too. ,2016-10-30 03:34:36,False,True,Shilpa Kasliwal,,,
"Doctor friendliness,Treatment satisfaction,","Fever,",0,0,YES,"She is a fabulous doctor, highly recommended . Both our kids get treated from her and she is like family now",2017-08-05 13:17:30,False,True,Samaya,,,
None,"Children's Health,",0,0,YES,"Excellent services. She is nice lady and cooperative. *** ********* *** nature is very good.
**** ***********",2017-05-05 18:53:48,False,True,Rushika Pandey,,,
None,None,0,0,YES,Dr Sumita chawla is an excellent doctor.she is also very patient compassionate and understanding.i trust my doctor opinion and always take their suggestions.*** ** *** ** *** **** *********** *** **************,2017-05-06 09:18:17,False,True,Baby.Tejaswini,,,
"Explanation of the health issue,Treatment satisfaction,Value for money,",None,0,0,YES,Good doctor. Diagnosis provided as per requirement rather than forcing and conducting tests.. Understands the problem and issues faced by parents.,2017-12-16 13:46:46,False,True,Joshua George,,,
