tags,context,found_helpful_data-review_yes_count,found_helpful_data-review_total_count,recommendation,review,reviewed_on,is_online_consult,recommends,patient_name,reply_text,replied_at,replier_name
None,None,0,0,YES,"It was an awesome Experience. Doctor Mr. Aniket Mule is a super doctor. Staff, nurses, and housekeeping everyone was very helpful, kind, and respectful...My treatment was successful. Thank you Wockhardt hospital mira road...",2024-07-19 05:26:46,False,True,Verified Patient,,,
None,None,0,0,YES,"The experience was overall good and positive . Had a proper diagnosis and treatment in the hospital
Thankyou",2023-07-05 06:24:23,False,True,Nisha,,,
None,None,0,0,YES,Doctor is very nice...treatment went very amazing....definitely going to recommend this Doctor to other people ,2023-08-31 04:45:55,False,True,Verified Patient,,,
"Value for money,Treatment satisfaction,","Fever Treatment,Colds,",0,0,NO,,2019-07-26 03:33:39,False,False,Verified Patient,,,
None,None,0,0,YES,He is a very nice doctor. His treatment and medications are also nice. His behaviour is also very nice and patient.,2023-08-04 05:00:12,False,True,Verified Patient,,,
None,None,0,0,YES,The treatment till I have been  taking up  so  is really good . The most important is that doctors which give treatment is really good.,2023-08-01 05:39:03,False,True,Verified Patient,,,
None,None,0,0,YES,Experience was good . It was helpful  . Good staff. Facility were good.  Nice coming here. Maintainces is nice.,2023-07-31 06:30:28,False,True,Verified Patient,,,
"Doctor friendliness,Explanation of the health issue,Treatment satisfaction,Value for money,Wait time,",None,0,0,YES,Visited the doc for viral infection and booked online. Without any waiting consultation was done. Explained issue in detail and prescribed medicine ***** ****** **** *****,2020-03-22 14:42:27,False,True,Verified Patient,Thank you for your feedback. ,2020-03-23T13:46:57+0000,Dr. Aniket Mule
"Doctor friendliness,Explanation of the health issue,Treatment satisfaction,Value for money,",None,0,0,YES,Doctor is very friendly *** **************Charges are slightly high.treatment satisfactory clinics staff is nice ,2020-01-08 07:48:00,False,True,Verified Patient,Thank you for your feedback. ,2020-03-24T06:28:20+0000,Dr. Aniket Mule
