tags,context,found_helpful_data-review_yes_count,found_helpful_data-review_total_count,recommendation,review,reviewed_on,is_online_consult,recommends,patient_name,reply_text,replied_at,replier_name
None,None,0,0,YES,"We shifted to delhi when my wife was in 8th month of her pregnancy and by that time its really hard to get a doctor whom you can trust. Been through google reviews, Practo reviews and also had prior visit to a doctor in my hometown and here also spoken with few on phone, everyone will speak with you frankly as the profession is like that but no one likes to encourage for a normal delivery even when everything was in favour of that.
Dr. Mohini has not only supported us for normal delivery during our initial talk but also encouraged and guided us in the very short span of time. Unfornuately, we had to go with C-section as my spouse tried for around 12 hours for normal delivery with no luck. All went well and both my wife and my child is doing well. *** ** *** **** ********* ****** *** ********** ** ***** glad that I visited her 😊
Again thanks a lot Mam for supporting us.",2022-07-12 17:22:05,False,True,Nitesh Singh,,,
"Explanation of the health issue,","Obstetrics Problems,",0,0,YES,"Words which I have to say for Dr. Mohini soni is ``she is very didicated and experience doctor. She is very much knowledgeable and experienced. She attached with us a lot and treated very well. Whenever we need , she is the first person to guide and support. And I will recommend to others as well.
                   Thanks doctor",2021-03-02 08:31:35,False,True,Devesh kumar,Thanks a lots sir ,2021-03-02T15:23:04+0000,Dr. Mohini Soni
None,None,0,0,YES,amazing friendly doctor.. i was very scared about my symptoms and worried but she took care of me so well she made me understand everything.. the medicine and the prescription.. she gave me all the time i needed ... im thank full i met her.. would recommend everyone .,2020-10-25 09:02:16,False,True,Shahjahan Shaikh ,Thanks dear for kind words,2020-11-09T11:13:18+0000,Dr. Mohini Soni
None,None,0,0,YES,"Best wishes for your future .. keep doing good work .. pure heart... caring doctor. best of luck...
",2021-04-05 12:10:37,False,True,Khushal,Thanks for your kind reply,2021-04-05T13:18:06+0000,Dr. Mohini Soni
None,None,0,0,YES,I had a wonderful experience with dr mohini  she is always available at the time of emergency thorugh online consultation also treatment is good and affordable.,2021-03-22 03:47:26,False,True,AKASHSHARMA,Thanks for kind words,2021-03-22T15:23:11+0000,Dr. Mohini Soni
None,None,0,0,YES,"I am from UP. I talk to her over phone first.  My mother was suffering from heavy bleeding.. she is very calm & caring doctor and explain everything in details..she did not advice unnecessary tests,all doctor told me to remove uterus of my mother but she did hysteroscopy and after that mother feel so well after long time..                                                     **** ************* *** **** **** ******.. recommend her for sure..",2021-03-31 15:20:25,False,True,Verified Patient,Thank you for sparing some time to rewiew my work.. I am really thankful to you.. ,2021-04-03T05:53:50+0000,Dr. Mohini Soni
None,None,0,0,YES,I would recommend Dr. Mohini to others as she is very friendly and listens to the problems very carefully. She explains everything in detail and prescribed me proper medications. ,2021-04-07 18:39:18,False,True,Verified Patient,Thanks for your kind words ,2021-04-08T08:12:19+0000,Dr. Mohini Soni
None,None,0,0,YES,"**** ***** ****** * ** **** I was trying to conceive and with the help of doctor mohini, now we are starting our journey of parenthood..",2021-03-25 09:12:01,False,True,Verified Patient,"Congratulations dear as USG is showing healthy fetus, you can relax and celebrate now.. 
Thanks dear for your kind review.. ",2021-03-25T13:53:21+0000,Dr. Mohini Soni
