tags,context,found_helpful_data-review_yes_count,found_helpful_data-review_total_count,recommendation,review,reviewed_on,is_online_consult,recommends,patient_name,reply_text,replied_at,replier_name
"Doctor friendliness,Explanation of the health issue,Treatment satisfaction,","Pregnancy Check Up,",0,0,YES,She just makes you feel very positive about everything. She explains everything very calmly and focuses a lot on Medical history. Moreover she doesn't believe in giving unnecessary medicines.,2021-02-25 13:17:51,False,True,PRIYANKA CHAUDHARYchau,,,
None,None,0,0,YES,"She is very experienced doctor , i had 4 miscarriages before i conceived from dr jasbir treatment but after her treatment i delivered a healthy baby without any complications she is a god for me , before her i lost my every hope for child just because of her i full fill my wish for child..**** ** * **** **** *****",2021-10-16 13:50:15,False,True,Verified Patient,,,
None,None,0,0,NO,"I visited her over a year ago, she came in highly recommended but the visit was highly disappointing. I had visited for pcos and a possible line of treatment. She gave me some medicines on my insistence but mostly just snubbed me for not wanting a child and told me that I didn't want to get pregnant it was ok to not treat pcos.* ********** **** ***** ****** **** *** **** **** ** ******** *** **** **** ** ****** **** ** ******* ** *** ***** ********* ** *** *********** **** ** ****** *** **** **** ***** ** ******* ****** *** *** ****** ** *** ** *********** Very unprofessional doctor, would not recommend her to anyone. ",2020-02-29 06:21:00,False,False,Verified Patient,,,
None,None,0,0,NO,I Had visited her for pregnancy checkup. Inspite of knowing my previous history of miscarriage she took my case very casually. Unfortunately I had suffered miscarriage again and she did DNC two times. As she has not done it properly for the first time due to which I had suffered infection and fever. I will not recommended to anyone with any complications history or infect to any treatment. ,2020-03-11 11:10:41,False,False,Verified Patient,,,
"Doctor friendliness,Explanation of the health issue,Treatment satisfaction,Value for money,Wait time,","Labor and Delivery,",0,0,YES,She is god for me because in last moment she save my life with normal delivery. She is really very friendly and experience doctor thank u so much doctor,2018-05-24 14:07:16,False,True,Verified Patient,,,
"Doctor friendliness,Explanation of the health issue,Treatment satisfaction,Value for money,Wait time,","Gynaecological Problem,",0,0,YES,Dr. Jasbir is one of the few experienced doctors in the country her patience to diagnose is at par with leading doctors across the country especially in her field. she is an excellent person who treats patients with a friendly approach .,2018-04-27 08:30:14,False,True,Verified Patient,,,
