tags,context,found_helpful_data-review_yes_count,found_helpful_data-review_total_count,recommendation,review,reviewed_on,is_online_consult,recommends,patient_name,reply_text,replied_at,replier_name
,"Female Sexual Problems,",0,0,YES,Doctor is very helpful and kind. Truly tries to understand your issue in detail. Staff at clinic is average.,2023-12-19 19:20:36,False,True,Shourya Lamba,,,
,,0,0,YES,"It was my first visit to the clinic …!!
I had my abdominal muscular pain …..
Doctor was too friendly and soft spoken ,gave me a good suggestion and explained detailly about my issue and I highly recommend the doctor ….!!!!

",2023-09-28 14:53:43,False,True,Harshithaa,,,
,"Abortion / Medical Termination of Pregnancy (MTP),",0,0,YES,"Dr Manisha was very understanding and friendly, explained all the procedure in details. Staff in hospital was also very supportive and caring.",2023-04-14 11:03:20,False,True,Sachinkumar,,,
,"Vaginal Infection Treatment,",0,0,YES,"Doctor was very nice, I got one time solution of all my veginal related issues
I have gone to so many 
knowledge gyanes but this has been my best experience ever.without any hesitation i shared my all consents with her, she is very friendly with cute smiling face, I would like to suggest the same doctor to all with my knowing ladies as much I can
",2023-09-26 16:17:21,False,True,Verified Patient,,,
,"Gynae Problems,",0,0,YES,Firstly she is on time as appointment are scheduled.. She was very friendly and never give you vibe that she don't know you.. She is really really good 👍,2022-01-25 09:25:14,False,True,Ujjwal,"Thank you for your feedback.
You can add patient story if possible.
Hope to see you again.",2022-01-25T14:11:47+0000,Dr. Manisha Gupta
,"Vaginal Infection Treatment,",0,0,YES,"I was anxious at time of visit due to my problem but the doctor calmed me
She is on time most of the times if there is any change they mention it prior

affordable m medicine and charges 
ofcourse effective treatment 
Overall I will recommond this doctor ",2023-03-27 06:12:09,False,True,Verified Patient,,,
