tags,context,found_helpful_data-review_yes_count,found_helpful_data-review_total_count,recommendation,review,reviewed_on,is_online_consult,recommends,patient_name,reply_text,replied_at,replier_name
,,0,0,YES,I am really grateful to dr Soumya.  i am glad that i delivered my baby under her medical care. she's amazing. i could tell that one can be confident that all will go well under her care. She was very caring and concerning throughout my pregnancy term. Even though she has to see many patients she listened to me even to my silliest concerns and always have given satisfying explanations. She always did the routine check ups very seriously and she would ensure that all would go good.She would not take even the slightest chance.She is very advanced .She is positive and friendly. ,2020-09-07 20:57:13,False,True,pragyan,,,
,,0,0,YES,"Dr.Sowmya Raghavan was great. Ma'am was very cordial and friendly throughout our 9 months of pregnancy. She was very thorough in all the procedures and it was a pleasure to have her deliver our baby Boy. We are grateful for the seamless procedures, making them very comfortable and convenient.",2023-06-20 12:12:52,False,True,SANJANA SAJEEV,,,
,,0,0,YES,"Even we reached in last month of delivery, Dr Sowmya madam took almost caring on us and when ever we called madam response was awesome, even though she was busy with multiple cases.Thanks alot.",2022-04-02 23:46:12,False,True,Gowtham Reddy,,,
,,0,0,YES,I am extremely thankful to Dr Sowmya raghavan. I had laproscopic Myomectomy. Doctor was very kind and helpful. My recovery was also good. ,2020-11-06 08:55:47,False,True,Sai Krithi,,,
,"Pre and Post Delivery Care,",0,0,YES,"Positive and kind, supportive and was able to answer all questions. Very patient and calm gesture…..",2022-06-20 10:36:25,False,True,Dhivya Lakshmi,,,
,,0,0,YES,"Very polite & patient listener. 29 years Experienced person ,guiding as correctly how to proceed with the next step.
",2023-06-05 05:12:50,False,True,Verified Patient,,,
