tags,context,found_helpful_data-review_yes_count,found_helpful_data-review_total_count,recommendation,review,reviewed_on,is_online_consult,recommends,patient_name,reply_text,replied_at,replier_name
None,None,0,0,YES,"Mathangi mam has been an pillar of support through out my pregnancy. she guided me right from day 1 for a normal delivery from weight reduction, control on gestational diabetes to proper regular monthly checkpoints. I had a normal delivery done by mam and I'm really so happy with her dedication and care shown on me and my baby. I highly recommend mam to all the mom to be's as she is super friendly , listens to all our problems and guides us throughout the journey to make it a happy and safe one..thank you mam 😊",2023-06-06 17:06:51,False,True,Pavithra,,,
None,None,0,0,YES,"**** ****** *** ****** *** *** ****** **** ** ********** ** i have pcod and am overweight. i was longing to be mom. i have visited many hospitals and doctors none explained me propery about pcod,pregnancy positive,weight reduction,intercourse dates.  none listened my problems calmly cz they are in rush to treat other patients. but mam listen your queries,problems and reply u and u ll understand it. u ll feel comfort and relax. with her hope u ll get all your energy to fight wit your issues and u ll really feel you ll b soon mom. womans who are all waiting for pregnancy waiting for right doctor visit mathangi mam. ",2020-06-26 13:33:30,False,True,Vasupradha Karthick,,,
"Doctor friendliness,Explanation of the health issue,Treatment satisfaction,Value for money,Wait time,","Gynae advice,",0,0,YES,"I am a person who is always nervous about visiting doctors. But when I was in desperate need for gynec advice, i got to know about her through Practo. Her friendliness and genuine care has made me more confident about taking my health in my hands. She is very reassuring and non-judgemental..something every woman will want in her gynecologist! Her professional attitude is very inspiring. I would recommend you to visit her and then you'll know what I mean!",2018-09-28 16:28:04,False,True,Iyshwarya,,,
None,None,0,0,YES,I am very blessed to have both my girls delivered normally by mathangi mam. She is a very dedicated doctor.***** ****** * *** *******,2021-12-07 14:28:35,False,True,Yazhini,,,
"Doctor friendliness,","Pregnancy Check Up,",0,0,YES,Dr. Mathangi was patient and heard me nicely. She nicely guided me about the coming days of pregnancy and explained clearly about the scans.,2019-04-30 07:52:58,False,True,Ditya,,,
"Doctor friendliness,Explanation of the health issue,Treatment satisfaction,","Gynae Problems,",0,0,YES,good doctor. Clear in thoughts and systematic assessment. friendly and easy to approach. my gynec issue which needed surgery got better with medical management alone. thanks,2018-06-30 02:52:57,False,True,Krithika,,,
"Doctor friendliness,Explanation of the health issue,Treatment satisfaction,","Gynaecological Problem,",0,0,YES,I am so glad to recommend Dr.Mathangi. She is extremely good as a doctor as well as a person... she really cares about the patients and their health. She is friendly and having so much patience to listen to the patients' queries.,2018-07-22 12:02:27,False,True,Verified Patient,,,
