tags,context,found_helpful_data-review_yes_count,found_helpful_data-review_total_count,recommendation,review,reviewed_on,is_online_consult,recommends,patient_name,reply_text,replied_at,replier_name
,,0,0,Yes,"I had visited the hospital and met the doctor for a gynae issue. Consultation was good with the doctor. I would like to recommend this doctor to my family and friends. Medicine was prescribed by doctor during consultation. Medical tests were done. There was more waiting time in the hospital, I waited for 30-35 minutes.",2021-04-23 06:06:15,False,True,AMIRTHAVALLI RAMESH,,,
,,0,0,YES,"It’s been a month since i delivered a baby boy. Dr. Mani Priya has been extremely patient throughout my pregnancy with all my check ups and scans . She made sure I was made very comfortable and explained everything. Most importantly, she sat through my delivery process so patiently and made sure I had a normal n safe delivery. She kept in touch post delivery to make sure i was recovering well. Thank you doctor for all the help you have provided us. Much recommended gynaecologist doctor. ",2020-02-15 12:27:55,False,True,Anjali Babu ,,,
"Doctor friendliness,","Irregular Periods,",0,0,YES,"Supportive and friendly to talk with. Even after booking practo appointment wait time was 2 hour. No point of booking with practo, doesnt help.",2020-02-10 18:53:18,False,True,Meenal Kamalakar,,,
"Doctor friendliness,","In-Vitro Fertilization (IVF),",0,0,YES,"
Good experience and good  guidance


And same while need to bring online appointment system
Hospital ventilation and  scan facility to improve more
",2021-11-06 07:29:15,False,True,Verified Patient,,,
