tags,context,found_helpful_data-review_yes_count,found_helpful_data-review_total_count,recommendation,review,reviewed_on,is_online_consult,recommends,patient_name,reply_text,replied_at,replier_name
"Doctor friendliness,Explanation of the health issue,Treatment satisfaction,Value for money,Wait time,","Ovarian Cyst Removal,",0,0,YES,"********* ********** Not money minded. Prescribes only which is needed.
I undergone Lap.surgery for removing right ovarian cyst  now I am well and healthy no issues.
Thank you ",2017-07-25 13:10:04,False,True,Lavanya,,,
"Doctor friendliness,Explanation of the health issue,Treatment satisfaction,Value for money,","Pregnancy Check Up,",0,0,YES,She is very friendly *** *** **** ************* So many complications came during my pregnancy but Mam handled everything 😍.,2017-12-21 15:18:32,False,True,Shweta,,,
None,"Breast Examination,",0,0,NO,There was no communication about the problem. She wasn’t exactly willing to listen to the problem. It was just hurried.,2024-08-02 13:14:45,False,False,Verified Patient,,,
None,None,0,0,NO,"As a CGHS beneficiary I took my 85 year old mother to this doctor at Billroth  She suggested for mammography
Once the result came,  the doctor refused to treat on CGHS rates.  *** *** ** ***** *** ************ ** *** *********** **** **** *** **** ********** ******** ******* **** ***** *** *** **** ******
After this incident I stopped seeing Smt.Lakshmi Devarajan.  ****** *** *** ** * **** *******  *** *** ******** *** ******** ******* *** ******* ** ** ********.
I suggest CGHS beneficiaries not to go to BILLROTH hospital and especially not to consult Dr.Lakshmi Devarajan.
*** ****** * *******  ********* ****** **** * ****** *********  *** ***** ***** ** **** **********",2023-07-13 07:55:03,False,False,b s rajanikanth,,,
None,"Pregnancy,",0,0,YES,"She is good decision maker when patient in critical. 
She is caring about the patient.


 









",2018-01-06 08:43:20,False,True,Jayaraman S,,,
