tags,context,found_helpful_data-review_yes_count,found_helpful_data-review_total_count,recommendation,review,reviewed_on,is_online_consult,recommends,patient_name,reply_text,replied_at,replier_name
"Doctor friendliness,Explanation of the health issue,Treatment satisfaction,","Pre and Post Delivery Care,",0,0,YES,"We are glad  to get to know about Dr. Madhavi Reddy, a caring doctor. We got to know about the doctor through multiple positive reviews online & offline and decided to  consult her in Motherhood hospital. Doctor explains the health issues very clearly in layman's terms. Also We appreciate doctor who encouraged for normal delivery  and with her experience n suggestion we had a normal delivery.

Best of all is that no matter if she had a hectic day during these COVID days at hospital, she will have a smile on her face and make you feel you are the most important person to her; that your problems have a solution that you yourself did not see. She is friendly & approchable and listens to patients' queries and answers clearly. She explains the condition and treatment for better understanding. She clarifies any doubts over calls/messages and encourages online consultation based on the situation, which saves a lot of time.

Thank you so so much Dr. Madhavi Reddy for making us feel like our decisions are valid and thank you Motherhood hospital for best in class services and care you provided inspite of COVID situations.",2021-07-31 06:42:31,False,True,Mrs KAVERI BABU ,,,
"Doctor friendliness,Treatment satisfaction,Value for money,","Normal Vaginal Delivery (NVD),Labor and Delivery,",0,0,YES,"I should definitely write a review about my experience with Motherhood hospital and Madhavi doctor
I chose Motherhood hospital mainly after seeing reviews about Madhavi Reddy doctor and her normal delivery Cases. Those reviews are very genuine and true. She guided me very well since my 5th month pregnancy and my 9 months journey was very good with her. Doctor is available over phone and WhatsApp for any kind of queries and support which helped me so much. I had few issues and My baby’s weight was less even She did not give any kind of unnecessary medicines through out my pregnancy. Just doctor asked me to take proper food intake. I followed all her instructions. 
Finally I am very much happy and satisfied with my delivery. I did not get natural pains and I am induced for labour. After getting admitted labour room staff supported me well and gave me courage. My normal delivery would not have been possible without doctor and staff support.

As Madhavi doctor said normal delivery can be done, it has been done with all staff support and doctor support. I could able to recover within 2 days. I am so happy.
I will definitely recommend Motherhood hospital and Madhavi doctor due to its transparency and the way normal delivery Is handled with much supporting and caring staff. 
I am very thankful to Madhavi mam. I will definitely consult you even for my second pregnancy.😊",2021-07-12 15:59:11,False,True,Sindhuja,,,
"Doctor friendliness,Explanation of the health issue,Treatment satisfaction,Value for money,","High-Risk Pregnancy Care,",0,0,YES,"As a first time mom, when I found out I was pregnant, i was really anxious. But when I met Dr Madhavi Reddy, I relaxed. She was friendly, approachable and I felt like I was in safe hands. My pregnancy had risks. Initially my scan revealed a hemorrhage. Dr Reddy immediately put me on bed rest. As my pregnancy continued, my scans revealed that I had a short cervix which means there was a very high chance of a pre-term birth. Needless to say, I was really worried. Dr Reddy gently explained the risks to me,, opted to perform the cervical cerlage and put me on complete bedrest until the end of pregnancy. Throughout my 9 months, whenever I needed her, she was always available on her phone. I texted her for smallest of things but she was attentive to my needs.
Finally when I entered the 36th week, she removed by stitch and advised me to get induced and deliver. My delivery was smooth. Nurses and doctors made me feel very comfortable. Dr Reddy helped me deliver my son safely and I can't thank her enough. She is highly recommended.",2020-12-24 06:53:36,False,True,Ankita Mishra,,,
"Doctor friendliness,Explanation of the health issue,Treatment satisfaction,Value for money,Wait time,","Normal Vaginal Delivery (NVD),",0,0,YES,"Really dont know from where to start, since i had a problem in my previous pregnancy i was very much confused where to go and whom to meet for this pregnancy, then finally my cousin suggested Dr Madhavi Reddy. i went to Dr Madhavi Reddy at 14 weeks of pregnancy with a bleeding issue and pregnancy diabetes, she explained me clearly about the problem and the solution for that. She promised me that she will help me to deliver a healthy baby without complications this time and I blindly followed all her instructions and suggestions and delivered a healthy boy baby on 27 May 2020. The best quality in her is her patience and practical thinking. People dont believe she always responds to patients either in call or WhatsApp. I personally contacted her many times even at 11 pm she responded me. Such a dedicated doctor i never seen till now. Next time also we will go to Dr Madhavi Reddy. I strongly recommend Dr Madhavi Reddy for safe and healthy delivery and she's expert in handling minor and major complications during pregnancy and doing normal deliveries except in very very very least cases considering the health of mother and baby. Overall its a very good experience with Dr Madhavi Reddy during my whole pregnancy and finally she's the one who helped me to become a healthy mom to a healthy and cute baby. ",2020-06-23 05:27:24,False,True,Manju Bhargavi,,,
"Explanation of the health issue,Doctor friendliness,Treatment satisfaction,Value for money,","Abortion / Medical Termination of Pregnancy (MTP),Pregnancy,",0,0,NO,"I was 6 weeks pregnant and had swelling on my jawline. Initially, we thought maybe it's a dental issue. But with the help of gynecologist, Madhavi Reddy we came to know they are mumps. She advised going for abortion as it may affect child growth. We did the same. 
When we visited the gynecologist for the second round of abortion pills. I was bleeding heavily and was very fatigued. I told her the same. She notified that it is normal as part of this process. When asked about the amount of bleeding and uterus pain, she just told us the bleeding will happen and there will be uterus pain for 1-2 weeks. 
I feel that a doctor should guide the patient thoroughly on the overall process and anything which should be a concern in the process **** ******** ****** ** *********
In the whole process, I lost a lot of blood. When we called customer care Motherhood, she did not even bother to have a talk with us and asked to get an appointment. 
Eventually, my hemoglobin went down to 4.5, pulse was 142. I got in a very critical condition and was brought to ******* hospital in an emergency, transfused 4 bottles of blood, underwent suction d&e procedure. I was admitted there for 4 days.
Never, will I ever refer any of my friends/family to this hospital and especially to Madhavi Reddy.",2020-04-02 11:38:17,False,False,Priyanka Bhakuni,,,
"Doctor friendliness,Explanation of the health issue,Treatment satisfaction,Value for money,Wait time,","Pregnancy Check Up,",0,0,YES,"I always looked forward to meet the doctor for regular check-ups. When I was diagnosed with dengue and typhoid during my 7th month of pregnancy, I thought I would not survive. But Dr. Madhavi Reddy was so caring and concerned, it's her early diagnosis and expertise made me recover within 3 days. It was such a comfort to see her and talk to her during such illness.

She never suggested for unnecessary scans or blood tests, or any other unnecessary expenses usually other private hospital and doctors do. Only necessary scans and blood tests were performed during the pregnancy period.

During the delivery of the baby, she was there through out and took care of each and every concern of us and helped in going through the pain. She made sure I was comfortable at every stage and considered our opinion and explained and shared her suggestions.

I can never thank her enough for the care and concern she showed for the last 9 months, she literally took care of me like a mother would. Thank you Doctor for everything.",2019-11-21 05:38:06,False,True,Prathima G.S,,,
"Doctor friendliness,Explanation of the health issue,Treatment satisfaction,Wait time,","Pregnancy Check Up,",0,0,YES,"I had consulted Dr. Madhavi Reddy from the time my initial month pregnancy till i get delivered. She is highly skilled, very knowledgeable, in one word She is just BRILLIANT.

During my regular checkups we felt that we are in a right place and with right doctor. Whenever I had any concerns Dr Madhavi Reddy always very much helpful, also the way she clarified our doubts was very simple and understandable. She motivated me for normal delivery from starting and accordingly she suggested exercise and diet.

On the day of delivery, I went through long hours of pain and since I was not able to bear the pain I was demanding for C-section but it was Dr. Madhavi who motivated me and gave me courage and I had normal delivery. It is really rare to see any doctor waiting for such a long duration for patient  for a normal delivery. I am sure if I would had visited any other doctor, definitely they it wont be a normal delivery.

I strongly recommend Dr Madhavi Reddy to other patients. She is full of positivity.

I wish you all the luck for all your endeavors.

Arpita and Nishant",2019-10-14 08:00:45,False,True,Arpita Verma,,,
"Doctor friendliness,Explanation of the health issue,Treatment satisfaction,Value for money,Wait time,","Pregnancy Check Up,",0,0,YES,"Myself and my wife met Dr. Madhavi reddy on 3rd month of my wife’s pregnancy and in the first consultation itself we felt very comfortable and from then onwards each time when we met her for regular checkups we felt that we are in a right place and with right doctor. Whenever we had any concerns related to health for my wife, Dr Madhavi reddy always very much helpful, also the way she clarified our doubts was very simple and understandable.  During the last week of my wife’s trimester, she encouraged for normal delivery (which she was encouraging us from the day one of our consultating) with few important tips, along with pregnancy excesise (which she had suggested my wife to attend).
On the day of delivery Dr. Madhavi reddy was continuously monitoring about the vitals and until my wife’s delivery she was with her throughout the process encouraging supporting for normal delivery and finally we were blessed with baby girl without C-session and with help of doctor my wife is healthy now. Thank you Doctor for being so much more than we ever thought,  we could find in a doctor like you! You’re an amazing person and you’ve made such a difference in our life and we will be forever grateful to you!! God bless!  
Last but not least, She is very friendly and always greets us with a smile. She listens to all our concerns very patiently and suggests proper course of action.

Thanks once again!
Harish and Nirmala",2019-09-17 06:37:33,False,True,J. Harish Prabhu,,,
"Doctor friendliness,Explanation of the health issue,Treatment satisfaction,Value for money,Wait time,","Pregnancy,",0,0,YES,"We met Dr Madhavi Reddy the day after the stick showed 2 lines to confirm pregnancy. From that time onward, it has been a wonderful experience with the Doctor. She is very friendly and always greets us with a smile. She listens to all our concerns very patiently and suggests proper course of action. 
She is highly skilled, very knowledgeable and highly respected among her peers and colleagues in Motherhood Hospital. 
The best part was her friendly and understanding nature. Throughout the 9 months of my wife's pregnancy, we never felt like we were visiting a hospital. It was more of a friendly visit which also happens to be a check up. The thing that we liked very much was that, in our case, she did not scare us even once. Even when some of the scan results were out of the normal range, she motivated us and suggested what needed to be done and we were able to see the improvement in results immediately. 

From all the check ups to scans to coming early in the morning to be there for her delivery, she was a source of strength to us. Even after the delivery, she let my wife be herself without imposing too many restrictions and took really good care of her. 

In short, we had a wonderful experience with Dr Madhavi Reddy and my wife Dhivya and I highly recommend the Doctor. 

P.S: She is never late in coming to the hospital. There has never been even one single instance where we had to wait because the Doctor did not come on time. 

Thanks, 
Dhivya and Karthick",2019-08-12 16:34:16,False,True,Karthick Sekar,,,
"Doctor friendliness,Explanation of the health issue,Treatment satisfaction,Wait time,","Caesarean Section (C Section),",0,0,YES,"Hello Mothers & to be Mother's,

It took me a while to find a doctor that made me feel comfortable and I am very happy that I found Dr.Madhavi Reddy at Motherhood HRBR Layout.
I visited Doctor during my 8.5months Pregnant and that was my first visit with the Doctor (prev consulting other Hospital), She made me feel very comfortable, friendly. also she is lovely to speak with at every appointment.
Dr ensured I had a smooth prep, Baby Delivery (C-Sec), and follow-up. I am so glad I chose Dr.Madhavi Reddy and would highly recommend to anyone.
It’s rare to find a doctor that combines such personal touches and care for a patient as a person.",2024-03-25 12:41:37,False,True,Verified Patient,,,
"Doctor friendliness,Explanation of the health issue,Treatment satisfaction,Value for money,","Pregnancy,",0,0,YES,"I am so happy with the care we got here from start to finish from every department of Motherhood Hospital including medical & non medical staff.We met Dr Madhavi Reddy for our consultation. Dr was so helpful and informative and was able to answer any questions we had & even over the phone at emergencies.I would like to thank you so much Dr Madhavi Reddy from the bottom of our hearts for taking such good care of us during the pregnancy as well as the delivery!! Because of your professionalism and always great smiles, we felt like we were in good hands and that gave us peace of mind towards the big day. Thank you for helping deliver the most precious gift of our life!!”At initial stage of pregnancy we have asked whether normal delivery is possible rather than cesarean & Dr promised normal delivery happen only if we follow every instruction of her. We had followed every instruction & finally it was normal delivery.When my wife was at labour, I didn't had hopes of normal delivery looking at her situation & asked Dr it's taking too long so can we look alternative. Dr Madhavi Reddy just smiled at me & told let her as well me to rest for 1 hr so that everything will be alright. Within 40 min i was asked to be at labour ward & Dr told me she ready delivery. Within next 40 mins baby was delivered. Both mother & baby was healthy. Mother was back to normal within few hours. I would like to thank you Dr Madhavi Reddy for all your guidance & support.Also need to Thank Rama mam, Dr Sireesha (scanning) all the staff from scanning team, Anesthesia Surgeon, Nursing Staff, House keeping staff, Admin Team, Security Guards & all non medical staff of hospital for supporting us.I have heard from many staff at hospital that Dr Madhavi Reddy always push for normal than ceserean & her maximum patients had normal deliveries.I strongly recommend Dr Madhavi Reddy consultation at Motherhood Hospital HRBR Layout Bengaluru.",2023-07-03 09:32:31,False,True,Verified Patient,,,
"Doctor friendliness,Explanation of the health issue,Treatment satisfaction,","Normal Vaginal Delivery (NVD),Pregnancy Check Up,",0,0,YES,"I consulted Dr.Madhavi Reddy on my 38th week of pregnancy as my consulting doctor was not available for next 3 weeks. We were given few options,we choose Madhavi Reddy among them,that was the best decision ever made.It is always a stress in mind when such things happen, but just by first visit we were convinced she is the right doctor for us. 

She is very patient,calm and friendly. She gave her contact number in case of emergency (which I had not got from my previous doctor). In 3 days after visiting her,I got my labor pain and I contacted her through Watsapp n call , she responded even at night 11.30. After visiting the hospital my contractions were not strong enough.She suggested to go back home n come back when pain frequency increases or water breaks or I can't tolerate pain. 

Next day my pain increased, I got admitted at afternoon. She visited me immediately. I had 2 fibroids and amiontic fluid levels were quite high. Other doctors I consulted had told, with fibroids it would be difficult for normal delivery. She never scared me or told such things. 

For next 10 hours she kept on visiting every one hour or two. Sometimes she was asking the duty doctors to send a video of the NST. This was when my baby's heartbeat started showing low after giving oxytocin.At this stage other doctors would have gone for c - section. But she stopped oxytocin and gave me oxygen mask n tried if that showed any improvement. Yes it did. 

Even after that my cervix was not diluted enough and the baby was still in -3 position. It would have needed another 8 hours of labour. She was ready to wait for such a long duration. Luckily when she came at 10pm , cervix was diluted enough and baby was in the right position for delivery. Within half n hour the baby was delivered normally.

She tries 100% for normal delivery. I strongly recommend her.she is very friendly and open to all our doubts.

God bless you and your family.

",2019-10-22 01:54:44,False,True,Verified Patient,,,
"Doctor friendliness,Explanation of the health issue,Treatment satisfaction,Value for money,Wait time,","Labor and Delivery,",0,0,YES,"I started my consultation with Dr.Madhavi Reddy from my 4th month after coming from Dubai for delivery.She started with a detailed examination of my health condition and started treating me with immense care.Dr Madhavi Reddy ** ****** ************* *** goes through minute details.She is always available over messages to clarify any doubts.I would highly recommend Dr madhavi reddy for a incredible experience of pregnancy.She is affable and approachable.
Lastly the staff, services and facilities in the hospital are very good.My overall experience was excellent.",2023-09-23 11:36:50,False,True,sirisha korlakunta,,,
"Doctor friendliness,Explanation of the health issue,Treatment satisfaction,Value for money,","Normal Vaginal Delivery (NVD),Pregnancy Check Up,",0,0,YES,"Dr.Madhavi Reddy is a wonderful person! She has treated me so well. She listens to the problems very patiently and treat.  Her way of dealing with us/patients is what we are happy about. The best part is she remembers the case history and gives the best treatment. Everytime we meet Dr.Madhavi, she asks about our well being, which is quite uncommon for doctors to ask. This shows her warm and welcoming nature. Thank you from bottom of our hearts for taking such good care of us throughout the pregnancy and delivery❤️
Because of your professionalism and great smiles, we felt we were in good hands and that gave us peace of mind towards the big day. Much appreciated and love!😊",2023-08-09 20:08:51,False,True,Vimla Sharma ,,,
"Doctor friendliness,Treatment satisfaction,Explanation of the health issue,","Maternal Care/ Checkup,",0,0,YES,"We had consulted doctor Madhavi reddy for pregnancy, after 8 years of marriage we conceived again in 2022 after having  miscarriage 2 yrs ago.. She was very friendly and she had looked all our history records and taken care of all the possibilities that might cause miscarriage again by taking second opinion from immunogist doctors and gave the medicines on time to time basis. We are now blessed with baby girl baby  a week ago with normal delivery  and she is doing great..Thank you so much doctor for being positive and supportive throughout this journey and making it fruitful. I would strongly recommend every one to consult Dr Madhavi Reddy for any pregnancy related. ",2023-08-01 12:48:57,False,True,Vijaya lakshmi A,,,
"Doctor friendliness,Explanation of the health issue,Treatment satisfaction,Value for money,","Pregnancy Check Up,",0,0,YES,"I Visited Dr Madhavi Reddy after my friend reference, the day one of my pregnancy to day after pregnancy same feeling Very cool, calm, patience, knowledgeable, careable, smiley, professional and very much dedicated to patients 

Always Keenly listen to patient and Always accessible even shared her personal number in case of emergency.

Never cancelled single appointment.

I personally highly recommend Dr Madhavi Reddy madam in all type of normal and complicated pregnancy if any.

Very much satisfied with the doctor.

Thank you so much madam you brought smile on our entire family.

Thanks for making pregnancy journey as very special and wonderful experience.

Thanks,
Manasa S M",2023-07-29 07:44:07,False,True,Manasa S M,,,
"Doctor friendliness,Explanation of the health issue,Treatment satisfaction,","Maternal Care/ Checkup,",0,0,YES,"We consulted Dr Madhavi reddy for my pregnancy. We visited her post going through all the reviews. Our experience with her has been amazing and all the reviews about her are 100% true.
She has been very supportive, friendly & approachable. We were very concerned & nervous as it was first pregnancy but her positive aura and approach made the journey much easier.
Throughout delivery she was very supportive, positive and kept on encouraging. Blessed with a girl and boy both were doing good.*** ** *** **** we could have asked for this journey. I highly recommend her to all the to-be moms.",2023-03-19 10:22:29,False,True,rajeswari boya,,,
"Doctor friendliness,Explanation of the health issue,Treatment satisfaction,Value for money,Wait time,","Pregnancy,",0,0,YES,"I would like to share my recent experience with Dr. Madhavi Reddy in Motherhood Hospital - HRBR Layout. Initially I was little nervous and worried in case if anything goes wrong during the nine months pregnancy journey. But with the doctor constant guidance and support, it all became easy and possible. I was amazed to see the hand holding done by the doctor and entire hospital staff to make sure both baby and mother are given the best possible treatment. I would like to specifically highlight the point when my wife blood platelets dropped abruptly during the last month and then doctor took the full responsibility of arranging platelets in almost no time and with the great services provided by the hospital it was all done without any hazzle. My wife delivered normally with no issues at all. This is the maximum anyone can expect from a doctor and a hospital. I would strongly recommend Dr Madhavi Reddy in Motherhood Hospital for a memorable start of the parenthood experience.",2023-03-01 15:50:23,False,True,Yateendra Kumar,,,
"Doctor friendliness,Explanation of the health issue,Treatment satisfaction,Wait time,","Pregnancy,",0,0,YES,"I am delighted to share my positive experience with Dr. Madhavi Reddy during my pregnancy. From the very first appointment, She made me feel comfortable and confident in her abilities. She was thorough in her explanations and answered all my questions with patience and clarity.

Throughout my pregnancy, She was attentive and supportive. She made sure that I had access to all of the necessary tests and screenings, and she closely monitored the health of both myself and my growing baby.

In addition to her medical expertise, Dr. Madhavi Reddy also demonstrated genuine care and concern for my well-being. She took the time to listen to my concerns and was always available to offer advice or support.

Overall, I would highly recommend Dr. Madhavi Reddy to anyone seeking a skilled and compassionate doctor for their pregnancy. She truly goes above and beyond to provide exceptional care, and I am so grateful for all that she did for me and my baby. Thanks ",2023-03-01 10:08:44,False,True,Siva Parvati ,,,
"Doctor friendliness,Explanation of the health issue,Treatment satisfaction,","Pregnancy,Pregnant,",0,0,YES,"During my pregnancy, I had very good and positive experience with Dr. Madhavi Mam. As I was told by some other doctor i have rudimentary horn and given unnecessary tablets and injection by another, I visited Madhavi Mam for second opinion. Dr. Madhavi suggested to discontinue all the injections and gave us confidence by her positive words, we decided to continue visiting her throughout my pregnancy since she explained everything clearly and did not scare us unnecessarily even though I had some small complications.  She always encourages for normal delivery and made double sure that the baby is good and healthy through out the process. she is always available and clears any doubts through whatsapp/messages. ",2023-02-17 10:54:26,False,True,Harshini,,,
