tags,context,found_helpful_data-review_yes_count,found_helpful_data-review_total_count,recommendation,review,reviewed_on,is_online_consult,recommends,patient_name,reply_text,replied_at,replier_name
None,"Pregnancy Check Up,Pregnant Women Counseling,Pregnant,",0,0,YES,Doctor Indira c reddy is very calm and experienced dr. . I think i made right choice by consulting her. . she clears our doubts very easily. . she explains each and everything very well whats going on with our body in very good way. . She will recheck with us for tests or anything. .  before consulting her visited 2 doctors had very bad experience but with her found the right personal touch. .she is v.friendly..got satisfied by her care n concern.. I will recommend her to everyone ,2017-05-23 18:28:25,False,True,Mrs.JYOTHI V JAIN,,,
None,"Pregnant,",0,0,YES,"Me and my wife are parents to a healthy beautiful boy because of Dr. Indira Reddy. She is very experienced *** *** ** *** **** ************* ** ********** My wife's pregnancy was not the easiest. Despite being busy, Dr. Indira makes time to listen and explain. We had bad experience with other renowned doctors who have packed schedules and don't spend time for patients except for the allocated 10 minutes. But my wife got good care under Dr. Indira and her team. 

Thanks Doctor.",2017-05-22 09:25:13,False,True,Sumit Gupta,,,
None,None,0,0,NO,"*** ** *** ******* ******* *** ** ******* ************** She has assistant who check all, and due to increase in covid cases her assistant will be in hospital Dr. Indra reddy will come to hospital only for in patients. OPD She is not handling.

I don't recommend her to anyone in this situation.",2021-05-08 08:57:53,False,False,Verified Patient,,,
"Explanation of the health issue,Treatment satisfaction,Value for money,Wait time,","PCOS,",0,0,NO,"Doctor was not listening at all, was in some kind of hurry. *** *** *** ****** ** ********** *** ******* *** said she will deal with it in second session. Not at all satisfied with the doctor's behavior.",2020-04-10 06:22:43,False,False,Verified Patient,,,
None,None,0,0,YES,"I had both my sons delivered at Sagar hospital by Dr. Indira Reddy. *** ** ** ********* ******* I would recommend her 100%She listens and answers all your doubts and is very calm, ever smiling and calm. ",2020-05-21 07:11:33,False,True,Benno Queenie,,,
None,None,0,0,YES,"She helped delivery my baby in my mid thirties. Have had the best experience with Dr. Indira C Reddy. Very patient and takes time to explain everything.
During labor she was like a god send encouraging and motivating me which enabled me to have a smooth delivery. Will always be grateful for having met her.
I would highly recommend Dr Reddy.",2023-09-08 04:20:26,False,True,Verified Patient,,,
None,None,0,0,YES,*** **** ****** **** ****** Very kind patient and motherly . I definitely recommend her. She helped me deliver a healthy baby boy inspite of complications during pregnancy.,2020-06-12 17:29:19,False,True,Verified Patient,,,
"Doctor friendliness,Explanation of the health issue,Treatment satisfaction,","Pregnancy Check Up,",0,0,YES,"VERY CALM AND POLITE ...  DOCTOR WILL LISTEN TO ALL YOUR CONCERNS VERY CAREFULLY.

HIGHLY RECOMMENDED. ",2019-08-18 04:39:26,False,True,Verified Patient,,,
"Doctor friendliness,Explanation of the health issue,Treatment satisfaction,","Pregnancy Check Up,",0,0,YES,"
Dr Indira's experience and angel like nature is very much visible in each interaction.

She gave me the confidence and guidance  like a mother.",2019-04-29 10:13:12,False,True,Verified Patient,,,
