tags,context,found_helpful_data-review_yes_count,found_helpful_data-review_total_count,recommendation,review,reviewed_on,is_online_consult,recommends,patient_name,reply_text,replied_at,replier_name
,,0,0,NO,"*** ** *** ******* ******* *** ** ******* ************** She has assistant who check all, and due to increase in covid cases her assistant will be in hospital Dr. Indra reddy will come to hospital only for in patients. OPD She is not handling.

I don't recommend her to anyone in this situation.",2021-05-08 08:57:53,False,False,Verified Patient,,,
"Explanation of the health issue,Treatment satisfaction,Value for money,Wait time,","PCOS,",0,0,NO,"Doctor was not listening at all, was in some kind of hurry. *** *** *** ****** ** ********** *** ******* *** said she will deal with it in second session. Not at all satisfied with the doctor's behavior.",2020-04-10 06:22:43,False,False,Verified Patient,,,
,,0,0,YES,"I had both my sons delivered at Sagar hospital by Dr. Indira Reddy. *** ** ** ********* ******* I would recommend her 100%She listens and answers all your doubts and is very calm, ever smiling and calm. ",2020-05-21 07:11:33,False,True,Benno Queenie,,,
,,0,0,YES,"She helped delivery my baby in my mid thirties. Have had the best experience with Dr. Indira C Reddy. Very patient and takes time to explain everything.
During labor she was like a god send encouraging and motivating me which enabled me to have a smooth delivery. Will always be grateful for having met her.
I would highly recommend Dr Reddy.",2023-09-08 04:20:26,False,True,Verified Patient,,,
,,0,0,YES,*** **** ****** **** ****** Very kind patient and motherly . I definitely recommend her. She helped me deliver a healthy baby boy inspite of complications during pregnancy.,2020-06-12 17:29:19,False,True,Verified Patient,,,
