tags,context,found_helpful_data-review_yes_count,found_helpful_data-review_total_count,recommendation,review,reviewed_on,is_online_consult,recommends,patient_name,reply_text,replied_at,replier_name
"Doctor friendliness,Explanation of the health issue,Treatment satisfaction,Value for money,","People Skills,",0,0,YES,"He is fare about diagnoses very positive *** ************** 
Too much of writting does not mean hood content. Allow less words here. Regards Dr.Ahuja ",2020-10-08 01:15:14,False,True,TIMONI(DR.AHUJA),,,
,,0,0,YES,Dr Ganesh is so humble *** ********* ** ****.In my life I never seen endocrinologist with this type of humblebehaviour.,2021-12-20 16:05:37,False,True,Verified Patient,,,
"Doctor friendliness,Explanation of the health issue,Value for money,Wait time,","Thyroid Disease in Children,",0,0,YES,Very experienced doctor.. Explained everything properly.. Very happy with the treatment procedure... ,2020-12-23 13:34:17,False,True,Verified Patient,,,
,,0,0,YES,"****** *** **** ***** checked nicely , also had good behaviour and satisfied as the worth of money. ",2020-10-19 08:20:01,False,True,Verified Patient,,,
