tags,context,found_helpful_data-review_yes_count,found_helpful_data-review_total_count,recommendation,review,reviewed_on,is_online_consult,recommends,patient_name,reply_text,replied_at,replier_name
,,0,0,NO,"I DO NOT recommend this doc. * ****** ******* ****** *** *** ** * ****** ******* ********** Took my father for leg pain related to diabetes and stroke and when asked how to reverse diabetes or manage it in the best way, he was extremely discouraging and negative and said diabetes can no way be reversed inspite of my father saying he has immense willpower and is willing to do anything to improve his quality of life. The doctor said he is just being honest and ****** ** **** *** ********* **** need which was to get guidance for a healthy life that is beyond just medicines. 

Patients often need encouragement and advise on their lifestyles and are willing to listen only to professionals like doctors instead of their own family. ******* **** *** ******* **** **** ***** *********** ********* *** *** ********* ** ** ****** ** ********** *** ***** ******* I hope they realize they are dealing with a more educated generation now and we expect deep care and quality in their services. ",2023-06-13 11:22:53,False,False,Verified Patient,,,
,,0,0,NO,"I had a bad experience and i do not recommend him to anyone. He is not even ready to listen what the patient wants to speak, just suggesting end test *** ***** *****.
Instead of calming the patients he was shouting. ***** ************** *** rude behaviour.",2023-09-05 16:01:22,False,False,Verified Patient,,,
,"Vaccination/ Immunization,",0,0,NO,"Very un-friendly. ** *** ****** * ************ ** *** ******** **** **** **** 
Showed no openness or patience to listen to the health issue. He was suggesting symptoms that do not match the issue. The associate doctor in the room was better at grasping what was said. 
Will need to get a second opinion if you're going to him. 
Visited at Apollo hospitals, Bannerghatta. ",2022-12-26 09:26:15,False,False,Verified Patient,,,
