tags,context,found_helpful_data-review_yes_count,found_helpful_data-review_total_count,recommendation,review,reviewed_on,is_online_consult,recommends,patient_name,reply_text,replied_at,replier_name
None,None,0,0,YES,"I visited him for high fever, which he quickly diagnosed it as dengue and cured it... He is a very experienced and professional doctor. Highly recommended!",2020-10-19 12:36:49,False,True,Sneha kothari,,,
"Doctor friendliness,Explanation of the health issue,Treatment satisfaction,Value for money,Wait time,","High cholesterol,",0,0,YES,Superb doctor nicely explained about the health issues.his behaviour was good nice gentleman and good experienced doctor.,2020-09-03 07:18:26,False,True,Sridevi Kiran ,,,
"Doctor friendliness,Explanation of the health issue,Treatment satisfaction,Value for money,Wait time,","Fever,",0,0,YES,Had a really good experience with Dr.Sagar as it was my first time on Practo Video consultation service. Indeed he is an experienced & a very qualified Doctor. Thank you so much for your Online support. Big Shout out to Dr.Sagar & Practo for making a smooth experience while you can't be able to travel with high fever.. it was just a click away! Thanks again🙏🏻😊,2022-09-12 11:43:57,True,True,Verified Patient,,,
None,None,0,0,YES,"Doctor has been very professional and very helpful 
I have consulted him for Fever and I was paranoid about covid and he treated after the covid positive result and he followed up with me on regular basis and Iam absolutely fine now Iam very grateful to him.",2020-10-07 09:15:27,False,True,Verified Patient,,,
None,None,0,0,YES,"Dr sagar is very genuine and carries much information , I visited him for furnacle treatment and he gave me appropriate treatment for that moreover there was a guy named Raju Verma such a great attender and gives injection so smoothly...",2021-07-13 04:51:29,False,True,Verified Patient,,,
None,None,0,0,YES,"Excellent care and very very friendly
He understood very well about my problem and given the appropriate medicine for the same
My health is very good now and improving day by day
I am really thankful to Dr. Sagar ",2020-10-28 16:28:32,False,True,Verified Patient,,,
